title,keywords,group,link,pdf
Render for CNN- Viewpoint Estimation in Images Using CNNs Trained With Rendered 3D Model Views,,,https://openaccess.thecvf.com/content_iccv_2015/html/Su_Render_for_CNN_ICCV_2015_paper.html,
Lost Shopping! Monocular Localization in Large Indoor Spaces,,,https://openaccess.thecvf.com/content_iccv_2015/html/Wang_Lost_Shopping_Monocular_ICCV_2015_paper.html,
Camera Pose Voting for Large-Scale Image-Based Localization,,,https://openaccess.thecvf.com/content_iccv_2015/html/Zeisl_Camera_Pose_Voting_ICCV_2015_paper.html,
MANTRA- Minimum Maximum Latent Structural SVM for Image Classification and Ranking,,,https://openaccess.thecvf.com/content_iccv_2015/html/Durand_MANTRA_Minimum_Maximum_ICCV_2015_paper.html,
DeepDriving- Learning Affordance for Direct Perception in Autonomous Driving,,,https://openaccess.thecvf.com/content_iccv_2015/html/Chen_DeepDriving_Learning_Affordance_ICCV_2015_paper.html,
Active Transfer Learning With Zero-Shot Priors- Reusing Past Datasets for Future Tasks,,,https://openaccess.thecvf.com/content_iccv_2015/html/Gavves_Active_Transfer_Learning_ICCV_2015_paper.html,
HD-CNN- Hierarchical Deep Convolutional Neural Networks for Large Scale Visual Recognition,,,https://openaccess.thecvf.com/content_iccv_2015/html/Yan_HD-CNN_Hierarchical_Deep_ICCV_2015_paper.html,
Learning The Structure of Deep Convolutional Networks,,,https://openaccess.thecvf.com/content_iccv_2015/html/Feng_Learning_The_Structure_ICCV_2015_paper.html,
FlowNet- Learning Optical Flow With Convolutional Networks,,,https://openaccess.thecvf.com/content_iccv_2015/html/Dosovitskiy_FlowNet_Learning_Optical_ICCV_2015_paper.html,
Learning Semi-Supervised Representation Towards a Unified Optimization Framework for Semi-Supervised Learning,,,https://openaccess.thecvf.com/content_iccv_2015/html/Li_Learning_Semi-Supervised_Representation_ICCV_2015_paper.html,
Context-Guided Diffusion for Label Propagation on Graphs,,,https://openaccess.thecvf.com/content_iccv_2015/html/Kim_Context-Guided_Diffusion_for_ICCV_2015_paper.html,
Learning to Rank Based on Subsequences,,,https://openaccess.thecvf.com/content_iccv_2015/html/Fernando_Learning_to_Rank_ICCV_2015_paper.html,
Unsupervised Learning of Visual Representations Using Videos,,,https://openaccess.thecvf.com/content_iccv_2015/html/Wang_Unsupervised_Learning_of_ICCV_2015_paper.html,
A Nonparametric Bayesian Approach Toward Stacked Convolutional Independent Component Analysis,,,https://openaccess.thecvf.com/content_iccv_2015/html/Chatzis_A_Nonparametric_Bayesian_ICCV_2015_paper.html,
Robust Principal Component Analysis on Graphs,,,https://openaccess.thecvf.com/content_iccv_2015/html/Shahid_Robust_Principal_Component_ICCV_2015_paper.html,
Projection Bank- From High-Dimensional Data to Medium-Length Binary Codes,,,https://openaccess.thecvf.com/content_iccv_2015/html/Liu_Projection_Bank_From_ICCV_2015_paper.html,
Robust Optimization for Deep Regression,,,https://openaccess.thecvf.com/content_iccv_2015/html/Belagiannis_Robust_Optimization_for_ICCV_2015_paper.html,
Multi-Class Multi-Annotator Active Learning With Robust Gaussian Process for Visual Recognition,,,https://openaccess.thecvf.com/content_iccv_2015/html/Long_Multi-Class_Multi-Annotator_Active_ICCV_2015_paper.html,
Maximum-Margin Structured Learning With Deep Networks for 3D Human Pose Estimation,,,https://openaccess.thecvf.com/content_iccv_2015/html/Li_Maximum-Margin_Structured_Learning_ICCV_2015_paper.html,
An Exploration of Parameter Redundancy in Deep Networks With Circulant Projections,,,https://openaccess.thecvf.com/content_iccv_2015/html/Cheng_An_Exploration_of_ICCV_2015_paper.html,
Additive Nearest Neighbor Feature Maps,,,https://openaccess.thecvf.com/content_iccv_2015/html/Wang_Additive_Nearest_Neighbor_ICCV_2015_paper.html,
Understanding Deep Features With Computer-Generated Imagery,,,https://openaccess.thecvf.com/content_iccv_2015/html/Aubry_Understanding_Deep_Features_ICCV_2015_paper.html,
Interpolation on the Manifold of K Component GMMs,,,https://openaccess.thecvf.com/content_iccv_2015/html/Kim_Interpolation_on_the_ICCV_2015_paper.html,
Context-Aware CNNs for Person Head Detection,,,https://openaccess.thecvf.com/content_iccv_2015/html/Vu_Context-Aware_CNNs_for_ICCV_2015_paper.html,
Mode-Seeking on Hypergraphs for Robust Geometric Model Fitting,,,https://openaccess.thecvf.com/content_iccv_2015/html/Wang_Mode-Seeking_on_Hypergraphs_ICCV_2015_paper.html,
Highly-Expressive Spaces of Well-Behaved Transformations- Keeping It Simple,,,https://openaccess.thecvf.com/content_iccv_2015/html/Freifeld_Highly-Expressive_Spaces_of_ICCV_2015_paper.html,
Entropy-Based Latent Structured Output Prediction,,,https://openaccess.thecvf.com/content_iccv_2015/html/Bouchacourt_Entropy-Based_Latent_Structured_ICCV_2015_paper.html,
Fast Orthogonal Projection Based on Kronecker Product,,,https://openaccess.thecvf.com/content_iccv_2015/html/Zhang_Fast_Orthogonal_Projection_ICCV_2015_paper.html,
PoseNet- A Convolutional Network for Real-Time 6-DOF Camera Relocalization,,,https://openaccess.thecvf.com/content_iccv_2015/html/Kendall_PoseNet_A_Convolutional_ICCV_2015_paper.html,
Predicting Multiple Structured Visual Interpretations,,,https://openaccess.thecvf.com/content_iccv_2015/html/Dey_Predicting_Multiple_Structured_ICCV_2015_paper.html,
Look and Think Twice- Capturing Top-Down Visual Attention With Feedback Convolutional Neural Networks,,,https://openaccess.thecvf.com/content_iccv_2015/html/Cao_Look_and_Think_ICCV_2015_paper.html,
Matrix Backpropagation for Deep Networks With Structured Layers,,,https://openaccess.thecvf.com/content_iccv_2015/html/Ionescu_Matrix_Backpropagation_for_ICCV_2015_paper.html,
Introducing Geometry in Active Learning for Image Segmentation,,,https://openaccess.thecvf.com/content_iccv_2015/html/Konyushkova_Introducing_Geometry_in_ICCV_2015_paper.html,
Joint Fine-Tuning in Deep Neural Networks for Facial Expression Recognition,,,https://openaccess.thecvf.com/content_iccv_2015/html/Jung_Joint_Fine-Tuning_in_ICCV_2015_paper.html,
Direct Intrinsics- Learning Albedo-Shading Decomposition by Convolutional Regression,,,https://openaccess.thecvf.com/content_iccv_2015/html/Narihira_Direct_Intrinsics_Learning_ICCV_2015_paper.html,
Face Flow,,,https://openaccess.thecvf.com/content_iccv_2015/html/Snape_Face_Flow_ICCV_2015_paper.html,
Discriminative Low-Rank Tracking,,,https://openaccess.thecvf.com/content_iccv_2015/html/Sui_Discriminative_Low-Rank_Tracking_ICCV_2015_paper.html,
SOWP- Spatially Ordered and Weighted Patch Descriptor for Visual Tracking,,,https://openaccess.thecvf.com/content_iccv_2015/html/Kim_SOWP_Spatially_Ordered_ICCV_2015_paper.html,
Live Repetition Counting,,,https://openaccess.thecvf.com/content_iccv_2015/html/Levy_Live_Repetition_Counting_ICCV_2015_paper.html,
Near-Online Multi-Target Tracking With Aggregated Local Flow Descriptor,,,https://openaccess.thecvf.com/content_iccv_2015/html/Choi_Near-Online_Multi-Target_Tracking_ICCV_2015_paper.html,
Multi-Kernel Correlation Filter for Visual Tracking,,,https://openaccess.thecvf.com/content_iccv_2015/html/Tang_Multi-Kernel_Correlation_Filter_ICCV_2015_paper.html,
Joint Probabilistic Data Association Revisited,,,https://openaccess.thecvf.com/content_iccv_2015/html/Rezatofighi_Joint_Probabilistic_Data_ICCV_2015_paper.html,
Tracking-by-Segmentation With Online Gradient Boosting Decision Tree,,,https://openaccess.thecvf.com/content_iccv_2015/html/Son_Tracking-by-Segmentation_With_Online_ICCV_2015_paper.html,
Exploring Causal Relationships in Visual Object Tracking,,,https://openaccess.thecvf.com/content_iccv_2015/html/Lebeda_Exploring_Causal_Relationships_ICCV_2015_paper.html,
Hierarchical Convolutional Features for Visual Tracking,,,https://openaccess.thecvf.com/content_iccv_2015/html/Ma_Hierarchical_Convolutional_Features_ICCV_2015_paper.html,
Robust Non-Rigid Motion Tracking and Surface Reconstruction Using L0 Regularization,,,https://openaccess.thecvf.com/content_iccv_2015/html/Guo_Robust_Non-Rigid_Motion_ICCV_2015_paper.html,
Online Object Tracking With Proposal Selection,,,https://openaccess.thecvf.com/content_iccv_2015/html/Hua_Online_Object_Tracking_ICCV_2015_paper.html,
Understanding and Diagnosing Visual Tracking Systems,,,https://openaccess.thecvf.com/content_iccv_2015/html/Wang_Understanding_and_Diagnosing_ICCV_2015_paper.html,
Integrating Dashcam Views Through Inter-Video Mapping,,,https://openaccess.thecvf.com/content_iccv_2015/html/Chen_Integrating_Dashcam_Views_ICCV_2015_paper.html,
Visual Tracking With Fully Convolutional Networks,,,https://openaccess.thecvf.com/content_iccv_2015/html/Wang_Visual_Tracking_With_ICCV_2015_paper.html,
Multiple Feature Fusion via Weighted Entropy for Visual Tracking,,,https://openaccess.thecvf.com/content_iccv_2015/html/Ma_Multiple_Feature_Fusion_ICCV_2015_paper.html,
Pedestrian Travel Time Estimation in Crowded Scenes,,,https://openaccess.thecvf.com/content_iccv_2015/html/Yi_Pedestrian_Travel_Time_ICCV_2015_paper.html,
Unsupervised Synchrony Discovery in Human Interaction,,,https://openaccess.thecvf.com/content_iccv_2015/html/Chu_Unsupervised_Synchrony_Discovery_ICCV_2015_paper.html,
Efficient Video Segmentation Using Parametric Graph Partitioning,,,https://openaccess.thecvf.com/content_iccv_2015/html/Yu_Efficient_Video_Segmentation_ICCV_2015_paper.html,
Learning to Track for Spatio-Temporal Action Localization,,,https://openaccess.thecvf.com/content_iccv_2015/html/Weinzaepfel_Learning_to_Track_ICCV_2015_paper.html,
Unsupervised Object Discovery and Tracking in Video Collections,,,https://openaccess.thecvf.com/content_iccv_2015/html/Kwak_Unsupervised_Object_Discovery_ICCV_2015_paper.html,
Car That Knows Before You Do- Anticipating Maneuvers via Learning Temporal Driving Models,,,https://openaccess.thecvf.com/content_iccv_2015/html/Jain_Car_That_Knows_ICCV_2015_paper.html,
Activity Auto-Completion- Predicting Human Activities From Partial Videos,,,https://openaccess.thecvf.com/content_iccv_2015/html/Xu_Activity_Auto-Completion_Predicting_ICCV_2015_paper.html,
Person Re-Identification With Correspondence Structure Learning,,,https://openaccess.thecvf.com/content_iccv_2015/html/Shen_Person_Re-Identification_With_ICCV_2015_paper.html,
Adaptive Exponential Smoothing for Online Filtering of Pixel Prediction Maps,,,https://openaccess.thecvf.com/content_iccv_2015/html/Dang_Adaptive_Exponential_Smoothing_ICCV_2015_paper.html,
P-CNN- Pose-Based CNN Features for Action Recognition,,,https://openaccess.thecvf.com/content_iccv_2015/html/Cheron_P-CNN_Pose-Based_CNN_ICCV_2015_paper.html,
Fully Connected Object Proposals for Video Segmentation,,,https://openaccess.thecvf.com/content_iccv_2015/html/Perazzi_Fully_Connected_Object_ICCV_2015_paper.html,
Video Segmentation With Just a Few Strokes,,,https://openaccess.thecvf.com/content_iccv_2015/html/Nagaraja_Video_Segmentation_With_ICCV_2015_paper.html,
Actionness-Assisted Recognition of Actions,,,https://openaccess.thecvf.com/content_iccv_2015/html/Luo_Actionness-Assisted_Recognition_of_ICCV_2015_paper.html,
COUNT Forest- CO-Voting Uncertain Number of Targets Using Random Forest for Crowd Density Estimation,,,https://openaccess.thecvf.com/content_iccv_2015/html/Pham_COUNT_Forest_CO-Voting_ICCV_2015_paper.html,
Multi-Cue Structure Preserving MRF for Unconstrained Video Segmentation,,,https://openaccess.thecvf.com/content_iccv_2015/html/Yi_Multi-Cue_Structure_Preserving_ICCV_2015_paper.html,
Motion Trajectory Segmentation via Minimum Cost Multicuts,,,https://openaccess.thecvf.com/content_iccv_2015/html/Keuper_Motion_Trajectory_Segmentation_ICCV_2015_paper.html,
Action Localization in Videos Through Context Walk,,,https://openaccess.thecvf.com/content_iccv_2015/html/Soomro_Action_Localization_in_ICCV_2015_paper.html,
RGB-W- When Vision Meets Wireless,,,https://openaccess.thecvf.com/content_iccv_2015/html/Alahi_RGB-W_When_Vision_ICCV_2015_paper.html,
Action Detection by Implicit Intentional Motion Clustering,,,https://openaccess.thecvf.com/content_iccv_2015/html/Chen_Action_Detection_by_ICCV_2015_paper.html,
Simultaneous Foreground Detection and Classification With Hybrid Features,,,https://openaccess.thecvf.com/content_iccv_2015/html/Kim_Simultaneous_Foreground_Detection_ICCV_2015_paper.html,
Training a Feedback Loop for Hand Pose Estimation,,,https://openaccess.thecvf.com/content_iccv_2015/html/Oberweger_Training_a_Feedback_ICCV_2015_paper.html,
Opening the Black Box- Hierarchical Sampling Optimization for Estimating Human Hand Pose,,,https://openaccess.thecvf.com/content_iccv_2015/html/Tang_Opening_the_Black_ICCV_2015_paper.html,
Panoptic Studio- A Massively Multiview System for Social Motion Capture,,,https://openaccess.thecvf.com/content_iccv_2015/html/Joo_Panoptic_Studio_A_ICCV_2015_paper.html,
Where to Buy It- Matching Street Clothing Photos in Online Shops,,,https://openaccess.thecvf.com/content_iccv_2015/html/Kiapour_Where_to_Buy_ICCV_2015_paper.html,
Multi-Task Recurrent Neural Network for Immediacy Prediction,,,https://openaccess.thecvf.com/content_iccv_2015/html/Chu_Multi-Task_Recurrent_Neural_ICCV_2015_paper.html,
Learning Complexity-Aware Cascades for Deep Pedestrian Detection,,,https://openaccess.thecvf.com/content_iccv_2015/html/Cai_Learning_Complexity-Aware_Cascades_ICCV_2015_paper.html,
Polarized 3D- High-Quality Depth Sensing With Polarization Cues,,,https://openaccess.thecvf.com/content_iccv_2015/html/Kadambi_Polarized_3D_High-Quality_ICCV_2015_paper.html,
Airborne Three-Dimensional Cloud Tomography,,,https://openaccess.thecvf.com/content_iccv_2015/html/Levis_Airborne_Three-Dimensional_Cloud_ICCV_2015_paper.html,
Leave-One-Out Kernel Optimization for Shadow Detection,,,https://openaccess.thecvf.com/content_iccv_2015/html/Vicente_Leave-One-Out_Kernel_Optimization_ICCV_2015_paper.html,
Removing Rain From a Single Image via Discriminative Sparse Coding,,,https://openaccess.thecvf.com/content_iccv_2015/html/Luo_Removing_Rain_From_ICCV_2015_paper.html,
Mutual-Structure for Joint Filtering,,,https://openaccess.thecvf.com/content_iccv_2015/html/Shen_Mutual-Structure_for_Joint_ICCV_2015_paper.html,
Photometric Stereo in a Scattering Medium,,,https://openaccess.thecvf.com/content_iccv_2015/html/Murez_Photometric_Stereo_in_ICCV_2015_paper.html,
Resolving Scale Ambiguity Via XSlit Aspect Ratio Analysis,,,https://openaccess.thecvf.com/content_iccv_2015/html/Yang_Resolving_Scale_Ambiguity_ICCV_2015_paper.html,
Single-Shot Specular Surface Reconstruction With Gonio-Plenoptic Imaging,,,https://openaccess.thecvf.com/content_iccv_2015/html/Meng_Single-Shot_Specular_Surface_ICCV_2015_paper.html,
TransCut- Transparent Object Segmentation From a Light-Field Image,,,https://openaccess.thecvf.com/content_iccv_2015/html/Xu_TransCut_Transparent_Object_ICCV_2015_paper.html,
Depth Recovery From Light Field Using Focal Stack Symmetry,,,https://openaccess.thecvf.com/content_iccv_2015/html/Lin_Depth_Recovery_From_ICCV_2015_paper.html,
Depth Map Estimation and Colorization of Anaglyph Images Using Local Color Prior and Reverse Intensity Distribution,,,https://openaccess.thecvf.com/content_iccv_2015/html/Williem_Depth_Map_Estimation_ICCV_2015_paper.html,
Learning Data-Driven Reflectance Priors for Intrinsic Image Decomposition,,,https://openaccess.thecvf.com/content_iccv_2015/html/Zhou_Learning_Data-Driven_Reflectance_ICCV_2015_paper.html,
Photometric Stereo With Small Angular Variations,,,https://openaccess.thecvf.com/content_iccv_2015/html/Wang_Photometric_Stereo_With_ICCV_2015_paper.html,
Occlusion-Aware Depth Estimation Using Light-Field Cameras,,,https://openaccess.thecvf.com/content_iccv_2015/html/Wang_Occlusion-Aware_Depth_Estimation_ICCV_2015_paper.html,
Oriented Light-Field Windows for Scene Flow,,,https://openaccess.thecvf.com/content_iccv_2015/html/Srinivasan_Oriented_Light-Field_Windows_ICCV_2015_paper.html,
Extended Depth of Field Catadioptric Imaging Using Focal Sweep,,,https://openaccess.thecvf.com/content_iccv_2015/html/Yokoya_Extended_Depth_of_ICCV_2015_paper.html,
Intrinsic Depth- Improving Depth Transfer With Intrinsic Images,,,https://openaccess.thecvf.com/content_iccv_2015/html/Kong_Intrinsic_Depth_Improving_ICCV_2015_paper.html,
Separating Fluorescent and Reflective Components by Using a Single Hyperspectral Image,,,https://openaccess.thecvf.com/content_iccv_2015/html/Zheng_Separating_Fluorescent_and_ICCV_2015_paper.html,
Frequency-Based Environment Matting by Compressive Sensing,,,https://openaccess.thecvf.com/content_iccv_2015/html/Qian_Frequency-Based_Environment_Matting_ICCV_2015_paper.html,
Complementary Sets of Shutter Sequences for Motion Deblurring,,,https://openaccess.thecvf.com/content_iccv_2015/html/Jeon_Complementary_Sets_of_ICCV_2015_paper.html,
Hyperspectral Compressive Sensing Using Manifold-Structured Sparsity Prior,,,https://openaccess.thecvf.com/content_iccv_2015/html/Zhang_Hyperspectral_Compressive_Sensing_ICCV_2015_paper.html,
A Gaussian Process Latent Variable Model for BRDF Inference,,,https://openaccess.thecvf.com/content_iccv_2015/html/Georgoulis_A_Gaussian_Process_ICCV_2015_paper.html,
Active One-Shot Scan for Wide Depth Range Using a Light Field Projector Based on Coded Aperture,,,https://openaccess.thecvf.com/content_iccv_2015/html/Kawasaki_Active_One-Shot_Scan_ICCV_2015_paper.html,
Model-Based Tracking at 300Hz Using Raw Time-of-Flight Observations,,,https://openaccess.thecvf.com/content_iccv_2015/html/Stuhmer_Model-Based_Tracking_at_ICCV_2015_paper.html,
Hyperspectral Super-Resolution by Coupled Spectral Unmixing,,,https://openaccess.thecvf.com/content_iccv_2015/html/Lanaras_Hyperspectral_Super-Resolution_by_ICCV_2015_paper.html,
"Depth Selective Camera- A Direct, On-Chip, Programmable Technique for Depth Selectivity in Photography",,,https://openaccess.thecvf.com/content_iccv_2015/html/Tadano_Depth_Selective_Camera_ICCV_2015_paper.html,
A Groupwise Multilinear Correspondence Optimization for 3D Faces,,,https://openaccess.thecvf.com/content_iccv_2015/html/Bolkart_A_Groupwise_Multilinear_ICCV_2015_paper.html,
Selective Encoding for Recognizing Unreliably Localized Faces,,,https://openaccess.thecvf.com/content_iccv_2015/html/Li_Selective_Encoding_for_ICCV_2015_paper.html,
Confidence Preserving Machine for Facial Action Unit Detection,,,https://openaccess.thecvf.com/content_iccv_2015/html/Zeng_Confidence_Preserving_Machine_ICCV_2015_paper.html,
Learning Social Relation Traits From Face Images,,,https://openaccess.thecvf.com/content_iccv_2015/html/Zhang_Learning_Social_Relation_ICCV_2015_paper.html,
Robust Heart Rate Measurement From Video Using Select Random Patches,,,https://openaccess.thecvf.com/content_iccv_2015/html/Lam_Robust_Heart_Rate_ICCV_2015_paper.html,
Robust Model-Based 3D Head Pose Estimation,,,https://openaccess.thecvf.com/content_iccv_2015/html/Meyer_Robust_Model-Based_3D_ICCV_2015_paper.html,
Robust Facial Landmark Detection Under Significant Head Poses and Occlusion,,,https://openaccess.thecvf.com/content_iccv_2015/html/Wu_Robust_Facial_Landmark_ICCV_2015_paper.html,
Conditional Convolutional Neural Network for Modality-Aware Face Recognition,,,https://openaccess.thecvf.com/content_iccv_2015/html/Xiong_Conditional_Convolutional_Neural_ICCV_2015_paper.html,
From Facial Parts Responses to Face Detection- A Deep Learning Approach,,,https://openaccess.thecvf.com/content_iccv_2015/html/Yang_From_Facial_Parts_ICCV_2015_paper.html,
Efficient PSD Constrained Asymmetric Metric Learning for Person Re-Identification,,,https://openaccess.thecvf.com/content_iccv_2015/html/Liao_Efficient_PSD_Constrained_ICCV_2015_paper.html,
Pose-Invariant 3D Face Alignment,,,https://openaccess.thecvf.com/content_iccv_2015/html/Jourabloo_Pose-Invariant_3D_Face_ICCV_2015_paper.html,
From Emotions to Action Units With Hidden and Semi-Hidden-Task Learning,,,https://openaccess.thecvf.com/content_iccv_2015/html/Ruiz_From_Emotions_to_ICCV_2015_paper.html,
Automated Facial Trait Judgment and Election Outcome Prediction- Social Dimensions of Face,,,https://openaccess.thecvf.com/content_iccv_2015/html/Joo_Automated_Facial_Trait_ICCV_2015_paper.html,
Simultaneous Local Binary Feature Learning and Encoding for Face Recognition,,,https://openaccess.thecvf.com/content_iccv_2015/html/Lu_Simultaneous_Local_Binary_ICCV_2015_paper.html,
Deep Learning Face Attributes in the Wild,,,https://openaccess.thecvf.com/content_iccv_2015/html/Liu_Deep_Learning_Face_ICCV_2015_paper.html,
Multi-Task Learning With Low Rank Attribute Embedding for Person Re-Identification,,,https://openaccess.thecvf.com/content_iccv_2015/html/Su_Multi-Task_Learning_With_ICCV_2015_paper.html,
Regressing a 3D Face Shape From a Single Image,,,https://openaccess.thecvf.com/content_iccv_2015/html/Tulyakov_Regressing_a_3D_ICCV_2015_paper.html,
Rendering of Eyes for Eye-Shape Registration and Gaze Estimation,,,https://openaccess.thecvf.com/content_iccv_2015/html/Wood_Rendering_of_Eyes_ICCV_2015_paper.html,
Multi-Scale Learning for Low-Resolution Person Re-Identification,,,https://openaccess.thecvf.com/content_iccv_2015/html/Li_Multi-Scale_Learning_for_ICCV_2015_paper.html,
Learning to Transfer- Transferring Latent Task Structures and Its Application to Person-Specific Facial Action Unit Detection,,,https://openaccess.thecvf.com/content_iccv_2015/html/Almaev_Learning_to_Transfer_ICCV_2015_paper.html,
Pairwise Conditional Random Forests for Facial Expression Recognition,,,https://openaccess.thecvf.com/content_iccv_2015/html/Dapogny_Pairwise_Conditional_Random_ICCV_2015_paper.html,
Multi-Conditional Latent Variable Model for Joint Facial Action Unit Detection,,,https://openaccess.thecvf.com/content_iccv_2015/html/Eleftheriadis_Multi-Conditional_Latent_Variable_ICCV_2015_paper.html,
Leveraging Datasets With Varying Annotations for Face Alignment via Deep Regression Network,,,https://openaccess.thecvf.com/content_iccv_2015/html/Zhang_Leveraging_Datasets_With_ICCV_2015_paper.html,
A Spatio-Temporal Appearance Representation for Viceo-Based Pedestrian Re-Identification,,,https://openaccess.thecvf.com/content_iccv_2015/html/Liu_A_Spatio-Temporal_Appearance_ICCV_2015_paper.html,
"Two Birds, One Stone- Jointly Learning Binary Code for Large-Scale Face Image Retrieval and Attributes Prediction",,,https://openaccess.thecvf.com/content_iccv_2015/html/Li_Two_Birds_One_ICCV_2015_paper.html,
An Accurate Iris Segmentation Framework Under Relaxed Imaging Constraints Using Total Variation Model,,,https://openaccess.thecvf.com/content_iccv_2015/html/Zhao_An_Accurate_Iris_ICCV_2015_paper.html,
Discriminative Pose-Free Descriptors for Face and Object Matching,,,https://openaccess.thecvf.com/content_iccv_2015/html/Sanyal_Discriminative_Pose-Free_Descriptors_ICCV_2015_paper.html,
Bi-Shifting Auto-Encoder for Unsupervised Domain Adaptation,,,https://openaccess.thecvf.com/content_iccv_2015/html/Kan_Bi-Shifting_Auto-Encoder_for_ICCV_2015_paper.html,
Regressive Tree Structured Model for Facial Landmark Localization,,,https://openaccess.thecvf.com/content_iccv_2015/html/Hsu_Regressive_Tree_Structured_ICCV_2015_paper.html,
Person Recognition in Personal Photo Collections,,,https://openaccess.thecvf.com/content_iccv_2015/html/Oh_Person_Recognition_in_ICCV_2015_paper.html,
Robust Statistical Face Frontalization,,,https://openaccess.thecvf.com/content_iccv_2015/html/Sagonas_Robust_Statistical_Face_ICCV_2015_paper.html,
PIEFA- Personalized Incremental and Ensemble Face Alignment,,,https://openaccess.thecvf.com/content_iccv_2015/html/Peng_PIEFA_Personalized_Incremental_ICCV_2015_paper.html,
Understanding Everyday Hands in Action From RGB-D Images,,,https://openaccess.thecvf.com/content_iccv_2015/html/Rogez_Understanding_Everyday_Hands_ICCV_2015_paper.html,
Example-Based Modeling of Facial Texture From Deficient Data,,,https://openaccess.thecvf.com/content_iccv_2015/html/Dessein_Example-Based_Modeling_of_ICCV_2015_paper.html,
Learning to Predict Saliency on Face Images,,,https://openaccess.thecvf.com/content_iccv_2015/html/Xu_Learning_to_Predict_ICCV_2015_paper.html,
Group Membership Prediction,,,https://openaccess.thecvf.com/content_iccv_2015/html/Zhang_Group_Membership_Prediction_ICCV_2015_paper.html,
Extraction of Virtual Baselines From Distorted Document Images Using Curvilinear Projection,,,https://openaccess.thecvf.com/content_iccv_2015/html/Meng_Extraction_of_Virtual_ICCV_2015_paper.html,
Robust RGB-D Odometry Using Point and Line Features,,,https://openaccess.thecvf.com/content_iccv_2015/html/Lu_Robust_RGB-D_Odometry_ICCV_2015_paper.html,
Learning a Discriminative Model for the Perception of Realism in Composite Images,,,https://openaccess.thecvf.com/content_iccv_2015/html/Zhu_Learning_a_Discriminative_ICCV_2015_paper.html,
What Makes Tom Hanks Look Like Tom Hanks,,,https://openaccess.thecvf.com/content_iccv_2015/html/Suwajanakorn_What_Makes_Tom_ICCV_2015_paper.html,
Wide-Area Image Geolocalization With Aerial Reference Imagery,,,https://openaccess.thecvf.com/content_iccv_2015/html/Workman_Wide-Area_Image_Geolocalization_ICCV_2015_paper.html,
Personalized Age Progression With Aging Dictionary,,,https://openaccess.thecvf.com/content_iccv_2015/html/Shu_Personalized_Age_Progression_ICCV_2015_paper.html,
FaceDirector- Continuous Control of Facial Performance in Video,,,https://openaccess.thecvf.com/content_iccv_2015/html/Malleson_FaceDirector_Continuous_Control_ICCV_2015_paper.html,
Synthesizing Illumination Mosaics From Internet Photo-Collections,,,https://openaccess.thecvf.com/content_iccv_2015/html/Ji_Synthesizing_Illumination_Mosaics_ICCV_2015_paper.html,
Hot or Not- Exploring Correlations Between Appearance and Temperature,,,https://openaccess.thecvf.com/content_iccv_2015/html/Glasner_Hot_or_Not_ICCV_2015_paper.html,
SPM-BP- Sped-up PatchMatch Belief Propagation for Continuous MRFs,,,https://openaccess.thecvf.com/content_iccv_2015/html/Li_SPM-BP_Sped-up_PatchMatch_ICCV_2015_paper.html,
