title,keywords,group,link,pdf
On the Visibility of Point Clouds,,,https://openaccess.thecvf.com/content_iccv_2015/html/Katz_On_the_Visibility_ICCV_2015_paper.html,
Weakly Supervised Graph Based Semantic Segmentation by Learning Communities of Image-Parts,,,https://openaccess.thecvf.com/content_iccv_2015/html/Pourian_Weakly_Supervised_Graph_ICCV_2015_paper.html,
Piecewise Flat Embedding for Image Segmentation,,,https://openaccess.thecvf.com/content_iccv_2015/html/Yu_Piecewise_Flat_Embedding_ICCV_2015_paper.html,
Semantic Image Segmentation via Deep Parsing Network,,,https://openaccess.thecvf.com/content_iccv_2015/html/Liu_Semantic_Image_Segmentation_ICCV_2015_paper.html,
Human Parsing With Contextualized Convolutional Neural Network,,,https://openaccess.thecvf.com/content_iccv_2015/html/Liang_Human_Parsing_With_ICCV_2015_paper.html,
Holistically-Nested Edge Detection,,,https://openaccess.thecvf.com/content_iccv_2015/html/Xie_Holistically-Nested_Edge_Detection_ICCV_2015_paper.html,
Minimum Barrier Salient Object Detection at 80 FPS,,,https://openaccess.thecvf.com/content_iccv_2015/html/Zhang_Minimum_Barrier_Salient_ICCV_2015_paper.html,
Learning Image Representations Tied to Ego-Motion,,,https://openaccess.thecvf.com/content_iccv_2015/html/Jayaraman_Learning_Image_Representations_ICCV_2015_paper.html,
Unsupervised Visual Representation Learning by Context Prediction,,,https://openaccess.thecvf.com/content_iccv_2015/html/Doersch_Unsupervised_Visual_Representation_ICCV_2015_paper.html,
Webly Supervised Learning of Convolutional Networks,,,https://openaccess.thecvf.com/content_iccv_2015/html/Chen_Webly_Supervised_Learning_ICCV_2015_paper.html,
Fast R-CNN,,,https://openaccess.thecvf.com/content_iccv_2015/html/Girshick_Fast_R-CNN_ICCV_2015_paper.html,
Bilinear CNN Models for Fine-Grained Visual Recognition,,,https://openaccess.thecvf.com/content_iccv_2015/html/Lin_Bilinear_CNN_Models_ICCV_2015_paper.html,
Discovering the Spatial Extent of Relative Attributes,,,https://openaccess.thecvf.com/content_iccv_2015/html/Xiao_Discovering_the_Spatial_ICCV_2015_paper.html,
Deep Neural Decision Forests,,,https://openaccess.thecvf.com/content_iccv_2015/html/Kontschieder_Deep_Neural_Decision_ICCV_2015_paper.html,
Deep Fried Convnets,,,https://openaccess.thecvf.com/content_iccv_2015/html/Yang_Deep_Fried_Convnets_ICCV_2015_paper.html,
Semantic Component Analysis,,,https://openaccess.thecvf.com/content_iccv_2015/html/Murdock_Semantic_Component_Analysis_ICCV_2015_paper.html,
Low-Rank Matrix Factorization Under General Mixture Noise Distributions,,,https://openaccess.thecvf.com/content_iccv_2015/html/Cao_Low-Rank_Matrix_Factorization_ICCV_2015_paper.html,
Web-Scale Image Clustering Revisited,,,https://openaccess.thecvf.com/content_iccv_2015/html/Avrithis_Web-Scale_Image_Clustering_ICCV_2015_paper.html,
Learning Discriminative Reconstructions for Unsupervised Outlier Removal,,,https://openaccess.thecvf.com/content_iccv_2015/html/Xia_Learning_Discriminative_Reconstructions_ICCV_2015_paper.html,
Learning Deconvolution Network for Semantic Segmentation,,,https://openaccess.thecvf.com/content_iccv_2015/html/Noh_Learning_Deconvolution_Network_ICCV_2015_paper.html,
Conditional Random Fields as Recurrent Neural Networks,,,https://openaccess.thecvf.com/content_iccv_2015/html/Zheng_Conditional_Random_Fields_ICCV_2015_paper.html,
The One Triangle Three Parallelograms Sampling Strategy and Its Application in Shape Regression,,,https://openaccess.thecvf.com/content_iccv_2015/html/Nilsson_The_One_Triangle_ICCV_2015_paper.html,
Boosting Object Proposals- From Pascal to COCO,,,https://openaccess.thecvf.com/content_iccv_2015/html/Pont-Tuset_Boosting_Object_Proposals_ICCV_2015_paper.html,
Secrets of GrabCut and Kernel K-Means,,,https://openaccess.thecvf.com/content_iccv_2015/html/Tang_Secrets_of_GrabCut_ICCV_2015_paper.html,
Video Matting via Sparse and Low-Rank Representation,,,https://openaccess.thecvf.com/content_iccv_2015/html/Zou_Video_Matting_via_ICCV_2015_paper.html,
Joint Object and Part Segmentation Using Deep Learned Potentials,,,https://openaccess.thecvf.com/content_iccv_2015/html/Wang_Joint_Object_and_ICCV_2015_paper.html,
Low-Rank Tensor Constrained Multiview Subspace Clustering,,,https://openaccess.thecvf.com/content_iccv_2015/html/Zhang_Low-Rank_Tensor_Constrained_ICCV_2015_paper.html,
BodyPrint- Pose Invariant 3D Shape Matching of Human Bodies,,,https://openaccess.thecvf.com/content_iccv_2015/html/Wang_BodyPrint_Pose_Invariant_ICCV_2015_paper.html,
The Middle Child Problem- Revisiting Parametric Min-Cut and Seeds for Object Proposals,,,https://openaccess.thecvf.com/content_iccv_2015/html/Humayun_The_Middle_Child_ICCV_2015_paper.html,
Contour Guided Hierarchical Model for Shape Matching,,,https://openaccess.thecvf.com/content_iccv_2015/html/Su_Contour_Guided_Hierarchical_ICCV_2015_paper.html,
Robust Image Segmentation Using Contour-Guided Color Palettes,,,https://openaccess.thecvf.com/content_iccv_2015/html/Fu_Robust_Image_Segmentation_ICCV_2015_paper.html,
Joint Optimization of Segmentation and Color Clustering,,,https://openaccess.thecvf.com/content_iccv_2015/html/Lobacheva_Joint_Optimization_of_ICCV_2015_paper.html,
BoxSup- Exploiting Bounding Boxes to Supervise Convolutional Networks for Semantic Segmentation,,,https://openaccess.thecvf.com/content_iccv_2015/html/Dai_BoxSup_Exploiting_Bounding_ICCV_2015_paper.html,
Detection and Segmentation of 2D Curved Reflection Symmetric Structures,,,https://openaccess.thecvf.com/content_iccv_2015/html/Teo_Detection_and_Segmentation_ICCV_2015_paper.html,
Unsupervised Tube Extraction Using Transductive Learning and Dense Trajectories,,,https://openaccess.thecvf.com/content_iccv_2015/html/Puscas_Unsupervised_Tube_Extraction_ICCV_2015_paper.html,
Compositional Hierarchical Representation of Shape Manifolds for Classification of Non-Manifold Shapes,,,https://openaccess.thecvf.com/content_iccv_2015/html/Ozay_Compositional_Hierarchical_Representation_ICCV_2015_paper.html,
Shell PCA- Statistical Shape Modelling in Shell Space,,,https://openaccess.thecvf.com/content_iccv_2015/html/Zhang_Shell_PCA_Statistical_ICCV_2015_paper.html,
Learning to Combine Mid-Level Cues for Object Proposal Generation,,,https://openaccess.thecvf.com/content_iccv_2015/html/Lee_Learning_to_Combine_ICCV_2015_paper.html,
Enhancing Road Maps by Parsing Aerial Images Around the World,,,https://openaccess.thecvf.com/content_iccv_2015/html/Mattyus_Enhancing_Road_Maps_ICCV_2015_paper.html,
Probabilistic Appearance Models for Segmentation and Classification,,,https://openaccess.thecvf.com/content_iccv_2015/html/Kruger_Probabilistic_Appearance_Models_ICCV_2015_paper.html,
A Randomized Ensemble Approach to Industrial CT Segmentation,,,https://openaccess.thecvf.com/content_iccv_2015/html/Kim_A_Randomized_Ensemble_ICCV_2015_paper.html,
Semi-Supervised Normalized Cuts for Image Segmentation,,,https://openaccess.thecvf.com/content_iccv_2015/html/Chew_Semi-Supervised_Normalized_Cuts_ICCV_2015_paper.html,
StereoSnakes- Contour Based Consistent Object Extraction For Stereo Images,,,https://openaccess.thecvf.com/content_iccv_2015/html/Ju_StereoSnakes_Contour_Based_ICCV_2015_paper.html,
Semantic Segmentation of RGBD Images With Mutex Constraints,,,https://openaccess.thecvf.com/content_iccv_2015/html/Deng_Semantic_Segmentation_of_ICCV_2015_paper.html,
Weakly- and Semi-Supervised Learning of a Deep Convolutional Network for Semantic Image Segmentation,,,https://openaccess.thecvf.com/content_iccv_2015/html/Papandreou_Weakly-_and_Semi-Supervised_ICCV_2015_paper.html,
Efficient Decomposition of Image and Mesh Graphs by Lifted Multicuts,,,https://openaccess.thecvf.com/content_iccv_2015/html/Keuper_Efficient_Decomposition_of_ICCV_2015_paper.html,
Parsimonious Labeling,,,https://openaccess.thecvf.com/content_iccv_2015/html/Dokania_Parsimonious_Labeling_ICCV_2015_paper.html,
Volumetric Bias in Segmentation and Reconstruction- Secrets and Solutions,,,https://openaccess.thecvf.com/content_iccv_2015/html/Boykov_Volumetric_Bias_in_ICCV_2015_paper.html,
Entropy Minimization for Convex Relaxation Approaches,,,https://openaccess.thecvf.com/content_iccv_2015/html/Souiai_Entropy_Minimization_for_ICCV_2015_paper.html,
Adaptively Unified Semi-Supervised Dictionary Learning With Active Points,,,https://openaccess.thecvf.com/content_iccv_2015/html/Wang_Adaptively_Unified_Semi-Supervised_ICCV_2015_paper.html,
Constrained Convolutional Neural Networks for Weakly Supervised Segmentation,,,https://openaccess.thecvf.com/content_iccv_2015/html/Pathak_Constrained_Convolutional_Neural_ICCV_2015_paper.html,
A Multiscale Variable-Grouping Framework for MRF Energy Minimization,,,https://openaccess.thecvf.com/content_iccv_2015/html/Meir_A_Multiscale_Variable-Grouping_ICCV_2015_paper.html,
Inferring M-Best Diverse Labelings in a Single One,,,https://openaccess.thecvf.com/content_iccv_2015/html/Kirillov_Inferring_M-Best_Diverse_ICCV_2015_paper.html,
Convolutional Sparse Coding for Image Super-Resolution,,,https://openaccess.thecvf.com/content_iccv_2015/html/Gu_Convolutional_Sparse_Coding_ICCV_2015_paper.html,
A Wavefront Marching Method for Solving the Eikonal Equation on Cartesian Grids,,,https://openaccess.thecvf.com/content_iccv_2015/html/Cancela_A_Wavefront_Marching_ICCV_2015_paper.html,
A Projection Free Method for Generalized Eigenvalue Problem With a Nonsmooth Regularizer,,,https://openaccess.thecvf.com/content_iccv_2015/html/Hwang_A_Projection_Free_ICCV_2015_paper.html,
Optimizing Expected Intersection-Over-Union With Candidate-Constrained CRFs,,,https://openaccess.thecvf.com/content_iccv_2015/html/Ahmed_Optimizing_Expected_Intersection-Over-Union_ICCV_2015_paper.html,
Higher-Order Inference for Multi-Class Log-Supermodular Models,,,https://openaccess.thecvf.com/content_iccv_2015/html/Zhang_Higher-Order_Inference_for_ICCV_2015_paper.html,
"Depth-Based Hand Pose Estimation- Data, Methods, and Challenges",,,https://openaccess.thecvf.com/content_iccv_2015/html/Supancic_Depth-Based_Hand_Pose_ICCV_2015_paper.html,
Adaptive Dither Voting for Robust Spatial Verification,,,https://openaccess.thecvf.com/content_iccv_2015/html/Wu_Adaptive_Dither_Voting_ICCV_2015_paper.html,
Alternating Co-Quantization for Cross-Modal Hashing,,,https://openaccess.thecvf.com/content_iccv_2015/html/Irie_Alternating_Co-Quantization_for_ICCV_2015_paper.html,
Learning Deep Representation With Large-Scale Attributes,,,https://openaccess.thecvf.com/content_iccv_2015/html/Ouyang_Learning_Deep_Representation_ICCV_2015_paper.html,
Deep Learning Strong Parts for Pedestrian Detection,,,https://openaccess.thecvf.com/content_iccv_2015/html/Tian_Deep_Learning_Strong_ICCV_2015_paper.html,
Flowing ConvNets for Human Pose Estimation in Videos,,,https://openaccess.thecvf.com/content_iccv_2015/html/Pfister_Flowing_ConvNets_for_ICCV_2015_paper.html,
Top Rank Supervised Binary Coding for Visual Search,,,https://openaccess.thecvf.com/content_iccv_2015/html/Song_Top_Rank_Supervised_ICCV_2015_paper.html,
BubbLeNet- Foveated Imaging for Visual Discovery,,,https://openaccess.thecvf.com/content_iccv_2015/html/Matzen_BubbLeNet_Foveated_Imaging_ICCV_2015_paper.html,
PQTable- Fast Exact Asymmetric Distance Neighbor Search for Product Quantization Using Hash Tables,,,https://openaccess.thecvf.com/content_iccv_2015/html/Matsui_PQTable_Fast_Exact_ICCV_2015_paper.html,
Lending A Hand- Detecting Hands and Recognizing Activities in Complex Egocentric Interactions,,,https://openaccess.thecvf.com/content_iccv_2015/html/Bambach_Lending_A_Hand_ICCV_2015_paper.html,
Fast and Accurate Head Pose Estimation via Random Projection Forests,,,https://openaccess.thecvf.com/content_iccv_2015/html/Lee_Fast_and_Accurate_ICCV_2015_paper.html,
An MRF-Poselets Model for Detecting Highly Articulated Humans,,,https://openaccess.thecvf.com/content_iccv_2015/html/Nguyen_An_MRF-Poselets_Model_ICCV_2015_paper.html,
Beyond Tree Structure Models- A New Occlusion Aware Graphical Model for Human Pose Estimation,,,https://openaccess.thecvf.com/content_iccv_2015/html/Fu_Beyond_Tree_Structure_ICCV_2015_paper.html,
Relaxing From Vocabulary- Robust Weakly-Supervised Deep Learning for Vocabulary-Free Image Tagging,,,https://openaccess.thecvf.com/content_iccv_2015/html/Fu_Relaxing_From_Vocabulary_ICCV_2015_paper.html,
Visual Phrases for Exemplar Face Detection,,,https://openaccess.thecvf.com/content_iccv_2015/html/Kumar_Visual_Phrases_for_ICCV_2015_paper.html,
Spatial Semantic Regularisation for Large Scale Object Detection,,,https://openaccess.thecvf.com/content_iccv_2015/html/Mrowca_Spatial_Semantic_Regularisation_ICCV_2015_paper.html,
Human Pose Estimation in Videos,,,https://openaccess.thecvf.com/content_iccv_2015/html/Zhang_Human_Pose_Estimation_ICCV_2015_paper.html,
Contour Box- Rejecting Object Proposals Without Explicit Closed Contours,,,https://openaccess.thecvf.com/content_iccv_2015/html/Lu_Contour_Box_Rejecting_ICCV_2015_paper.html,
Registering Images to Untextured Geometry Using Average Shading Gradients,,,https://openaccess.thecvf.com/content_iccv_2015/html/Plotz_Registering_Images_to_ICCV_2015_paper.html,
Robust Nonrigid Registration by Convex Optimization,,,https://openaccess.thecvf.com/content_iccv_2015/html/Chen_Robust_Nonrigid_Registration_ICCV_2015_paper.html,
Robust and Optimal Sum-of-Squares-Based Point-to-Plane Registration of Image Sets and Structured Scenes,,,https://openaccess.thecvf.com/content_iccv_2015/html/Paudel_Robust_and_Optimal_ICCV_2015_paper.html,
MeshStereo- A Global Stereo Model With Mesh Alignment Regularization for View Interpolation,,,https://openaccess.thecvf.com/content_iccv_2015/html/Zhang_MeshStereo_A_Global_ICCV_2015_paper.html,
CV-HAZOP- Introducing Test Data Validation for Computer Vision,,,https://openaccess.thecvf.com/content_iccv_2015/html/Zendel_CV-HAZOP_Introducing_Test_ICCV_2015_paper.html,
Structure From Motion Using Structure-Less Resection,,,https://openaccess.thecvf.com/content_iccv_2015/html/Zheng_Structure_From_Motion_ICCV_2015_paper.html,
Joint Camera Clustering and Surface Segmentation for Large-Scale Multi-View Stereo,,,https://openaccess.thecvf.com/content_iccv_2015/html/Zhang_Joint_Camera_Clustering_ICCV_2015_paper.html,
Higher-Order CRF Structural Segmentation of 3D Reconstructed Surfaces,,,https://openaccess.thecvf.com/content_iccv_2015/html/Liu_Higher-Order_CRF_Structural_ICCV_2015_paper.html,
Hyperpoints and Fine Vocabularies for Large-Scale Location Recognition,,,https://openaccess.thecvf.com/content_iccv_2015/html/Sattler_Hyperpoints_and_Fine_ICCV_2015_paper.html,
Globally Optimal 2D-3D Registration From Points or Lines Without Correspondences,,,https://openaccess.thecvf.com/content_iccv_2015/html/Brown_Globally_Optimal_2D-3D_ICCV_2015_paper.html,
The HCI Stereo Metrics- Geometry-Aware Performance Analysis of Stereo Algorithms,,,https://openaccess.thecvf.com/content_iccv_2015/html/Honauer_The_HCI_Stereo_ICCV_2015_paper.html,
Merging the Unmatchable- Stitching Visually Disconnected SfM Models,,,https://openaccess.thecvf.com/content_iccv_2015/html/Cohen_Merging_the_Unmatchable_ICCV_2015_paper.html,
3D Fragment Reassembly Using Integrated Template Guidance and Fracture-Region Matching,,,https://openaccess.thecvf.com/content_iccv_2015/html/Zhang_3D_Fragment_Reassembly_ICCV_2015_paper.html,
Procedural Editing of 3D Building Point Clouds,,,https://openaccess.thecvf.com/content_iccv_2015/html/Demir_Procedural_Editing_of_ICCV_2015_paper.html,
Semantically-Aware Aerial Reconstruction From Multi-Modal Data,,,https://openaccess.thecvf.com/content_iccv_2015/html/Cabezas_Semantically-Aware_Aerial_Reconstruction_ICCV_2015_paper.html,
Guaranteed Outlier Removal for Rotation Search,,,https://openaccess.thecvf.com/content_iccv_2015/html/Bustos_Guaranteed_Outlier_Removal_ICCV_2015_paper.html,
Peeking Template Matching for Depth Extension,,,https://openaccess.thecvf.com/content_iccv_2015/html/Korman_Peeking_Template_Matching_ICCV_2015_paper.html,
Deformable 3D Fusion- From Partial Dynamic 3D Observations to Complete 4D Models,,,https://openaccess.thecvf.com/content_iccv_2015/html/Xu_Deformable_3D_Fusion_ICCV_2015_paper.html,
Non-Parametric Structure-Based Calibration of Radially Symmetric Cameras,,,https://openaccess.thecvf.com/content_iccv_2015/html/Camposeco_Non-Parametric_Structure-Based_Calibration_ICCV_2015_paper.html,
Exploiting Object Similarity in 3D Reconstruction,,,https://openaccess.thecvf.com/content_iccv_2015/html/Zhou_Exploiting_Object_Similarity_ICCV_2015_paper.html,
You Are Here- Mimicking the Human Thinking Process in Reading Floor-Plans,,,https://openaccess.thecvf.com/content_iccv_2015/html/Chu_You_Are_Here_ICCV_2015_paper.html,
MAP Disparity Estimation Using Hidden Markov Trees,,,https://openaccess.thecvf.com/content_iccv_2015/html/Psota_MAP_Disparity_Estimation_ICCV_2015_paper.html,
Wide Baseline Stereo Matching With Convex Bounded Distortion Constraints,,,https://openaccess.thecvf.com/content_iccv_2015/html/Galun_Wide_Baseline_Stereo_ICCV_2015_paper.html,
Interactive Visual Hull Refinement for Specular and Transparent Object Surface Reconstruction,,,https://openaccess.thecvf.com/content_iccv_2015/html/Zuo_Interactive_Visual_Hull_ICCV_2015_paper.html,
Hierarchical Higher-Order Regression Forest Fields- An Application to 3D Indoor Scene Labelling,,,https://openaccess.thecvf.com/content_iccv_2015/html/Pham_Hierarchical_Higher-Order_Regression_ICCV_2015_paper.html,
Classical Scaling Revisited,,,https://openaccess.thecvf.com/content_iccv_2015/html/Shamai_Classical_Scaling_Revisited_ICCV_2015_paper.html,
Dense Continuous-Time Tracking and Mapping With Rolling Shutter RGB-D Cameras,,,https://openaccess.thecvf.com/content_iccv_2015/html/Kerl_Dense_Continuous-Time_Tracking_ICCV_2015_paper.html,
Dense Image Registration and Deformable Surface Reconstruction in Presence of Occlusions and Minimal Texture,,,https://openaccess.thecvf.com/content_iccv_2015/html/Ngo_Dense_Image_Registration_ICCV_2015_paper.html,
The Likelihood-Ratio Test and Efficient Robust Estimation,,,https://openaccess.thecvf.com/content_iccv_2015/html/Cohen_The_Likelihood-Ratio_Test_ICCV_2015_paper.html,
Reflection Modeling for Passive Stereo,,,https://openaccess.thecvf.com/content_iccv_2015/html/Nair_Reflection_Modeling_for_ICCV_2015_paper.html,
Detailed Full-Body Reconstructions of Moving People From Monocular RGB-D Sequences,,,https://openaccess.thecvf.com/content_iccv_2015/html/Bogo_Detailed_Full-Body_Reconstructions_ICCV_2015_paper.html,
Efficient Solution to the Epipolar Geometry for Radially Distorted Cameras,,,https://openaccess.thecvf.com/content_iccv_2015/html/Kukelova_Efficient_Solution_to_ICCV_2015_paper.html,
Learning a Descriptor-Specific 3D Keypoint Detector,,,https://openaccess.thecvf.com/content_iccv_2015/html/Salti_Learning_a_Descriptor-Specific_ICCV_2015_paper.html,
Component-Wise Modeling of Articulated Objects,,,https://openaccess.thecvf.com/content_iccv_2015/html/Ntouskos_Component-Wise_Modeling_of_ICCV_2015_paper.html,
A Collaborative Filtering Approach to Real-Time Hand Pose Estimation,,,https://openaccess.thecvf.com/content_iccv_2015/html/Choi_A_Collaborative_Filtering_ICCV_2015_paper.html,
On the Equivalence of Moving Entrance Pupil and Radial Distortion for Camera Calibration,,,https://openaccess.thecvf.com/content_iccv_2015/html/Kumar_On_the_Equivalence_ICCV_2015_paper.html,
A Linear Generalized Camera Calibration From Three Intersecting Reference Planes,,,https://openaccess.thecvf.com/content_iccv_2015/html/Nishimura_A_Linear_Generalized_ICCV_2015_paper.html,
Towards Pointless Structure From Motion- 3D Reconstruction and Camera Parameters From General 3D Curves,,,https://openaccess.thecvf.com/content_iccv_2015/html/Nurutdinova_Towards_Pointless_Structure_ICCV_2015_paper.html,
"Attributed Grammars for Joint Estimation of Human Attributes, Part and Pose",,,https://openaccess.thecvf.com/content_iccv_2015/html/Park_Attributed_Grammars_for_ICCV_2015_paper.html,
Real-Time Pose Estimation Piggybacked on Object Detection,,,https://openaccess.thecvf.com/content_iccv_2015/html/Juranek_Real-Time_Pose_Estimation_ICCV_2015_paper.html,
Understanding and Predicting Image Memorability at a Large Scale,,,https://openaccess.thecvf.com/content_iccv_2015/html/Khosla_Understanding_and_Predicting_ICCV_2015_paper.html,
Multiple Granularity Descriptors for Fine-Grained Categorization,,,https://openaccess.thecvf.com/content_iccv_2015/html/Wang_Multiple_Granularity_Descriptors_ICCV_2015_paper.html,
Guiding the Long-Short Term Memory Model for Image Caption Generation,,,https://openaccess.thecvf.com/content_iccv_2015/html/Jia_Guiding_the_Long-Short_ICCV_2015_paper.html,
Just Noticeable Differences in Visual Attributes,,,https://openaccess.thecvf.com/content_iccv_2015/html/Yu_Just_Noticeable_Differences_ICCV_2015_paper.html,
VQA- Visual Question Answering,,,https://openaccess.thecvf.com/content_iccv_2015/html/Antol_VQA_Visual_Question_ICCV_2015_paper.html,
"Localize Me Anywhere, Anytime- A Multi-Task Point-Retrieval Approach",,,https://openaccess.thecvf.com/content_iccv_2015/html/Lu_Localize_Me_Anywhere_ICCV_2015_paper.html,
Dense Optical Flow Prediction From a Static Image,,,https://openaccess.thecvf.com/content_iccv_2015/html/Walker_Dense_Optical_Flow_ICCV_2015_paper.html,
Unsupervised Domain Adaptation for Zero-Shot Learning,,,https://openaccess.thecvf.com/content_iccv_2015/html/Kodirov_Unsupervised_Domain_Adaptation_ICCV_2015_paper.html,
Visual Madlibs- Fill in the Blank Description Generation and Question Answering,,,https://openaccess.thecvf.com/content_iccv_2015/html/Yu_Visual_Madlibs_Fill_ICCV_2015_paper.html,
Actions and Attributes From Wholes and Parts,,,https://openaccess.thecvf.com/content_iccv_2015/html/Gkioxari_Actions_and_Attributes_ICCV_2015_paper.html,
DeepBox- Learning Objectness With Convolutional Networks,,,https://openaccess.thecvf.com/content_iccv_2015/html/Kuo_DeepBox_Learning_Objectness_ICCV_2015_paper.html,
Active Object Localization With Deep Reinforcement Learning,,,https://openaccess.thecvf.com/content_iccv_2015/html/Caicedo_Active_Object_Localization_ICCV_2015_paper.html,
Scene-Domain Active Part Models for Object Representation,,,https://openaccess.thecvf.com/content_iccv_2015/html/Ren_Scene-Domain_Active_Part_ICCV_2015_paper.html,
A Unified Multiplicative Framework for Attribute Learning,,,https://openaccess.thecvf.com/content_iccv_2015/html/Liang_A_Unified_Multiplicative_ICCV_2015_paper.html,
Contractive Rectifier Networks for Nonlinear Maximum Margin Classification,,,https://openaccess.thecvf.com/content_iccv_2015/html/An_Contractive_Rectifier_Networks_ICCV_2015_paper.html,
Augmenting Strong Supervision Using Web Data for Fine-Grained Categorization,,,https://openaccess.thecvf.com/content_iccv_2015/html/Xu_Augmenting_Strong_Supervision_ICCV_2015_paper.html,
Learning Like a Child- Fast Novel Visual Concept Learning From Sentence Descriptions of Images,,,https://openaccess.thecvf.com/content_iccv_2015/html/Mao_Learning_Like_a_ICCV_2015_paper.html,
Learning Common Sense Through Visual Abstraction,,,https://openaccess.thecvf.com/content_iccv_2015/html/Vedantam_Learning_Common_Sense_ICCV_2015_paper.html,
Domain Generalization for Object Recognition With Multi-Task Autoencoders,,,https://openaccess.thecvf.com/content_iccv_2015/html/Ghifary_Domain_Generalization_for_ICCV_2015_paper.html,
Square Localization for Efficient and Accurate Object Detection,,,https://openaccess.thecvf.com/content_iccv_2015/html/Lu_Square_Localization_for_ICCV_2015_paper.html,
Box Aggregation for Proposal Decimation- Last Mile of Object Detection,,,https://openaccess.thecvf.com/content_iccv_2015/html/Liu_Box_Aggregation_for_ICCV_2015_paper.html,
DeepProposal- Hunting Objects by Cascading Deep Convolutional Layers,,,https://openaccess.thecvf.com/content_iccv_2015/html/Ghodrati_DeepProposal_Hunting_Objects_ICCV_2015_paper.html,
Semantic Segmentation With Object Clique Potential,,,https://openaccess.thecvf.com/content_iccv_2015/html/Qi_Semantic_Segmentation_With_ICCV_2015_paper.html,
Automatic Concept Discovery From Parallel Text and Visual Corpora,,,https://openaccess.thecvf.com/content_iccv_2015/html/Sun_Automatic_Concept_Discovery_ICCV_2015_paper.html,
Simpler Non-Parametric Methods Provide as Good or Better Results to Multiple-Instance Learning,,,https://openaccess.thecvf.com/content_iccv_2015/html/Venkatesan_Simpler_Non-Parametric_Methods_ICCV_2015_paper.html,
Monocular Object Instance Segmentation and Depth Ordering With CNNs,,,https://openaccess.thecvf.com/content_iccv_2015/html/Zhang_Monocular_Object_Instance_ICCV_2015_paper.html,
Multimodal Convolutional Neural Networks for Matching Image and Sentence,,,https://openaccess.thecvf.com/content_iccv_2015/html/Ma_Multimodal_Convolutional_Neural_ICCV_2015_paper.html,
Structural Kernel Learning for Large Scale Multiclass Object Co-Detection,,,https://openaccess.thecvf.com/content_iccv_2015/html/Hayder_Structural_Kernel_Learning_ICCV_2015_paper.html,
Flickr30k Entities- Collecting Region-to-Phrase Correspondences for Richer Image-to-Sentence Models,,,https://openaccess.thecvf.com/content_iccv_2015/html/Plummer_Flickr30k_Entities_Collecting_ICCV_2015_paper.html,
"Predicting Depth, Surface Normals and Semantic Labels With a Common Multi-Scale Convolutional Architecture",,,https://openaccess.thecvf.com/content_iccv_2015/html/Eigen_Predicting_Depth_Surface_ICCV_2015_paper.html,
AttentionNet- Aggregating Weak Directions for Accurate Object Detection,,,https://openaccess.thecvf.com/content_iccv_2015/html/Yoo_AttentionNet_Aggregating_Weak_ICCV_2015_paper.html,
Common Subspace for Model and Similarity- Phrase Learning for Caption Generation From Images,,,https://openaccess.thecvf.com/content_iccv_2015/html/Ushiku_Common_Subspace_for_ICCV_2015_paper.html,
3D-Assisted Feature Synthesis for Novel Views of an Object,,,https://openaccess.thecvf.com/content_iccv_2015/html/Su_3D-Assisted_Feature_Synthesis_ICCV_2015_paper.html,
