title,keywords,group,link,pdf
Ask Your Neurons- A Neural-Based Approach to Answering Questions About Images,,,https://openaccess.thecvf.com/content_iccv_2015/html/Malinowski_Ask_Your_Neurons_ICCV_2015_paper.html,
"Segment-Phrase Table for Semantic Segmentation, Visual Entailment and Paraphrasing",,,https://openaccess.thecvf.com/content_iccv_2015/html/Izadinia_Segment-Phrase_Table_for_ICCV_2015_paper.html,
Aligning Books and Movies- Towards Story-Like Visual Explanations by Watching Movies and Reading Books,,,https://openaccess.thecvf.com/content_iccv_2015/html/Zhu_Aligning_Books_and_ICCV_2015_paper.html,
Learning Query and Image Similarities With Ranking Canonical Correlation Analysis,,,https://openaccess.thecvf.com/content_iccv_2015/html/Yao_Learning_Query_and_ICCV_2015_paper.html,
Learning to See by Moving,,,https://openaccess.thecvf.com/content_iccv_2015/html/Agrawal_Learning_to_See_ICCV_2015_paper.html,
Object Detection Using Generalization and Efficiency Balanced Co-Occurrence Features,,,https://openaccess.thecvf.com/content_iccv_2015/html/Ren_Object_Detection_Using_ICCV_2015_paper.html,
Mining And-Or Graphs for Graph Matching and Object Discovery,,,https://openaccess.thecvf.com/content_iccv_2015/html/Zhang_Mining_And-Or_Graphs_ICCV_2015_paper.html,
Pose Induction for Novel Object Categories,,,https://openaccess.thecvf.com/content_iccv_2015/html/Tulsiani_Pose_Induction_for_ICCV_2015_paper.html,
Dynamic Texture Recognition via Orthogonal Tensor Dictionary Learning,,,https://openaccess.thecvf.com/content_iccv_2015/html/Quan_Dynamic_Texture_Recognition_ICCV_2015_paper.html,
Convolutional Channel Features,,,https://openaccess.thecvf.com/content_iccv_2015/html/Yang_Convolutional_Channel_Features_ICCV_2015_paper.html,
Local Convolutional Features With Unsupervised Training for Image Retrieval,,,https://openaccess.thecvf.com/content_iccv_2015/html/Paulin_Local_Convolutional_Features_ICCV_2015_paper.html,
RIDE- Reversal Invariant Descriptor Enhancement,,,https://openaccess.thecvf.com/content_iccv_2015/html/Xie_RIDE_Reversal_Invariant_ICCV_2015_paper.html,
Discrete Tabu Search for Graph Matching,,,https://openaccess.thecvf.com/content_iccv_2015/html/Adamczewski_Discrete_Tabu_Search_ICCV_2015_paper.html,
Discriminative Learning of Deep Convolutional Feature Point Descriptors,,,https://openaccess.thecvf.com/content_iccv_2015/html/Simo-Serra_Discriminative_Learning_of_ICCV_2015_paper.html,
Amodal Completion and Size Constancy in Natural Scenes,,,https://openaccess.thecvf.com/content_iccv_2015/html/Kar_Amodal_Completion_and_ICCV_2015_paper.html,
Learning Where to Position Parts in 3D,,,https://openaccess.thecvf.com/content_iccv_2015/html/Pedersoli_Learning_Where_to_ICCV_2015_paper.html,
Query Adaptive Similarity Measure for RGB-D Object Recognition,,,https://openaccess.thecvf.com/content_iccv_2015/html/Cheng_Query_Adaptive_Similarity_ICCV_2015_paper.html,
Listening With Your Eyes- Towards a Practical Visual Speech Recognition System Using Deep Boltzmann Machines,,,https://openaccess.thecvf.com/content_iccv_2015/html/Sui_Listening_With_Your_ICCV_2015_paper.html,
Cluster-Based Point Set Saliency,,,https://openaccess.thecvf.com/content_iccv_2015/html/Tasse_Cluster-Based_Point_Set_ICCV_2015_paper.html,
A Comprehensive Multi-Illuminant Dataset for Benchmarking of the Intrinsic Image Algorithms,,,https://openaccess.thecvf.com/content_iccv_2015/html/Beigpour_A_Comprehensive_Multi-Illuminant_ICCV_2015_paper.html,
PatchMatch-Based Automatic Lattice Detection for Near-Regular Textures,,,https://openaccess.thecvf.com/content_iccv_2015/html/Liu_PatchMatch-Based_Automatic_Lattice_ICCV_2015_paper.html,
A Data-Driven Metric for Comprehensive Evaluation of Saliency Models,,,https://openaccess.thecvf.com/content_iccv_2015/html/Li_A_Data-Driven_Metric_ICCV_2015_paper.html,
A Matrix Decomposition Perspective to Multiple Graph Matching,,,https://openaccess.thecvf.com/content_iccv_2015/html/Yan_A_Matrix_Decomposition_ICCV_2015_paper.html,
Fast and Effective L0 Gradient Minimization by Region Fusion,,,https://openaccess.thecvf.com/content_iccv_2015/html/Nguyen_Fast_and_Effective_ICCV_2015_paper.html,
Generic Promotion of Diffusion-Based Salient Object Detection,,,https://openaccess.thecvf.com/content_iccv_2015/html/Jiang_Generic_Promotion_of_ICCV_2015_paper.html,
Nighttime Haze Removal With Glow and Multiple Light Colors,,,https://openaccess.thecvf.com/content_iccv_2015/html/Li_Nighttime_Haze_Removal_ICCV_2015_paper.html,
Conformal and Low-Rank Sparse Representation for Image Restoration,,,https://openaccess.thecvf.com/content_iccv_2015/html/Li_Conformal_and_Low-Rank_ICCV_2015_paper.html,
Patch Group Based Nonlocal Self-Similarity Prior Learning for Image Denoising,,,https://openaccess.thecvf.com/content_iccv_2015/html/Xu_Patch_Group_Based_ICCV_2015_paper.html,
Automatic Thumbnail Generation Based on Visual Representativeness and Foreground Recognizability,,,https://openaccess.thecvf.com/content_iccv_2015/html/Huang_Automatic_Thumbnail_Generation_ICCV_2015_paper.html,
SALICON- Reducing the Semantic Gap in Saliency Prediction by Adapting Deep Neural Networks,,,https://openaccess.thecvf.com/content_iccv_2015/html/Huang_SALICON_Reducing_the_ICCV_2015_paper.html,
A Novel Sparsity Measure for Tensor Recovery,,,https://openaccess.thecvf.com/content_iccv_2015/html/Zhao_A_Novel_Sparsity_ICCV_2015_paper.html,
Oriented Object Proposals,,,https://openaccess.thecvf.com/content_iccv_2015/html/He_Oriented_Object_Proposals_ICCV_2015_paper.html,
Learning Nonlinear Spectral Filters for Color Image Reconstruction,,,https://openaccess.thecvf.com/content_iccv_2015/html/Moeller_Learning_Nonlinear_Spectral_ICCV_2015_paper.html,
Beyond White- Ground Truth Colors for Color Constancy Correction,,,https://openaccess.thecvf.com/content_iccv_2015/html/Cheng_Beyond_White_Ground_ICCV_2015_paper.html,
RGB-Guided Hyperspectral Image Upsampling,,,https://openaccess.thecvf.com/content_iccv_2015/html/Kwon_RGB-Guided_Hyperspectral_Image_ICCV_2015_paper.html,
Projection Onto the Manifold of Elongated Structures for Accurate Extraction,,,https://openaccess.thecvf.com/content_iccv_2015/html/Sironi_Projection_Onto_the_ICCV_2015_paper.html,
Naive Bayes Super-Resolution Forest,,,https://openaccess.thecvf.com/content_iccv_2015/html/Salvador_Naive_Bayes_Super-Resolution_ICCV_2015_paper.html,
POP Image Fusion - Derivative Domain Image Fusion Without Reintegration,,,https://openaccess.thecvf.com/content_iccv_2015/html/Finlayson_POP_Image_Fusion_ICCV_2015_paper.html,
Adaptive Spatial-Spectral Dictionary Learning for Hyperspectral Image Denoising,,,https://openaccess.thecvf.com/content_iccv_2015/html/Fu_Adaptive_Spatial-Spectral_Dictionary_ICCV_2015_paper.html,
Fully Connected Guided Image Filtering,,,https://openaccess.thecvf.com/content_iccv_2015/html/Dai_Fully_Connected_Guided_ICCV_2015_paper.html,
Segment Graph Based Image Filtering- Fast Structure-Preserving Smoothing,,,https://openaccess.thecvf.com/content_iccv_2015/html/Zhang_Segment_Graph_Based_ICCV_2015_paper.html,
Deep Networks for Image Super-Resolution With Sparse Prior,,,https://openaccess.thecvf.com/content_iccv_2015/html/Wang_Deep_Networks_for_ICCV_2015_paper.html,
Convolutional Color Constancy,,,https://openaccess.thecvf.com/content_iccv_2015/html/Barron_Convolutional_Color_Constancy_ICCV_2015_paper.html,
Learning Ordinal Relationships for Mid-Level Vision,,,https://openaccess.thecvf.com/content_iccv_2015/html/Zoran_Learning_Ordinal_Relationships_ICCV_2015_paper.html,
Thin Structure Estimation With Curvature Regularization,,,https://openaccess.thecvf.com/content_iccv_2015/html/Marin_Thin_Structure_Estimation_ICCV_2015_paper.html,
HARF- Hierarchy-Associated Rich Features for Salient Object Detection,,,https://openaccess.thecvf.com/content_iccv_2015/html/Zou_HARF_Hierarchy-Associated_Rich_ICCV_2015_paper.html,
Deep Colorization,,,https://openaccess.thecvf.com/content_iccv_2015/html/Cheng_Deep_Colorization_ICCV_2015_paper.html,
Image Matting With KL-Divergence Based Sparse Sampling,,,https://openaccess.thecvf.com/content_iccv_2015/html/Karacan_Image_Matting_With_ICCV_2015_paper.html,
Intrinsic Decomposition of Image Sequences From Local Temporal Variations,,,https://openaccess.thecvf.com/content_iccv_2015/html/Laffont_Intrinsic_Decomposition_of_ICCV_2015_paper.html,
Low-Rank Tensor Approximation With Laplacian Scale Mixture Modeling for Multiframe Image Denoising,,,https://openaccess.thecvf.com/content_iccv_2015/html/Dong_Low-Rank_Tensor_Approximation_ICCV_2015_paper.html,
Learning Parametric Distributions for Image Super-Resolution- Where Patch Matching Meets Sparse Coding,,,https://openaccess.thecvf.com/content_iccv_2015/html/Li_Learning_Parametric_Distributions_ICCV_2015_paper.html,
Improving Image Restoration With Soft-Rounding,,,https://openaccess.thecvf.com/content_iccv_2015/html/Mei_Improving_Image_Restoration_ICCV_2015_paper.html,
See the Difference- Direct Pre-Image Reconstruction and Pose Estimation by Differentiating HOG,,,https://openaccess.thecvf.com/content_iccv_2015/html/Chiu_See_the_Difference_ICCV_2015_paper.html,
An Efficient Statistical Method for Image Noise Level Estimation,,,https://openaccess.thecvf.com/content_iccv_2015/html/Chen_An_Efficient_Statistical_ICCV_2015_paper.html,
Contour Detection and Characterization for Asynchronous Event Sensors,,,https://openaccess.thecvf.com/content_iccv_2015/html/Barranco_Contour_Detection_and_ICCV_2015_paper.html,
Class-Specific Image Deblurring,,,https://openaccess.thecvf.com/content_iccv_2015/html/Anwar_Class-Specific_Image_Deblurring_ICCV_2015_paper.html,
High-for-Low and Low-for-High- Efficient Boundary Detection From Deep Object Features and its Applications to High-Level Vision,,,https://openaccess.thecvf.com/content_iccv_2015/html/Bertasius_High-for-Low_and_Low-for-High_ICCV_2015_paper.html,
Variational Depth Superresolution Using Example-Based Edge Representations,,,https://openaccess.thecvf.com/content_iccv_2015/html/Ferstl_Variational_Depth_Superresolution_ICCV_2015_paper.html,
Conditioned Regression Models for Non-Blind Single Image Super-Resolution,,,https://openaccess.thecvf.com/content_iccv_2015/html/Riegler_Conditioned_Regression_Models_ICCV_2015_paper.html,
Video Super-Resolution via Deep Draft-Ensemble Learning,,,https://openaccess.thecvf.com/content_iccv_2015/html/Liao_Video_Super-Resolution_via_ICCV_2015_paper.html,
Pan-Sharpening With a Hyper-Laplacian Penalty,,,https://openaccess.thecvf.com/content_iccv_2015/html/Jiang_Pan-Sharpening_With_a_ICCV_2015_paper.html,
Video Restoration Against Yin-Yang Phasing,,,https://openaccess.thecvf.com/content_iccv_2015/html/Wu_Video_Restoration_Against_ICCV_2015_paper.html,
Rolling Shutter Super-Resolution,,,https://openaccess.thecvf.com/content_iccv_2015/html/Punnappurath_Rolling_Shutter_Super-Resolution_ICCV_2015_paper.html,
Learning Large-Scale Automatic Image Colorization,,,https://openaccess.thecvf.com/content_iccv_2015/html/Deshpande_Learning_Large-Scale_Automatic_ICCV_2015_paper.html,
Compression Artifacts Reduction by a Deep Convolutional Network,,,https://openaccess.thecvf.com/content_iccv_2015/html/Dong_Compression_Artifacts_Reduction_ICCV_2015_paper.html,
Multiple-Hypothesis Affine Region Estimation With Anisotropic LoG Filters,,,https://openaccess.thecvf.com/content_iccv_2015/html/Hasegawa_Multiple-Hypothesis_Affine_Region_ICCV_2015_paper.html,
A Self-Paced Multiple-Instance Learning Framework for Co-Saliency Detection,,,https://openaccess.thecvf.com/content_iccv_2015/html/Zhang_A_Self-Paced_Multiple-Instance_ICCV_2015_paper.html,
External Patch Prior Guided Internal Clustering for Image Denoising,,,https://openaccess.thecvf.com/content_iccv_2015/html/Chen_External_Patch_Prior_ICCV_2015_paper.html,
Self-Calibration of Optical Lenses,,,https://openaccess.thecvf.com/content_iccv_2015/html/Hirsch_Self-Calibration_of_Optical_ICCV_2015_paper.html,
Illumination Robust Color Naming via Label Propagation,,,https://openaccess.thecvf.com/content_iccv_2015/html/liu_Illumination_Robust_Color_ICCV_2015_paper.html,
Unsupervised Cross-Modal Synthesis of Subject-Specific Scans,,,https://openaccess.thecvf.com/content_iccv_2015/html/Vemulapalli_Unsupervised_Cross-Modal_Synthesis_ICCV_2015_paper.html,
Learning to Boost Filamentary Structure Segmentation,,,https://openaccess.thecvf.com/content_iccv_2015/html/Gu_Learning_to_Boost_ICCV_2015_paper.html,
Weakly-Supervised Structured Output Learning With Flexible and Latent Graphs Using High-Order Loss Functions,,,https://openaccess.thecvf.com/content_iccv_2015/html/Carneiro_Weakly-Supervised_Structured_Output_ICCV_2015_paper.html,
Efficient Classifier Training to Minimize False Merges in Electron Microscopy Segmentation,,,https://openaccess.thecvf.com/content_iccv_2015/html/Parag_Efficient_Classifier_Training_ICCV_2015_paper.html,
On Statistical Analysis of Neuroimages With Imperfect Registration,,,https://openaccess.thecvf.com/content_iccv_2015/html/Kim_On_Statistical_Analysis_ICCV_2015_paper.html,
Convex Optimization With Abstract Linear Operators,,,https://openaccess.thecvf.com/content_iccv_2015/html/Diamond_Convex_Optimization_With_ICCV_2015_paper.html,
Building Dynamic Cloud Maps From the Ground Up,,,https://openaccess.thecvf.com/content_iccv_2015/html/Murdock_Building_Dynamic_Cloud_ICCV_2015_paper.html,
"A Versatile Learning-Based 3D Temporal Tracker- Scalable, Robust, Online",,,https://openaccess.thecvf.com/content_iccv_2015/html/Tan_A_Versatile_Learning-Based_ICCV_2015_paper.html,
Realtime Edge-Based Visual Odometry for a Monocular Camera,,,https://openaccess.thecvf.com/content_iccv_2015/html/Tarrio_Realtime_Edge-Based_Visual_ICCV_2015_paper.html,
Fill and Transfer- A Simple Physics-Based Approach for Containability Reasoning,,,https://openaccess.thecvf.com/content_iccv_2015/html/Yu_Fill_and_Transfer_ICCV_2015_paper.html,
On Linear Structure From Motion for Light Field Cameras,,,https://openaccess.thecvf.com/content_iccv_2015/html/Johannsen_On_Linear_Structure_ICCV_2015_paper.html,
3D Object Reconstruction From Hand-Object Interactions,,,https://openaccess.thecvf.com/content_iccv_2015/html/Tzionas_3D_Object_Reconstruction_ICCV_2015_paper.html,
Minimal Solvers for 3D Geometry From Satellite Imagery,,,https://openaccess.thecvf.com/content_iccv_2015/html/Zheng_Minimal_Solvers_for_ICCV_2015_paper.html,
An Efficient Minimal Solution for Multi-Camera Motion,,,https://openaccess.thecvf.com/content_iccv_2015/html/Ventura_An_Efficient_Minimal_ICCV_2015_paper.html,
"Learning Shape, Motion and Elastic Models in Force Space",,,https://openaccess.thecvf.com/content_iccv_2015/html/Agudo_Learning_Shape_Motion_ICCV_2015_paper.html,
A Versatile Scene Model With Differentiable Visibility Applied to Generative Pose Estimation,,,https://openaccess.thecvf.com/content_iccv_2015/html/Rhodin_A_Versatile_Scene_ICCV_2015_paper.html,
Semantic Pose Using Deep Networks Trained on Synthetic RGB-D,,,https://openaccess.thecvf.com/content_iccv_2015/html/Papon_Semantic_Pose_Using_ICCV_2015_paper.html,
Exploiting High Level Scene Cues in Stereo Reconstruction,,,https://openaccess.thecvf.com/content_iccv_2015/html/Hadfield_Exploiting_High_Level_ICCV_2015_paper.html,
Point Triangulation Through Polyhedron Collapse Using the l[-] Norm,,,https://openaccess.thecvf.com/content_iccv_2015/html/Donne_Point_Triangulation_Through_ICCV_2015_paper.html,
Optimizing the Viewing Graph for Structure-From-Motion,,,https://openaccess.thecvf.com/content_iccv_2015/html/Sweeney_Optimizing_the_Viewing_ICCV_2015_paper.html,
Intrinsic Scene Decomposition From RGB-D images,,,https://openaccess.thecvf.com/content_iccv_2015/html/Hachama_Intrinsic_Scene_Decomposition_ICCV_2015_paper.html,
3D Hand Pose Estimation Using Randomized Decision Forest With Segmentation Index Points,,,https://openaccess.thecvf.com/content_iccv_2015/html/Li_3D_Hand_Pose_ICCV_2015_paper.html,
Accurate Camera Calibration Robust to Defocus Using a Smartphone,,,https://openaccess.thecvf.com/content_iccv_2015/html/Ha_Accurate_Camera_Calibration_ICCV_2015_paper.html,
High Quality Structure From Small Motion for Rolling Shutter Cameras,,,https://openaccess.thecvf.com/content_iccv_2015/html/Im_High_Quality_Structure_ICCV_2015_paper.html,
Photogeometric Scene Flow for High-Detail Dynamic 3D Reconstruction,,,https://openaccess.thecvf.com/content_iccv_2015/html/Gotardo_Photogeometric_Scene_Flow_ICCV_2015_paper.html,
Blur-Aware Disparity Estimation From Defocus Stereo Images,,,https://openaccess.thecvf.com/content_iccv_2015/html/Chen_Blur-Aware_Disparity_Estimation_ICCV_2015_paper.html,
Global Structure-From-Motion by Similarity Averaging,,,https://openaccess.thecvf.com/content_iccv_2015/html/Cui_Global_Structure-From-Motion_by_ICCV_2015_paper.html,
Massively Parallel Multiview Stereopsis by Surface Normal Diffusion,,,https://openaccess.thecvf.com/content_iccv_2015/html/Galliani_Massively_Parallel_Multiview_ICCV_2015_paper.html,
Variational PatchMatch MultiView Reconstruction and Refinement,,,https://openaccess.thecvf.com/content_iccv_2015/html/Heise_Variational_PatchMatch_MultiView_ICCV_2015_paper.html,
As-Rigid-As-Possible Volumetric Shape-From-Template,,,https://openaccess.thecvf.com/content_iccv_2015/html/Parashar_As-Rigid-As-Possible_Volumetric_Shape-From-Template_ICCV_2015_paper.html,
General Dynamic Scene Reconstruction From Multiple View Video,,,https://openaccess.thecvf.com/content_iccv_2015/html/Mustafa_General_Dynamic_Scene_ICCV_2015_paper.html,
The Joint Image Handbook,,,https://openaccess.thecvf.com/content_iccv_2015/html/Trager_The_Joint_Image_ICCV_2015_paper.html,
"Direct, Dense, and Deformable- Template-Based Non-Rigid 3D Reconstruction From RGB Video",,,https://openaccess.thecvf.com/content_iccv_2015/html/Yu_Direct_Dense_and_ICCV_2015_paper.html,
Single Image Pop-Up From Discriminatively Learned Parts,,,https://openaccess.thecvf.com/content_iccv_2015/html/Zhu_Single_Image_Pop-Up_ICCV_2015_paper.html,
Learning Informative Edge Maps for Indoor Scene Layout Prediction,,,https://openaccess.thecvf.com/content_iccv_2015/html/Mallya_Learning_Informative_Edge_ICCV_2015_paper.html,
Multi-View Convolutional Neural Networks for 3D Shape Recognition,,,https://openaccess.thecvf.com/content_iccv_2015/html/Su_Multi-View_Convolutional_Neural_ICCV_2015_paper.html,
Learning Analysis-by-Synthesis for 6D Pose Estimation in RGB-D Images,,,https://openaccess.thecvf.com/content_iccv_2015/html/Krull_Learning_Analysis-by-Synthesis_for_ICCV_2015_paper.html,
3D Surface Profilometry Using Phase Shifting of De Bruijn Pattern,,,https://openaccess.thecvf.com/content_iccv_2015/html/Donlic_3D_Surface_Profilometry_ICCV_2015_paper.html,
A Deep Visual Correspondence Embedding Model for Stereo Matching Costs,,,https://openaccess.thecvf.com/content_iccv_2015/html/Chen_A_Deep_Visual_ICCV_2015_paper.html,
Learning Concept Embeddings With Combined Human-Machine Expertise,,,https://openaccess.thecvf.com/content_iccv_2015/html/Wilber_Learning_Concept_Embeddings_ICCV_2015_paper.html,
"Deep Multi-Patch Aggregation Network for Image Style, Aesthetics, and Quality Estimation",,,https://openaccess.thecvf.com/content_iccv_2015/html/Lu_Deep_Multi-Patch_Aggregation_ICCV_2015_paper.html,
Towards Computational Baby Learning- A Weakly-Supervised Approach for Object Detection,,,https://openaccess.thecvf.com/content_iccv_2015/html/Liang_Towards_Computational_Baby_ICCV_2015_paper.html,
Improving Image Classification With Location Context,,,https://openaccess.thecvf.com/content_iccv_2015/html/Tang_Improving_Image_Classification_ICCV_2015_paper.html,
HICO- A Benchmark for Recognizing Human-Object Interactions in Images,,,https://openaccess.thecvf.com/content_iccv_2015/html/Chao_HICO_A_Benchmark_ICCV_2015_paper.html,
Delving Deep into Rectifiers- Surpassing Human-Level Performance on ImageNet Classification,,,https://openaccess.thecvf.com/content_iccv_2015/html/He_Delving_Deep_into_ICCV_2015_paper.html,
Continuous Pose Estimation With a Spatial Ensemble of Fisher Regressors,,,https://openaccess.thecvf.com/content_iccv_2015/html/Fenzi_Continuous_Pose_Estimation_ICCV_2015_paper.html,
Adaptive Hashing for Fast Similarity Search,,,https://openaccess.thecvf.com/content_iccv_2015/html/Cakir_Adaptive_Hashing_for_ICCV_2015_paper.html,
Single Image 3D Without a Single 3D Image,,,https://openaccess.thecvf.com/content_iccv_2015/html/Fouhey_Single_Image_3D_ICCV_2015_paper.html,
Cross-Domain Image Retrieval With a Dual Attribute-Aware Ranking Network,,,https://openaccess.thecvf.com/content_iccv_2015/html/Huang_Cross-Domain_Image_Retrieval_ICCV_2015_paper.html,
Attribute-Graph- A Graph Based Approach to Image Ranking,,,https://openaccess.thecvf.com/content_iccv_2015/html/Prabhu_Attribute-Graph_A_Graph_ICCV_2015_paper.html,
Contextual Action Recognition With R-CNN,,,https://openaccess.thecvf.com/content_iccv_2015/html/Gkioxari_Contextual_Action_Recognition_ICCV_2015_paper.html,
What Makes an Object Memorable-,,,https://openaccess.thecvf.com/content_iccv_2015/html/Dubey_What_Makes_an_ICCV_2015_paper.html,
kNN Hashing With Factorized Neighborhood Representation,,,https://openaccess.thecvf.com/content_iccv_2015/html/Ding_kNN_Hashing_With_ICCV_2015_paper.html,
Multi-View Complementary Hash Tables for Nearest Neighbor Search,,,https://openaccess.thecvf.com/content_iccv_2015/html/Liu_Multi-View_Complementary_Hash_ICCV_2015_paper.html,
Scalable Person Re-Identification- A Benchmark,,,https://openaccess.thecvf.com/content_iccv_2015/html/Zheng_Scalable_Person_Re-Identification_ICCV_2015_paper.html,
MMSS- Multi-Modal Sharable and Specific Feature Learning for RGB-D Object Recognition,,,https://openaccess.thecvf.com/content_iccv_2015/html/Wang_MMSS_Multi-Modal_Sharable_ICCV_2015_paper.html,
Object Detection via a Multi-Region and Semantic Segmentation-Aware CNN Model,,,https://openaccess.thecvf.com/content_iccv_2015/html/Gidaris_Object_Detection_via_ICCV_2015_paper.html,
Neural Activation Constellations- Unsupervised Part Model Discovery With Convolutional Networks,,,https://openaccess.thecvf.com/content_iccv_2015/html/Simon_Neural_Activation_Constellations_ICCV_2015_paper.html,
Cascaded Sparse Spatial Bins for Efficient and Effective Generic Object Detection,,,https://openaccess.thecvf.com/content_iccv_2015/html/Novotny_Cascaded_Sparse_Spatial_ICCV_2015_paper.html,
Probabilistic Label Relation Graphs With Ising Models,,,https://openaccess.thecvf.com/content_iccv_2015/html/Ding_Probabilistic_Label_Relation_ICCV_2015_paper.html,
Predicting Good Features for Image Geo-Localization Using Per-Bundle VLAD,,,https://openaccess.thecvf.com/content_iccv_2015/html/Kim_Predicting_Good_Features_ICCV_2015_paper.html,
Task-Driven Feature Pooling for Image Classification,,,https://openaccess.thecvf.com/content_iccv_2015/html/Xie_Task-Driven_Feature_Pooling_ICCV_2015_paper.html,
Cutting Edge- Soft Correspondences in Multimodal Scene Parsing,,,https://openaccess.thecvf.com/content_iccv_2015/html/Namin_Cutting_Edge_Soft_ICCV_2015_paper.html,
One Shot Learning via Compositions of Meaningful Patches,,,https://openaccess.thecvf.com/content_iccv_2015/html/Wong_One_Shot_Learning_ICCV_2015_paper.html,
FASText- Efficient Unconstrained Scene Text Detector,,,https://openaccess.thecvf.com/content_iccv_2015/html/Busta_FASText_Efficient_Unconstrained_ICCV_2015_paper.html,
Multi-Scale Recognition With DAG-CNNs,,,https://openaccess.thecvf.com/content_iccv_2015/html/Yang_Multi-Scale_Recognition_With_ICCV_2015_paper.html,
Relaxed Multiple-Instance SVM With Application to Object Discovery,,,https://openaccess.thecvf.com/content_iccv_2015/html/Wang_Relaxed_Multiple-Instance_SVM_ICCV_2015_paper.html,
Im2Calories- Towards an Automated Mobile Vision Food Diary,,,https://openaccess.thecvf.com/content_iccv_2015/html/Meyers_Im2Calories_Towards_an_ICCV_2015_paper.html,
LEWIS- Latent Embeddings for Word Images and their Semantics,,,https://openaccess.thecvf.com/content_iccv_2015/html/Gordo_LEWIS_Latent_Embeddings_ICCV_2015_paper.html,
Per-Sample Kernel Adaptation for Visual Recognition and Grouping,,,https://openaccess.thecvf.com/content_iccv_2015/html/Antic_Per-Sample_Kernel_Adaptation_ICCV_2015_paper.html,
Fine-Grained Change Detection of Misaligned Scenes With Varied Illuminations,,,https://openaccess.thecvf.com/content_iccv_2015/html/Feng_Fine-Grained_Change_Detection_ICCV_2015_paper.html,
Aggregating Local Deep Features for Image Retrieval,,,https://openaccess.thecvf.com/content_iccv_2015/html/Babenko_Aggregating_Local_Deep_ICCV_2015_paper.html,
Learning Deep Object Detectors From 3D Models,,,https://openaccess.thecvf.com/content_iccv_2015/html/Peng_Learning_Deep_Object_ICCV_2015_paper.html,
Harvesting Discriminative Meta Objects With Deep CNN Features for Scene Classification,,,https://openaccess.thecvf.com/content_iccv_2015/html/Wu_Harvesting_Discriminative_Meta_ICCV_2015_paper.html,
Scalable Nonlinear Embeddings for Semantic Category-Based Image Retrieval,,,https://openaccess.thecvf.com/content_iccv_2015/html/Sharma_Scalable_Nonlinear_Embeddings_ICCV_2015_paper.html,
Person Re-Identification Ranking Optimisation by Discriminant Context Information Analysis,,,https://openaccess.thecvf.com/content_iccv_2015/html/Garcia_Person_Re-Identification_Ranking_ICCV_2015_paper.html,
Unsupervised Generation of a Viewpoint Annotated Car Dataset From Videos,,,https://openaccess.thecvf.com/content_iccv_2015/html/Sedaghat_Unsupervised_Generation_of_ICCV_2015_paper.html,
Structured Indoor Modeling,,,https://openaccess.thecvf.com/content_iccv_2015/html/Ikehata_Structured_Indoor_Modeling_ICCV_2015_paper.html,
3D Time-Lapse Reconstruction From Internet Photos,,,https://openaccess.thecvf.com/content_iccv_2015/html/Martin-Brualla_3D_Time-Lapse_Reconstruction_ICCV_2015_paper.html,
"Global, Dense Multiscale Reconstruction for a Billion Points",,,https://openaccess.thecvf.com/content_iccv_2015/html/Ummenhofer_Global_Dense_Multiscale_ICCV_2015_paper.html,
