title,keywords,group,link,pdf
Flow Fields- Dense Correspondence Fields for Highly Accurate Large Displacement Optical Flow Estimation,,,https://openaccess.thecvf.com/content_iccv_2015/html/Bailer_Flow_Fields_Dense_ICCV_2015_paper.html,
Dense Semantic Correspondence Where Every Pixel is a Classifier,,,https://openaccess.thecvf.com/content_iccv_2015/html/Bristow_Dense_Semantic_Correspondence_ICCV_2015_paper.html,
Multi-Image Matching via Fast Alternating Minimization,,,https://openaccess.thecvf.com/content_iccv_2015/html/Zhou_Multi-Image_Matching_via_ICCV_2015_paper.html,
Differential Recurrent Neural Networks for Action Recognition,,,https://openaccess.thecvf.com/content_iccv_2015/html/Veeriah_Differential_Recurrent_Neural_ICCV_2015_paper.html,
Similarity Gaussian Process Latent Variable Model for Multi-Modal Data Analysis,,,https://openaccess.thecvf.com/content_iccv_2015/html/Song_Similarity_Gaussian_Process_ICCV_2015_paper.html,
Learning Ensembles of Potential Functions for Structured Prediction With Latent Variables,,,https://openaccess.thecvf.com/content_iccv_2015/html/Hajimirsadeghi_Learning_Ensembles_of_ICCV_2015_paper.html,
Simultaneous Deep Transfer Across Domains and Tasks,,,https://openaccess.thecvf.com/content_iccv_2015/html/Tzeng_Simultaneous_Deep_Transfer_ICCV_2015_paper.html,
Low Dimensional Explicit Feature Maps,,,https://openaccess.thecvf.com/content_iccv_2015/html/Chum_Low_Dimensional_Explicit_ICCV_2015_paper.html,
Unsupervised Learning of Spatiotemporally Coherent Metrics,,,https://openaccess.thecvf.com/content_iccv_2015/html/Goroshin_Unsupervised_Learning_of_ICCV_2015_paper.html,
Multi-Label Cross-Modal Retrieval,,,https://openaccess.thecvf.com/content_iccv_2015/html/Ranjan_Multi-Label_Cross-Modal_Retrieval_ICCV_2015_paper.html,
Improving Ferns Ensembles by Sparsifying and Quantising Posterior Probabilities,,,https://openaccess.thecvf.com/content_iccv_2015/html/Rodriguez_Improving_Ferns_Ensembles_ICCV_2015_paper.html,
Beyond Gauss- Image-Set Matching on the Riemannian Manifold of PDFs,,,https://openaccess.thecvf.com/content_iccv_2015/html/Harandi_Beyond_Gauss_Image-Set_ICCV_2015_paper.html,
Unsupervised Domain Adaptation With Imbalanced Cross-Domain Data,,,https://openaccess.thecvf.com/content_iccv_2015/html/Hsu_Unsupervised_Domain_Adaptation_ICCV_2015_paper.html,
"Secrets of Matrix Factorization- Approximations, Numerics, Manifold Optimization and Random Restarts",,,https://openaccess.thecvf.com/content_iccv_2015/html/Hong_Secrets_of_Matrix_ICCV_2015_paper.html,
Geometry-Aware Deep Transform,,,https://openaccess.thecvf.com/content_iccv_2015/html/Huang_Geometry-Aware_Deep_Transform_ICCV_2015_paper.html,
Learning Binary Codes for Maximum Inner Product Search,,,https://openaccess.thecvf.com/content_iccv_2015/html/Shen_Learning_Binary_Codes_ICCV_2015_paper.html,
ML-MG- Multi-Label Learning With Missing Labels Using a Mixed Graph,,,https://openaccess.thecvf.com/content_iccv_2015/html/Wu_ML-MG_Multi-Label_Learning_ICCV_2015_paper.html,
Zero-Shot Learning via Semantic Similarity Embedding,,,https://openaccess.thecvf.com/content_iccv_2015/html/Zhang_Zero-Shot_Learning_via_ICCV_2015_paper.html,
Bayesian Model Adaptation for Crowd Counts,,,https://openaccess.thecvf.com/content_iccv_2015/html/Liu_Bayesian_Model_Adaptation_ICCV_2015_paper.html,
An NMF Perspective on Binary Hashing,,,https://openaccess.thecvf.com/content_iccv_2015/html/Mukherjee_An_NMF_Perspective_ICCV_2015_paper.html,
Multi-View Domain Generalization for Visual Recognition,,,https://openaccess.thecvf.com/content_iccv_2015/html/Niu_Multi-View_Domain_Generalization_ICCV_2015_paper.html,
Infinite Feature Selection,,,https://openaccess.thecvf.com/content_iccv_2015/html/Roffo_Infinite_Feature_Selection_ICCV_2015_paper.html,
Semi-Supervised Zero-Shot Classification With Label Representation Learning,,,https://openaccess.thecvf.com/content_iccv_2015/html/Li_Semi-Supervised_Zero-Shot_Classification_ICCV_2015_paper.html,
A Supervised Low-Rank Method for Learning Invariant Subspaces,,,https://openaccess.thecvf.com/content_iccv_2015/html/Siyahjani_A_Supervised_Low-Rank_ICCV_2015_paper.html,
Recursive Frechet Mean Computation on the Grassmannian and its Applications to Computer Vision,,,https://openaccess.thecvf.com/content_iccv_2015/html/Chakraborty_Recursive_Frechet_Mean_ICCV_2015_paper.html,
Multi-View Subspace Clustering,,,https://openaccess.thecvf.com/content_iccv_2015/html/Gao_Multi-View_Subspace_Clustering_ICCV_2015_paper.html,
Predicting Deep Zero-Shot Convolutional Neural Networks Using Textual Descriptions,,,https://openaccess.thecvf.com/content_iccv_2015/html/Ba_Predicting_Deep_Zero-Shot_ICCV_2015_paper.html,
Structured Feature Selection,,,https://openaccess.thecvf.com/content_iccv_2015/html/Gao_Structured_Feature_Selection_ICCV_2015_paper.html,
Conditional High-Order Boltzmann Machine- A Supervised Learning Model for Relation Learning,,,https://openaccess.thecvf.com/content_iccv_2015/html/Huang_Conditional_High-Order_Boltzmann_ICCV_2015_paper.html,
Learning Image and User Features for Recommendation in Social Networks,,,https://openaccess.thecvf.com/content_iccv_2015/html/Geng_Learning_Image_and_ICCV_2015_paper.html,
Dual-Feature Warping-Based Motion Model Estimation,,,https://openaccess.thecvf.com/content_iccv_2015/html/Li_Dual-Feature_Warping-Based_Motion_ICCV_2015_paper.html,
An Adaptive Data Representation for Robust Point-Set Registration and Merging,,,https://openaccess.thecvf.com/content_iccv_2015/html/Campbell_An_Adaptive_Data_ICCV_2015_paper.html,
Local Subspace Collaborative Tracking,,,https://openaccess.thecvf.com/content_iccv_2015/html/Ma_Local_Subspace_Collaborative_ICCV_2015_paper.html,
Learning Spatially Regularized Correlation Filters for Visual Tracking,,,https://openaccess.thecvf.com/content_iccv_2015/html/Danelljan_Learning_Spatially_Regularized_ICCV_2015_paper.html,
SpeDo- 6 DOF Ego-Motion Sensor Using Speckle Defocus Imaging,,,https://openaccess.thecvf.com/content_iccv_2015/html/Jo_SpeDo_6_DOF_ICCV_2015_paper.html,
Unsupervised Trajectory Clustering via Adaptive Multi-Kernel-Based Shrinkage,,,https://openaccess.thecvf.com/content_iccv_2015/html/Xu_Unsupervised_Trajectory_Clustering_ICCV_2015_paper.html,
TRIC-track- Tracking by Regression With Incrementally Learned Cascades,,,https://openaccess.thecvf.com/content_iccv_2015/html/Wang_TRIC-track_Tracking_by_ICCV_2015_paper.html,
Recurrent Network Models for Human Dynamics,,,https://openaccess.thecvf.com/content_iccv_2015/html/Fragkiadaki_Recurrent_Network_Models_ICCV_2015_paper.html,
Contour Flow- Middle-Level Motion Estimation by Combining Motion Segmentation and Contour Alignment,,,https://openaccess.thecvf.com/content_iccv_2015/html/Di_Contour_Flow_Middle-Level_ICCV_2015_paper.html,
FollowMe- Efficient Online Min-Cost Flow Tracking With Bounded Memory and Computation,,,https://openaccess.thecvf.com/content_iccv_2015/html/Lenz_FollowMe_Efficient_Online_ICCV_2015_paper.html,
Learning to Divide and Conquer for Online Multi-Target Tracking,,,https://openaccess.thecvf.com/content_iccv_2015/html/Solera_Learning_to_Divide_ICCV_2015_paper.html,
Minimizing Human Effort in Interactive Tracking by Incremental Learning of Model Parameters,,,https://openaccess.thecvf.com/content_iccv_2015/html/Ciptadi_Minimizing_Human_Effort_ICCV_2015_paper.html,
A Novel Representation of Parts for Accurate 3D Object Detection and Tracking in Monocular Images,,,https://openaccess.thecvf.com/content_iccv_2015/html/Crivellaro_A_Novel_Representation_ICCV_2015_paper.html,
Linearization to Nonlinear Learning for Visual Tracking,,,https://openaccess.thecvf.com/content_iccv_2015/html/Ma_Linearization_to_Nonlinear_ICCV_2015_paper.html,
Self-Occlusions and Disocclusions in Causal Video Object Segmentation,,,https://openaccess.thecvf.com/content_iccv_2015/html/Yang_Self-Occlusions_and_Disocclusions_ICCV_2015_paper.html,
Large Displacement 3D Scene Flow With Occlusion Reasoning,,,https://openaccess.thecvf.com/content_iccv_2015/html/Zanfir_Large_Displacement_3D_ICCV_2015_paper.html,
Co-Interest Person Detection From Multiple Wearable Camera Videos,,,https://openaccess.thecvf.com/content_iccv_2015/html/Lin_Co-Interest_Person_Detection_ICCV_2015_paper.html,
Sparse Dynamic 3D Reconstruction From Unsynchronized Videos,,,https://openaccess.thecvf.com/content_iccv_2015/html/Zheng_Sparse_Dynamic_3D_ICCV_2015_paper.html,
Category-Blind Human Action Recognition- A Practical Recognition System,,,https://openaccess.thecvf.com/content_iccv_2015/html/Li_Category-Blind_Human_Action_ICCV_2015_paper.html,
Temporal Subspace Clustering for Human Motion Segmentation,,,https://openaccess.thecvf.com/content_iccv_2015/html/Li_Temporal_Subspace_Clustering_ICCV_2015_paper.html,
Weakly-Supervised Alignment of Video With Text,,,https://openaccess.thecvf.com/content_iccv_2015/html/Bojanowski_Weakly-Supervised_Alignment_of_ICCV_2015_paper.html,
Learning Temporal Embeddings for Complex Video Analysis,,,https://openaccess.thecvf.com/content_iccv_2015/html/Ramanathan_Learning_Temporal_Embeddings_ICCV_2015_paper.html,
Unsupervised Semantic Parsing of Video Collections,,,https://openaccess.thecvf.com/content_iccv_2015/html/Sener_Unsupervised_Semantic_Parsing_ICCV_2015_paper.html,
Learning Spatiotemporal Features With 3D Convolutional Networks,,,https://openaccess.thecvf.com/content_iccv_2015/html/Tran_Learning_Spatiotemporal_Features_ICCV_2015_paper.html,
Temporal Perception and Prediction in Ego-Centric Video,,,https://openaccess.thecvf.com/content_iccv_2015/html/Zhou_Temporal_Perception_and_ICCV_2015_paper.html,
Describing Videos by Exploiting Temporal Structure,,,https://openaccess.thecvf.com/content_iccv_2015/html/Yao_Describing_Videos_by_ICCV_2015_paper.html,
Person Re-Identification With Discriminatively Trained Viewpoint Invariant Dictionaries,,,https://openaccess.thecvf.com/content_iccv_2015/html/Karanam_Person_Re-Identification_With_ICCV_2015_paper.html,
Storyline Representation of Egocentric Videos With an Applications to Story-Based Search,,,https://openaccess.thecvf.com/content_iccv_2015/html/Xiong_Storyline_Representation_of_ICCV_2015_paper.html,
Sequence to Sequence - Video to Text,,,https://openaccess.thecvf.com/content_iccv_2015/html/Venugopalan_Sequence_to_Sequence_ICCV_2015_paper.html,
Context Aware Active Learning of Activity Recognition Models,,,https://openaccess.thecvf.com/content_iccv_2015/html/Hasan_Context_Aware_Active_ICCV_2015_paper.html,
Action Recognition by Hierarchical Mid-Level Action Elements,,,https://openaccess.thecvf.com/content_iccv_2015/html/Lan_Action_Recognition_by_ICCV_2015_paper.html,
Selecting Relevant Web Trained Concepts for Automated Event Retrieval,,,https://openaccess.thecvf.com/content_iccv_2015/html/Singh_Selecting_Relevant_Web_ICCV_2015_paper.html,
Beyond Covariance- Feature Representation With Nonlinear Kernel Matrices,,,https://openaccess.thecvf.com/content_iccv_2015/html/Wang_Beyond_Covariance_Feature_ICCV_2015_paper.html,
Multiresolution Hierarchy Co-Clustering for Semantic Segmentation in Sequences With Small Variations,,,https://openaccess.thecvf.com/content_iccv_2015/html/Varas_Multiresolution_Hierarchy_Co-Clustering_ICCV_2015_paper.html,
Objects2action- Classifying and Localizing Actions Without Any Video Example,,,https://openaccess.thecvf.com/content_iccv_2015/html/Jain_Objects2action_Classifying_and_ICCV_2015_paper.html,
Human Action Recognition Using Factorized Spatio-Temporal Convolutional Networks,,,https://openaccess.thecvf.com/content_iccv_2015/html/Sun_Human_Action_Recognition_ICCV_2015_paper.html,
Bayesian Non-Parametric Inference for Manifold Based MoCap Representation,,,https://openaccess.thecvf.com/content_iccv_2015/html/Natola_Bayesian_Non-Parametric_Inference_ICCV_2015_paper.html,
Semantic Video Entity Linking Based on Visual Content and Metadata,,,https://openaccess.thecvf.com/content_iccv_2015/html/Li_Semantic_Video_Entity_ICCV_2015_paper.html,
Love Thy Neighbors- Image Annotation by Exploiting Image Metadata,,,https://openaccess.thecvf.com/content_iccv_2015/html/Johnson_Love_Thy_Neighbors_ICCV_2015_paper.html,
Unsupervised Extraction of Video Highlights Via Robust Recurrent Auto-Encoders,,,https://openaccess.thecvf.com/content_iccv_2015/html/Yang_Unsupervised_Extraction_of_ICCV_2015_paper.html,
Learning Visual Clothing Style With Heterogeneous Dyadic Co-Occurrences,,,https://openaccess.thecvf.com/content_iccv_2015/html/Veit_Learning_Visual_Clothing_ICCV_2015_paper.html,
Text Flow- A Unified Text Detection System in Natural Scene Images,,,https://openaccess.thecvf.com/content_iccv_2015/html/Tian_Text_Flow_A_ICCV_2015_paper.html,
"Uncovering Interactions and Interactors- Joint Estimation of Head, Body Orientation and F-Formations From Surveillance Videos",,,https://openaccess.thecvf.com/content_iccv_2015/html/Ricci_Uncovering_Interactions_and_ICCV_2015_paper.html,
Generating Notifications for Missing Actions- Dont Forget to Turn the Lights Off!,,,https://openaccess.thecvf.com/content_iccv_2015/html/Soran_Generating_Notifications_for_ICCV_2015_paper.html,
Partial Person Re-Identification,,,https://openaccess.thecvf.com/content_iccv_2015/html/Zheng_Partial_Person_Re-Identification_ICCV_2015_paper.html,
Shape Interaction Matrix Revisited and Robustified- Efficient Subspace Clustering With Corrupted and Incomplete Data,,,https://openaccess.thecvf.com/content_iccv_2015/html/Ji_Shape_Interaction_Matrix_ICCV_2015_paper.html,
Multiple Hypothesis Tracking Revisited,,,https://openaccess.thecvf.com/content_iccv_2015/html/Kim_Multiple_Hypothesis_Tracking_ICCV_2015_paper.html,
Learning to Track- Online Multi-Object Tracking by Decision Making,,,https://openaccess.thecvf.com/content_iccv_2015/html/Xiang_Learning_to_Track_ICCV_2015_paper.html,
