title,keywords,group,link,pdf
Neurogenesis-Inspired Dictionary Learning- Online Model Adaption in a Changing World,,,,https://www.ijcai.org/proceedings/0235.pdf
Towards Understanding the Invertibility of Convolutional Neural Networks,,,,https://www.ijcai.org/proceedings/0236.pdf
Sample Efficient Policy Search for Optimal Stopping Domains,,,,https://www.ijcai.org/proceedings/0237.pdf
Extracting Visual Knowledge from the Web with Multimodal Learning,,,,https://www.ijcai.org/proceedings/0238.pdf
DeepFM- A Factorization-Machine based Neural Network for CTR Prediction,,,,https://www.ijcai.org/proceedings/0239.pdf
A Density-based Nonparametric Model for Online Event Discovery from the Social Media Data,,,,https://www.ijcai.org/proceedings/0240.pdf
Exclusivity Regularized Machine- A New Ensemble SVM Classifier,,,,https://www.ijcai.org/proceedings/0241.pdf
ROUTE- Robust Outlier Estimation for Low Rank Matrix Recovery,,,,https://www.ijcai.org/proceedings/0242.pdf
Improved Deep Embedded Clustering with Local Structure Preservation,,,,https://www.ijcai.org/proceedings/0243.pdf
Robust Asymmetric Bayesian Adaptive Matrix Factorization,,,,https://www.ijcai.org/proceedings/0244.pdf
SitNet- Discrete Similarity Transfer Network for Zero-shot Hashing,,,,https://www.ijcai.org/proceedings/0245.pdf
Synthesizing Samples for Zero-shot Learning,,,,https://www.ijcai.org/proceedings/0246.pdf
Understanding Users Budgets for Recommendation with Hierarchical Poisson Factorization,,,,https://www.ijcai.org/proceedings/0247.pdf
Improved Strong Worst-case Upper Bounds for MDP Planning,,,,https://www.ijcai.org/proceedings/0248.pdf
Instability Prediction in Power Systems using Recurrent Neural Networks,,,,https://www.ijcai.org/proceedings/0249.pdf
Knowledge Transfer for Out-of-Knowledge-Base Entities - A Graph Neural Network Approach,,,,https://www.ijcai.org/proceedings/0250.pdf
Orthogonal and Nonnegative Graph Reconstruction for Large Scale Clustering,,,,https://www.ijcai.org/proceedings/0251.pdf
Self-paced Mixture of Regressions,,,,https://www.ijcai.org/proceedings/0252.pdf
Online Multitask Relative Similarity Learning,,,,https://www.ijcai.org/proceedings/0253.pdf
Nonlinear Maximum Margin Multi-View Learning with Adaptive Kernel,,,,https://www.ijcai.org/proceedings/0254.pdf
Category-aware Next Point-of-Interest Recommendation via Listwise Bayesian Personalized Ranking,,,,https://www.ijcai.org/proceedings/0255.pdf
Storage Fit Learning with Unlabeled Data,,,,https://www.ijcai.org/proceedings/0256.pdf
Fast Recursive Low-rank Tensor Learning for Regression,,,,https://www.ijcai.org/proceedings/0257.pdf
Diversifying Personalized Recommendation with User-session Context,,,,https://www.ijcai.org/proceedings/0258.pdf
Semi-supervised Max-margin Topic Model with Manifold Posterior Regularization,,,,https://www.ijcai.org/proceedings/0259.pdf
Mention Recommendation for Twitter with End-to-end Memory Network,,,,https://www.ijcai.org/proceedings/0260.pdf
Cost-Effective Active Learning from Diverse Labelers,,,,https://www.ijcai.org/proceedings/0261.pdf
Multi-instance multi-label active learning,,,,https://www.ijcai.org/proceedings/0262.pdf
Cross-modal Common Representation Learning by Hybrid Transfer Network,,,,https://www.ijcai.org/proceedings/0263.pdf
Incremental Matrix Factorization- A Linear Feature Transformation Perspective,,,,https://www.ijcai.org/proceedings/0264.pdf
Enhancing the Unified Features to Locate Buggy Files by Exploiting the Sequential Nature of Source Code,,,,https://www.ijcai.org/proceedings/0265.pdf
Ordinal Zero-Shot Learning,,,,https://www.ijcai.org/proceedings/0266.pdf
Adaptive Learning Rate via Covariance Matrix Based Preconditioning for Deep Neural Networks,,,,https://www.ijcai.org/proceedings/0267.pdf
Privacy Issues Regarding the Application of DNNs to Activity-Recognition using Wearables and Its Countermeasures by Use of Adversarial Training,,,,https://www.ijcai.org/proceedings/0268.pdf
Embedding-based Representation of Categorical Data by Hierarchical Value Coupling Learning,,,,https://www.ijcai.org/proceedings/0269.pdf
Semi-supervised Learning over Heterogeneous Information Networks by Ensemble of Meta-graph Guided Random Walks,,,,https://www.ijcai.org/proceedings/0270.pdf
Exploration of Tree-based Hierarchical Softmax for Recurrent Language Models,,,,https://www.ijcai.org/proceedings/0271.pdf
Theoretic Analysis and Extremely Easy Algorithms for Domain Adaptive Feature Learning,,,,https://www.ijcai.org/proceedings/0272.pdf
Variational Deep Embedding- An Unsupervised and Generative Approach to Clustering,,,,https://www.ijcai.org/proceedings/0273.pdf
Improving Classification Accuracy of Feedforward Neural Networks for Spiking Neuromorphic Chips,,,,https://www.ijcai.org/proceedings/0274.pdf
Confusion Graph- Detecting Confusion Communities in Large Scale Image Classification,,,,https://www.ijcai.org/proceedings/0275.pdf
A Functional Dynamic Boltzmann Machine,,,,https://www.ijcai.org/proceedings/0276.pdf
Modelling the Working Week for Multi-Step Forecasting using Gaussian Process Regression,,,,https://www.ijcai.org/proceedings/0277.pdf
Bernoulli Rank-1 Bandits for Click Feedback,,,,https://www.ijcai.org/proceedings/0278.pdf
Learning deep structured network for weakly supervised change detection,,,,https://www.ijcai.org/proceedings/0279.pdf
DeepStory- Video Story QA by Deep Embedded Memory Networks,,,,https://www.ijcai.org/proceedings/0280.pdf
Efficiency Through Procrastination- Approximately Optimal Algorithm Configuration with Runtime Guarantees,,,,https://www.ijcai.org/proceedings/0281.pdf
Decreasing Uncertainty in Planning with State Prediction,,,,https://www.ijcai.org/proceedings/0282.pdf
Learning Latest Classifiers without Additional Labeled Data,,,,https://www.ijcai.org/proceedings/0283.pdf
Earth Movers Distance Pooling over Siamese LSTMs for Automatic Short Answer Grading,,,,https://www.ijcai.org/proceedings/0284.pdf
Saliency Guided End-to-End Learning for Weakly Supervised Object Detection,,,,https://www.ijcai.org/proceedings/0285.pdf
Basket-Sensitive Personalized Item Recommendation,,,,https://www.ijcai.org/proceedings/0286.pdf
Learning Sparse Representations in Reinforcement Learning with Sparse Coding,,,,https://www.ijcai.org/proceedings/0287.pdf
Semantic Visualization for Short Texts with Word Embeddings,,,,https://www.ijcai.org/proceedings/0288.pdf
Name Nationality Classification with Recurrent Neural Networks,,,,https://www.ijcai.org/proceedings/0289.pdf
Constrained Bayesian Reinforcement Learning via Approximate Linear Programming,,,,https://www.ijcai.org/proceedings/0290.pdf
High Dimensional Bayesian Optimization using Dropout,,,,https://www.ijcai.org/proceedings/0291.pdf
Effective Representing of Information Network by Variational Autoencoder,,,,https://www.ijcai.org/proceedings/0292.pdf
Self-paced Convolutional Neural Networks,,,,https://www.ijcai.org/proceedings/0293.pdf
Learning Users Intrinsic and Extrinsic Interests for Point-of-Interest Recommendation- A Unified Approach,,,,https://www.ijcai.org/proceedings/0294.pdf
Efficient Kernel Selection via Spectral Analysis,,,,https://www.ijcai.org/proceedings/0295.pdf
Improving the Generalization Performance of Multi-class SVM via Angular Regularization,,,,https://www.ijcai.org/proceedings/0296.pdf
Large-scale Subspace Clustering by Fast Regression Coding,,,,https://www.ijcai.org/proceedings/0297.pdf
Projective Low-rank Subspace Clustering via Learning Deep Encoder,,,,https://www.ijcai.org/proceedings/0298.pdf
Radar- Residual Analysis for Anomaly Detection in Attributed Networks,,,,https://www.ijcai.org/proceedings/0299.pdf
Reconstruction-based Unsupervised Feature Selection- An Embedded Approach,,,,https://www.ijcai.org/proceedings/0300.pdf
Multi-Stream Deep Similarity Learning Networks for Visual Tracking,,,,https://www.ijcai.org/proceedings/0301.pdf
Affinity Learning for Mixed Data Clustering,,,,https://www.ijcai.org/proceedings/0302.pdf
Online Robust Low-Rank Tensor Learning,,,,https://www.ijcai.org/proceedings/0303.pdf
Self-paced Compensatory Deep Boltzmann Machine for Semi-Structured Document Embedding,,,,https://www.ijcai.org/proceedings/0304.pdf
Person Re-Identification by Deep Joint Learning of Multi-Loss Classification,,,,https://www.ijcai.org/proceedings/0305.pdf
Locality Adaptive Discriminant Analysis,,,,https://www.ijcai.org/proceedings/0306.pdf
MAM-RNN- Multi-level Attention Model Based RNN for Video Captioning,,,,https://www.ijcai.org/proceedings/0307.pdf
Classification and Representation Joint Learning via Deep Networks,,,,https://www.ijcai.org/proceedings/0308.pdf
CFNN- Correlation Filter Neural Network for Visual Object Tracking,,,,https://www.ijcai.org/proceedings/0309.pdf
Demystifying Neural Style Transfer,,,,https://www.ijcai.org/proceedings/0310.pdf
End-to-End Adversarial Memory Network for Cross-domain Sentiment Classification,,,,https://www.ijcai.org/proceedings/0311.pdf
Integrating Specialized Classifiers Based on Continuous Time Markov Chain,,,,https://www.ijcai.org/proceedings/0312.pdf
Incomplete Attribute Learning with auxiliary labels,,,,https://www.ijcai.org/proceedings/0313.pdf
LoCaTe- Influence Quantification for Location Promotion in Location-based Social Networks,,,,https://www.ijcai.org/proceedings/0314.pdf
Discriminative Deep Hashing for Scalable Face Image Retrieval,,,,https://www.ijcai.org/proceedings/0315.pdf
Hybrid Neural Networks for Learning the Trend in Time Series,,,,https://www.ijcai.org/proceedings/0316.pdf
Regional Concept Drift Detection and Density Synchronized Drift Adaptation,,,,https://www.ijcai.org/proceedings/0317.pdf
"Deep Neural Networks for High Dimension, Low Sample Size Data",,,,https://www.ijcai.org/proceedings/0318.pdf
Locally Linear Factorization Machines,,,,https://www.ijcai.org/proceedings/0319.pdf
DeepFacade- A Deep Learning Approach to Facade Parsing,,,,https://www.ijcai.org/proceedings/0320.pdf
Semi-supervised Orthogonal Graph Embedding with Recursive Projections,,,,https://www.ijcai.org/proceedings/0321.pdf
Modeling Hebb Learning Rule for Unsupervised Learning,,,,https://www.ijcai.org/proceedings/0322.pdf
Fast SVM Trained by Divide-and-Conquer Anchors,,,,https://www.ijcai.org/proceedings/0323.pdf
Improving Learning-from-Crowds through Expert Validation,,,,https://www.ijcai.org/proceedings/0324.pdf
Accelerated Local Anomaly Detection via Resolving Attributed Networks,,,,https://www.ijcai.org/proceedings/0325.pdf
Cause-Effect Knowledge Acquisition and Neural Association Model for Solving A Set of Winograd Schema Problems,,,,https://www.ijcai.org/proceedings/0326.pdf
Learning Concise Representations of Users Influences through Online Behaviors,,,,https://www.ijcai.org/proceedings/0327.pdf
Adaptive Group Sparse Multi-task Learning via Trace Lasso,,,,https://www.ijcai.org/proceedings/0328.pdf
Understanding How Feature Structure Transfers in Transfer Learning,,,,https://www.ijcai.org/proceedings/0329.pdf
Deep Ordinal Regression Based on Data Relationship for Small Datasets,,,,https://www.ijcai.org/proceedings/0330.pdf
Learning User Dependencies for Recommendation,,,,https://www.ijcai.org/proceedings/0331.pdf
JM-Net and Cluster-SVM for Aerial Scene Classification,,,,https://www.ijcai.org/proceedings/0332.pdf
Dynamic Weighted Majority for Incremental Learning of Imbalanced Data Streams with Concept Drift,,,,https://www.ijcai.org/proceedings/0333.pdf
Sampling for Approximate Maximum Search in Factorized Tensor,,,,https://www.ijcai.org/proceedings/0334.pdf
Image Matching via Loopy RNN,,,,https://www.ijcai.org/proceedings/0335.pdf
Tracking the Evolution of Customer Purchase Behavior Segmentation via a Fragmentation-Coagulation Process,,,,https://www.ijcai.org/proceedings/0336.pdf
Adaptive Semi-Supervised Learning with Discriminative Least Squares Regression,,,,https://www.ijcai.org/proceedings/0337.pdf
EigenNet- Towards Fast and Structural Learning of Deep Neural Networks,,,,https://www.ijcai.org/proceedings/0338.pdf
Symmetric Non-negative Latent Factor Models for Undirected Large Networks,,,,https://www.ijcai.org/proceedings/0339.pdf
Exploiting High-Order Information in Heterogeneous Multi-Task Feature Learning,,,,https://www.ijcai.org/proceedings/0340.pdf
General Heterogeneous Transfer Distance Metric Learning via Knowledge Fragments Transfer,,,,https://www.ijcai.org/proceedings/0341.pdf
WALKING WALKing walking- Action Recognition from Action Echoes,,,,https://www.ijcai.org/proceedings/0342.pdf
Cross-Domain Recommendation- An Embedding and Mapping Approach,,,,https://www.ijcai.org/proceedings/0343.pdf
Count-Based Exploration in Feature Space for Reinforcement Learning,,,,https://www.ijcai.org/proceedings/0344.pdf
Exemplar-centered Supervised Shallow Parametric Data Embedding,,,,https://www.ijcai.org/proceedings/0345.pdf
Logistic Markov Decision Processes,,,,https://www.ijcai.org/proceedings/0346.pdf
Beyond the Nystrom Approximation- Speeding up Spectral Clustering using Uniform Sampling and Weighted Kernel k-means,,,,https://www.ijcai.org/proceedings/0347.pdf
Rescale-Invariant SVM for Binary Classification,,,,https://www.ijcai.org/proceedings/0348.pdf
Completely Heterogeneous Transfer Learning with Attention - What And What Not To Transfer,,,,https://www.ijcai.org/proceedings/0349.pdf
Thresholding Bandits with Augmented UCB,,,,https://www.ijcai.org/proceedings/0350.pdf
Self-Paced Multitask Learning with Shared Knowledge,,,,https://www.ijcai.org/proceedings/0351.pdf
Learning Feature Engineering for Classification,,,,https://www.ijcai.org/proceedings/0352.pdf
Autonomous Task Sequencing for Customized Curriculum Design in Reinforcement Learning,,,,https://www.ijcai.org/proceedings/0353.pdf
Large-scale Online Kernel Learning with Random Feature Reparameterization,,,,https://www.ijcai.org/proceedings/0354.pdf
Discriminative Bayesian Nonparametric Clustering,,,,https://www.ijcai.org/proceedings/0355.pdf
Joint Capped Norms Minimization for Robust Matrix Recovery,,,,https://www.ijcai.org/proceedings/0356.pdf
Self-weighted Multiview Clustering with Multiple Graphs,,,,https://www.ijcai.org/proceedings/0357.pdf
SEVEN- Deep Semi-supervised Verification Networks,,,,https://www.ijcai.org/proceedings/0358.pdf
Discovering Relevance-Dependent Bicluster Structure from Relational Data,,,,https://www.ijcai.org/proceedings/0359.pdf
Learning Homophily Couplings from Non-IID Data for Joint Feature Selection and Noise-Resilient Outlier Detection,,,,https://www.ijcai.org/proceedings/0360.pdf
Flexible Orthogonal Neighborhood Preserving Embedding,,,,https://www.ijcai.org/proceedings/0361.pdf
Boosted Zero-Shot Learning with Semantic Correlation Regularization,,,,https://www.ijcai.org/proceedings/0362.pdf
Optimizing Ratio of Monotone Set Functions,,,,https://www.ijcai.org/proceedings/0363.pdf
On Subset Selection with General Cost Constraints,,,,https://www.ijcai.org/proceedings/0364.pdf
Improving Stochastic Block Models by Incorporating Power-Law Degree Characteristic,,,,https://www.ijcai.org/proceedings/0365.pdf
A Dual-Stage Attention-Based Recurrent Neural Network for Time Series Prediction,,,,https://www.ijcai.org/proceedings/0366.pdf
Stacking With Auxiliary Features,,,,https://www.ijcai.org/proceedings/0367.pdf
Robust Softmax Regression for Multi-class Classification with Self-Paced Learning,,,,https://www.ijcai.org/proceedings/0368.pdf
Sense Beauty by Label Distribution Learning,,,,https://www.ijcai.org/proceedings/0369.pdf
Distributed Accelerated Proximal Coordinate Gradient Methods,,,,https://www.ijcai.org/proceedings/0370.pdf
Right for the Right Reasons- Training Differentiable Models by Constraining their Explanations,,,,https://www.ijcai.org/proceedings/0371.pdf
See without looking- joint visualization of sensitive multi-site datasets,,,,https://www.ijcai.org/proceedings/0372.pdf
LMPP- A Large Margin Point Process Combining Reinforcement and Competition for Modeling Hashtag Popularity,,,,https://www.ijcai.org/proceedings/0373.pdf
Convolutional-Match Networks for Question Answering,,,,https://www.ijcai.org/proceedings/0374.pdf
Locally Consistent Bayesian Network Scores for Multi-Relational Data,,,,https://www.ijcai.org/proceedings/0375.pdf
Compressed Nonparametric Language Modelling,,,,https://www.ijcai.org/proceedings/0376.pdf
Learning Multi-level Region Consistency with Dense Multi-label Networks for Semantic Segmentation,,,,https://www.ijcai.org/proceedings/0377.pdf
Accelerated Doubly Stochastic Gradient Algorithm for Large-scale Empirical Risk Minimization,,,,https://www.ijcai.org/proceedings/0378.pdf
Learning with Previously Unseen Features,,,,https://www.ijcai.org/proceedings/0379.pdf
Learning Hedonic Games,,,,https://www.ijcai.org/proceedings/0380.pdf
Hierarchical LSTM with Adjusted Temporal Attention for Video Captioning,,,,https://www.ijcai.org/proceedings/0381.pdf
Recommendation vs Sentiment Analysis- A Text-Driven Latent Factor Model for Rating Prediction with Cold-Start Awareness,,,,https://www.ijcai.org/proceedings/0382.pdf
Two dimensional Large Margin Nearest Neighbor for Matrix Classification,,,,https://www.ijcai.org/proceedings/0383.pdf
Fast Sparse Gaussian Markov Random Fields Learning Based on Cholesky Factorization,,,,https://www.ijcai.org/proceedings/0384.pdf
End-to-end optimization of goal-driven and visually grounded dialogue systems,,,,https://www.ijcai.org/proceedings/0385.pdf
Forecast the Plausible Paths in Crowd Scenes,,,,https://www.ijcai.org/proceedings/0386.pdf
Vertex-Weighted Hypergraph Learning for Multi-View Object Classification,,,,https://www.ijcai.org/proceedings/0387.pdf
Deep Supervised Hashing with Nonlinear Projections,,,,https://www.ijcai.org/proceedings/0388.pdf
Correlational Dueling Bandits with Application to Clinical Treatment in Large Decision Spaces,,,,https://www.ijcai.org/proceedings/0389.pdf
CHARDA- Causal Hybrid Automata Recovery via Dynamic Analysis,,,,https://www.ijcai.org/proceedings/0390.pdf
MRLR- Multi-level Representation Learning for Personalized Ranking in Recommendation,,,,https://www.ijcai.org/proceedings/0391.pdf
Bayesian Dynamic Mode Decomposition,,,,https://www.ijcai.org/proceedings/0392.pdf
Student-t Process Regression with Student-t Likelihood,,,,https://www.ijcai.org/proceedings/0393.pdf
Robust Survey Aggregation with Student-t Distribution and Sparse Representation,,,,https://www.ijcai.org/proceedings/0394.pdf
Inverse Covariance Estimation with Structured Groups,,,,https://www.ijcai.org/proceedings/0395.pdf
From Ensemble Clustering to Multi-View Clustering,,,,https://www.ijcai.org/proceedings/0396.pdf
Retaining Data from Streams of Social Platforms with Minimal Regret,,,,https://www.ijcai.org/proceedings/0397.pdf
Disambiguating Energy Disaggregation- A Collective Probabilistic Approach,,,,https://www.ijcai.org/proceedings/0398.pdf
TransNet- Translation-Based Network Representation Learning for Social Relation Extraction,,,,https://www.ijcai.org/proceedings/0399.pdf
COBRA- A Fast and Simple Method for Active Clustering with Pairwise Constraints,,,,https://www.ijcai.org/proceedings/0400.pdf
Scaling Active Search using Linear Similarity Functions,,,,https://www.ijcai.org/proceedings/0401.pdf
Sifting Common Information from Many Variables,,,,https://www.ijcai.org/proceedings/0402.pdf
Locality Preserving Projections for Grassmann manifold,,,,https://www.ijcai.org/proceedings/0403.pdf
Tag Disentangled Generative Adversarial Network for Object Image Re-rendering,,,,https://www.ijcai.org/proceedings/0404.pdf
Active Learning for Black-Box Semantic Role Labeling with Neural Factors,,,,https://www.ijcai.org/proceedings/0405.pdf
Combining Knowledge with Deep Convolutional Neural Networks for Short Text Classification,,,,https://www.ijcai.org/proceedings/0406.pdf
Multi-Component Nonnegative Matrix Factorization,,,,https://www.ijcai.org/proceedings/0407.pdf
Convolutional 2D LDA for Nonlinear Dimensionality Reduction,,,,https://www.ijcai.org/proceedings/0408.pdf
Angle Principal Component Analysis,,,,https://www.ijcai.org/proceedings/0409.pdf
Instance-Level Label Propagation with Multi-Instance Learning,,,,https://www.ijcai.org/proceedings/0410.pdf
A Sequence Labeling Convolutional Network and Its Application to Handwritten String Recognition,,,,https://www.ijcai.org/proceedings/0411.pdf
Interactive Image Segmentation via Pairwise Likelihood Learning,,,,https://www.ijcai.org/proceedings/0412.pdf
Obtaining High-Quality Label by Distinguishing between Easy and Hard Items in Crowdsourcing,,,,https://www.ijcai.org/proceedings/0413.pdf
Multiple Medoids based Multi-view Relational Fuzzy Clustering with Minimax Optimization,,,,https://www.ijcai.org/proceedings/0414.pdf
App Download Forecasting- An Evolutionary Hierarchical Competition Approach,,,,https://www.ijcai.org/proceedings/0415.pdf
Cascade Dynamics Modeling with Attention-based Recurrent Neural Network,,,,https://www.ijcai.org/proceedings/0416.pdf
Fast Change Point Detection on Dynamic Social Networks,,,,https://www.ijcai.org/proceedings/0417.pdf
Multiple Kernel Clustering Framework with Improved Kernels,,,,https://www.ijcai.org/proceedings/0418.pdf
Approximate Large-scale Multiple Kernel k-means Using Deep Neural Network,,,,https://www.ijcai.org/proceedings/0419.pdf
On Gleaning Knowledge from Multiple Domains for Active Learning,,,,https://www.ijcai.org/proceedings/0420.pdf
Doubly Sparsifying Network,,,,https://www.ijcai.org/proceedings/0421.pdf
Improving Reinforcement Learning with Confidence-Based Demonstrations,,,,https://www.ijcai.org/proceedings/0422.pdf
Supervised Deep Features for Software Functional Clone Detection by Exploiting Lexical and Syntactical Information in Source Code,,,,https://www.ijcai.org/proceedings/0423.pdf
Group-wise Deep Co-saliency Detection,,,,https://www.ijcai.org/proceedings/0424.pdf
Deep Descriptor Transforming for Image Co-Localization,,,,https://www.ijcai.org/proceedings/0425.pdf
Learning from Demonstrations with High-Level Side Information,,,,https://www.ijcai.org/proceedings/0426.pdf
Sequential Prediction of Social Media Popularity with Deep Temporal Context Networks,,,,https://www.ijcai.org/proceedings/0427.pdf
Discriminant Tensor Dictionary Learning with Neighbor Uncorrelation for Image Set Based Classification,,,,https://www.ijcai.org/proceedings/0428.pdf
Unsupervised Deep Video Hashing with Balanced Rotation,,,,https://www.ijcai.org/proceedings/0429.pdf
Modeling Trajectories with Recurrent Neural Networks,,,,https://www.ijcai.org/proceedings/0430.pdf
Deep Context- A Neural Language Model for Large-scale Networked Documents,,,,https://www.ijcai.org/proceedings/0431.pdf
Sequence Prediction with Unlabeled Data by Reward Function Learning,,,,https://www.ijcai.org/proceedings/0432.pdf
Query-Driven Discovery of Anomalous Subgraphs in Attributed Graphs,,,,https://www.ijcai.org/proceedings/0433.pdf
Dual Inference for Machine Learning,,,,https://www.ijcai.org/proceedings/0434.pdf
Attentional Factorization Machines- Learning the Weight of Feature Interactions via Attention Networks,,,,https://www.ijcai.org/proceedings/0435.pdf
SVD-free Convex-Concave Approaches for Nuclear Norm Regularization,,,,https://www.ijcai.org/proceedings/0436.pdf
Dynamic Multi-View Hashing for Online Image Retrieval,,,,https://www.ijcai.org/proceedings/0437.pdf
Image-embodied Knowledge Representation Learning,,,,https://www.ijcai.org/proceedings/0438.pdf
Linear Manifold Regularization with Adaptive Graph for Semi-supervised Dimensionality Reduction,,,,https://www.ijcai.org/proceedings/0439.pdf
Multi-Class Support Vector Machine via Maximizing Multi-Class Margins,,,,https://www.ijcai.org/proceedings/0440.pdf
Multi-view Feature Learning with Discriminative Regularization,,,,https://www.ijcai.org/proceedings/0441.pdf
Feature Selection via Scaling Factor Integrated Multi-Class Support Vector Machines,,,,https://www.ijcai.org/proceedings/0442.pdf
Incomplete Label Distribution Learning,,,,https://www.ijcai.org/proceedings/0443.pdf
Multi-Positive and Unlabeled Learning,,,,https://www.ijcai.org/proceedings/0444.pdf
Stochastic Online Anomaly Analysis for Streaming Time Series,,,,https://www.ijcai.org/proceedings/0445.pdf
Tag-Aware Personalized Recommendation Using a Hybrid Deep Model,,,,https://www.ijcai.org/proceedings/0446.pdf
Deep Matrix Factorization Models for Recommender Systems,,,,https://www.ijcai.org/proceedings/0447.pdf
Multiple Indefinite Kernel Learning for Feature Selection,,,,https://www.ijcai.org/proceedings/0448.pdf
Tensor Decomposition with Missing Indices,,,,https://www.ijcai.org/proceedings/0449.pdf
When Does Label Propagation Fail- A View from a Network Generative Model,,,,https://www.ijcai.org/proceedings/0450.pdf
FolkPopularityRank- Tag Recommendation for Enhancing Social Popularity using Text Tags in Content Sharing Services,,,,https://www.ijcai.org/proceedings/0451.pdf
Semi-Supervised Deep Hashing with a Bipartite Graph,,,,https://www.ijcai.org/proceedings/0452.pdf
Predicting Human Interaction via Relative Attention Model,,,,https://www.ijcai.org/proceedings/0453.pdf
Learning Discriminative Correlation Subspace for Heterogeneous Domain Adaptation,,,,https://www.ijcai.org/proceedings/0454.pdf
Life-Stage Modeling by Customer-Manifold Embedding,,,,https://www.ijcai.org/proceedings/0455.pdf
Joint Image Emotion Classification and Distribution Learning via Deep Convolutional Neural Network,,,,https://www.ijcai.org/proceedings/0456.pdf
Positive unlabeled learning via wrapper-based adaptive sampling,,,,https://www.ijcai.org/proceedings/0457.pdf
Learning to Read Irregular Text with Attention Mechanisms,,,,https://www.ijcai.org/proceedings/0458.pdf
Modal Consistency based Pre-Trained Multi-Model Reuse,,,,https://www.ijcai.org/proceedings/0459.pdf
A Robust Noise Resistant Algorithm for POI Identification from Flickr Data,,,,https://www.ijcai.org/proceedings/0460.pdf
Multi-Task Deep Reinforcement Learning for Continuous Action Control,,,,https://www.ijcai.org/proceedings/0461.pdf
Efficient Inexact Proximal Gradient Algorithm for Nonconvex Problems,,,,https://www.ijcai.org/proceedings/0462.pdf
