title,keywords,group,link,pdf
Learning Mahalanobis Distance Metric- Considering Instance Disturbance Helps,,,,https://www.ijcai.org/proceedings/0463.pdf
A Deep Neural Network for Chinese Zero Pronoun Resolution,,,,https://www.ijcai.org/proceedings/0464.pdf
Learning Co-Substructures by Kernel Dependence Maximization,,,,https://www.ijcai.org/proceedings/0465.pdf
Privileged Multi-label Learning,,,,https://www.ijcai.org/proceedings/0466.pdf
Link Prediction with Spatial and Temporal Consistency in Dynamic Networks,,,,https://www.ijcai.org/proceedings/0467.pdf
Single-Pass PCA of Large High-Dimensional Data,,,,https://www.ijcai.org/proceedings/0468.pdf
Open Category Classification by Adversarial Sample Generation,,,,https://www.ijcai.org/proceedings/0469.pdf
Fast Stochastic Variance Reduced ADMM for Stochastic Composition Optimization,,,,https://www.ijcai.org/proceedings/0470.pdf
Deep-dense Conditional Random Fields for Object Co-segmentation,,,,https://www.ijcai.org/proceedings/0471.pdf
User Profile Preserving Social Network Embedding,,,,https://www.ijcai.org/proceedings/0472.pdf
A Generalized Recurrent Neural Architecture for Text Classification with Multi-Task Learning,,,,https://www.ijcai.org/proceedings/0473.pdf
ME-MD- An Effective Framework for Neural Machine Translation with Multiple Encoders and Decoders,,,,https://www.ijcai.org/proceedings/0474.pdf
Adaptive Manifold Regularized Matrix Factorization for Data Clustering,,,,https://www.ijcai.org/proceedings/0475.pdf
Adaptively Unified Semi-supervised Learning for Cross-Modal Retrieval,,,,https://www.ijcai.org/proceedings/0476.pdf
DRLnet- Deep Difference Representation Learning Network and An Unsupervised Optimization Framework,,,,https://www.ijcai.org/proceedings/0477.pdf
Hashtag Recommendation for Multimodal Microblog Using Co-Attention Network,,,,https://www.ijcai.org/proceedings/0478.pdf
Global-residual and Local-boundary Refinement Networks for Rectifying Scene Parsing Predictions,,,,https://www.ijcai.org/proceedings/0479.pdf
Robust Regression via Heuristic Hard Thresholding,,,,https://www.ijcai.org/proceedings/0480.pdf
Multi-Instance Learning with Key Instance Shift,,,,https://www.ijcai.org/proceedings/0481.pdf
Multimodal Linear Discriminant Analysis via Structural Sparsity,,,,https://www.ijcai.org/proceedings/0482.pdf
Weighted Double Q-learning,,,,https://www.ijcai.org/proceedings/0483.pdf
Tensor Based Knowledge Transfer Across Skill Categories for Robot Control,,,,https://www.ijcai.org/proceedings/0484.pdf
Learning Discriminative Recommendation Systems with Side Information,,,,https://www.ijcai.org/proceedings/0485.pdf
Random Shifting for CNN- a Solution to Reduce Information Loss in Down-Sampling Layers,,,,https://www.ijcai.org/proceedings/0486.pdf
Hierarchical Feature Selection with Recursive Regularization,,,,https://www.ijcai.org/proceedings/0487.pdf
Deep Optical Flow Estimation Via Multi-Scale Correspondence Structure Learning,,,,https://www.ijcai.org/proceedings/0488.pdf
ContextCare- Incorporating Contextual Information Networks to Representation Learning on Medical Forum Data,,,,https://www.ijcai.org/proceedings/0489.pdf
Deep Multiple Instance Hashing for Object-based Image Retrieval,,,,https://www.ijcai.org/proceedings/0490.pdf
TUCH- Turning Cross-view Hashing into Single-view Hashing via Generative Adversarial Nets,,,,https://www.ijcai.org/proceedings/0491.pdf
Video Question Answering via Hierarchical Spatio-Temporal Attention Networks,,,,https://www.ijcai.org/proceedings/0492.pdf
Link Prediction via Ranking Metric Dual-Level Attention Network Learning,,,,https://www.ijcai.org/proceedings/0493.pdf
Microblog Sentiment Classiﬁcation via Recurrent Random Walk Network Learning,,,,https://www.ijcai.org/proceedings/0494.pdf
Tensor Completion with Side Information- A Riemannian Manifold Approach,,,,https://www.ijcai.org/proceedings/0495.pdf
Binary Linear Compression for Multi-label Classification,,,,https://www.ijcai.org/proceedings/0496.pdf
Deep Forest- Towards An Alternative to Deep Neural Networks,,,,https://www.ijcai.org/proceedings/0497.pdf
Diverse Neuron Type Selection for Convolutional Neural Networks,,,,https://www.ijcai.org/proceedings/0498.pdf
Locality Constrained Deep Supervised Hashing for Image Retrieval,,,,https://www.ijcai.org/proceedings/0499.pdf
Deep Graphical Feature Learning for Face Sketch Synthesis,,,,https://www.ijcai.org/proceedings/0500.pdf
Adaptive Hypergraph Learning for Unsupervised Feature Selection,,,,https://www.ijcai.org/proceedings/0501.pdf
No Learner Left Behind- On the Complexity of Teaching Multiple Learners Simultaneously,,,,https://www.ijcai.org/proceedings/0502.pdf
Dependency Exploitation- A Unified CNN-RNN Approach for Visual Emotion Recognition,,,,https://www.ijcai.org/proceedings/0503.pdf
What to Do Next- Modeling User Behaviors by Time-LSTM,,,,https://www.ijcai.org/proceedings/0504.pdf
Object Recognition with and without Objects,,,,https://www.ijcai.org/proceedings/0505.pdf
Understanding People Lifestyles- Construction of Urban Movement Knowledge Graph from GPS Trajectory,,,,https://www.ijcai.org/proceedings/0506.pdf
Cake Cutting- Envy and Truth,,,,https://www.ijcai.org/proceedings/0507.pdf
Networked Fairness in Cake Cutting,,,,https://www.ijcai.org/proceedings/0508.pdf
Deep Multi-species Embedding,,,,https://www.ijcai.org/proceedings/0509.pdf
Opinion-aware Knowledge Graph for Political Ideology Detection,,,,https://www.ijcai.org/proceedings/0510.pdf
Exploiting Music Play Sequence for Music Recommendation,,,,https://www.ijcai.org/proceedings/0511.pdf
Social Pressure in Opinion Games,,,,https://www.ijcai.org/proceedings/0512.pdf
Focused Depth-first Proof Number Search using Convolutional Neural Networks for the Game of Hex,,,,https://www.ijcai.org/proceedings/0513.pdf
DeepAM- Migrate APIs with Multi-modal Sequence to Sequence Learning,,,,https://www.ijcai.org/proceedings/0514.pdf
Playing Repeated Network Interdiction Games with Semi-Bandit Feedback,,,,https://www.ijcai.org/proceedings/0515.pdf
Comparing Strategic Secrecy and Stackelberg Commitment in Security Games,,,,https://www.ijcai.org/proceedings/0516.pdf
Modeling Physicians Utterances to Explore Diagnostic Decision-making,,,,https://www.ijcai.org/proceedings/0517.pdf
Game Engine Learning from Video,,,,https://www.ijcai.org/proceedings/0518.pdf
Who to Invite Next- Predicting Invitees of Social Groups,,,,https://www.ijcai.org/proceedings/0519.pdf
Fashion Style Generator,,,,https://www.ijcai.org/proceedings/0520.pdf
Exploring Personalized Neural Conversational Models,,,,https://www.ijcai.org/proceedings/0521.pdf
Stratified Strategy Selection for Unit Control in Real-Time Strategy Games,,,,https://www.ijcai.org/proceedings/0522.pdf
Defending Against Man-In-The-Middle Attack in Repeated Games,,,,https://www.ijcai.org/proceedings/0523.pdf
How to Keep a Knowledge Base Synchronized with Its Encyclopedia Source,,,,https://www.ijcai.org/proceedings/0524.pdf
Tactics of Adversarial Attack on Deep Reinforcement Learning Agents,,,,https://www.ijcai.org/proceedings/0525.pdf
Adversarial Generation of Real-time Feedback with Neural Networks for Simulation-based Training,,,,https://www.ijcai.org/proceedings/0526.pdf
Staying Ahead of the Game- Adaptive Robust Optimization for Dynamic Allocation of Threat Screening Resources,,,,https://www.ijcai.org/proceedings/0527.pdf
Blue Skies- A Methodology for Data-Driven Clear Sky Modelling,,,,https://www.ijcai.org/proceedings/0528.pdf
Thwarting Vote Buying Through Decoy Ballots,,,,https://www.ijcai.org/proceedings/0529.pdf
Quantifying Aspect Bias in Ordinal Ratings using a Bayesian Approach,,,,https://www.ijcai.org/proceedings/0530.pdf
Unified Representation and Lifted Sampling for Generative Models of Social Networks,,,,https://www.ijcai.org/proceedings/0531.pdf
Cognitive-Inspired Conversational-Strategy Reasoner for Socially-Aware Agents,,,,https://www.ijcai.org/proceedings/0532.pdf
When Security Games Hit Traffic- Optimal Traffic Enforcement Under One Sided Uncertainty,,,,https://www.ijcai.org/proceedings/0533.pdf
Leveraging Human Knowledge in Tabular Reinforcement Learning- A Study of Human Subjects,,,,https://www.ijcai.org/proceedings/0534.pdf
A Monte Carlo Tree Search approach to Active Malware Analysis,,,,https://www.ijcai.org/proceedings/0535.pdf
Depression Detection via Harvesting Social Media- A Multimodal Dictionary Learning Solution,,,,https://www.ijcai.org/proceedings/0536.pdf
The Minds of Many- Opponent Modeling in a Stochastic Game,,,,https://www.ijcai.org/proceedings/0537.pdf
Interactive Narrative Personalization with Deep Reinforcement Learning,,,,https://www.ijcai.org/proceedings/0538.pdf
Predicting the Quality of Short Narratives from Social Media,,,,https://www.ijcai.org/proceedings/0539.pdf
A Trust-based Mixture of Gaussian Processes Model for Reliable Regression in Participatory Sensing,,,,https://www.ijcai.org/proceedings/0540.pdf
Online Reputation Fraud Campaign Detection in User Ratings,,,,https://www.ijcai.org/proceedings/0541.pdf
Predicting Alzheimers Disease Cognitive Assessment via Robust Low-Rank Structured Sparse Model,,,,https://www.ijcai.org/proceedings/0542.pdf
Beyond Universal Saliency- Personalized Saliency Prediction with Multi-task CNN,,,,https://www.ijcai.org/proceedings/0543.pdf
Fast Network Embedding Enhancement via High Order Proximity Approximation,,,,https://www.ijcai.org/proceedings/0544.pdf
A Convolutional Approach for Misinformation Identification,,,,https://www.ijcai.org/proceedings/0545.pdf
No Time to Observe- Adaptive Influence Maximization with Partial Feedback,,,,https://www.ijcai.org/proceedings/0546.pdf
Socialized Word Embeddings,,,,https://www.ijcai.org/proceedings/0547.pdf
Efficient Private ERM for Smooth Objectives,,,,https://www.ijcai.org/proceedings/0548.pdf
A Causal Framework for Discovering and Removing Direct and Indirect Discrimination,,,,https://www.ijcai.org/proceedings/0549.pdf
Optimal Escape Interdiction on Transportation Networks,,,,https://www.ijcai.org/proceedings/0550.pdf
Efficient Label Contamination Attacks Against Black-Box Learning Models,,,,https://www.ijcai.org/proceedings/0551.pdf
A Group-Based Personalized Model for Image Privacy Classification and Labeling,,,,https://www.ijcai.org/proceedings/0552.pdf
A Feature-Enriched Neural Model for Joint Chinese Word Segmentation and Part-of-Speech Tagging,,,,https://www.ijcai.org/proceedings/0553.pdf
Multimodal Storytelling via Generative Adversarial Imitation Learning,,,,https://www.ijcai.org/proceedings/0554.pdf
Joint Training for Pivot-based Neural Machine Translation,,,,https://www.ijcai.org/proceedings/0555.pdf
Solving Probability Problems in Natural Language,,,,https://www.ijcai.org/proceedings/0556.pdf
Stance Classification with Target-specific Neural Attention,,,,https://www.ijcai.org/proceedings/0557.pdf
An Attention-based Regression Model for Grounding Textual Phrases in Images,,,,https://www.ijcai.org/proceedings/0558.pdf
Effective Deep Memory Networks for Distant Supervised Relation Extraction,,,,https://www.ijcai.org/proceedings/0559.pdf
Understanding and Exploiting Language Diversity,,,,https://www.ijcai.org/proceedings/0560.pdf
Learning to Explain Entity Relationships by Pairwise Ranking with Convolutional Neural Networks,,,,https://www.ijcai.org/proceedings/0561.pdf
SWIM- A Simple Word Interaction Model for Implicit Discourse Relation Recognition,,,,https://www.ijcai.org/proceedings/0562.pdf
MAT- A Multimodal Attentive Translator for Image Captioning,,,,https://www.ijcai.org/proceedings/0563.pdf
How Unlabeled Web Videos Help Complex Event Detection-,,,,https://www.ijcai.org/proceedings/0564.pdf
A Structural Representation Learning for Multi-relational Networks,,,,https://www.ijcai.org/proceedings/0565.pdf
Dynamic Compositional Neural Networks over Tree Structure,,,,https://www.ijcai.org/proceedings/0566.pdf
Adaptive Semantic Compositionality for Sentence Modelling,,,,https://www.ijcai.org/proceedings/0567.pdf
Interactive Attention Networks for Aspect-Level Sentiment Classification,,,,https://www.ijcai.org/proceedings/0568.pdf
Inverted Bilingual Topic Models for Lexicon Extraction from Non-parallel Data,,,,https://www.ijcai.org/proceedings/0569.pdf
Why Cant You Convince Me- Modeling Weaknesses in Unpersuasive Arguments,,,,https://www.ijcai.org/proceedings/0570.pdf
Parsing Natural Language Conversations using Contextual Cues,,,,https://www.ijcai.org/proceedings/0571.pdf
Automatic Assessment of Absolute Sentence Complexity,,,,https://www.ijcai.org/proceedings/0572.pdf
Finding Prototypes of Answers for Improving Answer Sentence Selection,,,,https://www.ijcai.org/proceedings/0573.pdf
From Neural Sentence Summarization to Headline Generation- A Coarse-to-Fine Approach,,,,https://www.ijcai.org/proceedings/0574.pdf
Multi-Modal Word Synset Induction,,,,https://www.ijcai.org/proceedings/0575.pdf
Conditional Generative Adversarial Networks for Commonsense Machine Comprehension,,,,https://www.ijcai.org/proceedings/0576.pdf
Joint Learning on Relevant User Attributes in Micro-blog,,,,https://www.ijcai.org/proceedings/0577.pdf
Learning Sentence Representation with Guidance of Human Attention,,,,https://www.ijcai.org/proceedings/0578.pdf
Bilateral Multi-Perspective Matching for Natural Language Sentences,,,,https://www.ijcai.org/proceedings/0579.pdf
DDoS Event Forecasting using Twitter Data,,,,https://www.ijcai.org/proceedings/0580.pdf
A Neural Model for Joint Event Detection and Summarization,,,,https://www.ijcai.org/proceedings/0581.pdf
A Variational Autoencoding Approach for Inducing Cross-lingual Word Embeddings,,,,https://www.ijcai.org/proceedings/0582.pdf
Learning to Identify Ambiguous and Misleading News Headlines,,,,https://www.ijcai.org/proceedings/0583.pdf
Improved Neural Machine Translation with Source Syntax,,,,https://www.ijcai.org/proceedings/0584.pdf
Symbolic Priors for RNN-based Semantic Parsing,,,,https://www.ijcai.org/proceedings/0585.pdf
Fast Parallel Training of Neural Language Models,,,,https://www.ijcai.org/proceedings/0586.pdf
Lexical Sememe Prediction via Word Embeddings and Matrix Factorization,,,,https://www.ijcai.org/proceedings/0587.pdf
A Correlated Topic Model Using Word Embeddings,,,,https://www.ijcai.org/proceedings/0588.pdf
Learning Conversational Systems that Interleave Task and Non-Task Content,,,,https://www.ijcai.org/proceedings/0589.pdf
AGRA- An Analysis-Generation-Ranking Framework for Automatic Abbreviation from Paper Titles,,,,https://www.ijcai.org/proceedings/0590.pdf
Segmenting Chinese Microtext- Joint Informal-Word Detection and Segmentation with Neural Networks,,,,https://www.ijcai.org/proceedings/0591.pdf
Automatic Generation of Grounded Visual Questions,,,,https://www.ijcai.org/proceedings/0592.pdf
Entity Suggestion with Conceptual Expanation,,,,https://www.ijcai.org/proceedings/0593.pdf
Maximum Expected Likelihood Estimation for Zero-resource Neural Machine Translation,,,,https://www.ijcai.org/proceedings/0594.pdf
Iterative Entity Alignment via Joint Knowledge Embeddings,,,,https://www.ijcai.org/proceedings/0595.pdf
Efficient Optimal Search under Expensive Edge Cost Computation,,,,https://www.ijcai.org/proceedings/0596.pdf
Reduction Techniques for Model Checking and Learning in MDPs,,,,https://www.ijcai.org/proceedings/0597.pdf
Faster Conflict Generation for Dynamic Controllability,,,,https://www.ijcai.org/proceedings/0598.pdf
Additive Merge-and-Shrink Heuristics for Diverse Action Costs,,,,https://www.ijcai.org/proceedings/0599.pdf
Purely Declarative Action Descriptions are Overrated- Classical Planning with Simulators,,,,https://www.ijcai.org/proceedings/0600.pdf
On Creating Complementary Pattern Databases,,,,https://www.ijcai.org/proceedings/0601.pdf
Beyond Forks- Finding and Ranking Star Factorings for Decoupled Search,,,,https://www.ijcai.org/proceedings/0602.pdf
Intelligent Belief State Sampling for Conformant Planning,,,,https://www.ijcai.org/proceedings/0603.pdf
Softpressure- A Schedule-Driven Backpressure Algorithm for Coping with Network Congestion,,,,https://www.ijcai.org/proceedings/0604.pdf
Switched Linear Multi-Robot Navigation Using Hierarchical Model Predictive Control,,,,https://www.ijcai.org/proceedings/0605.pdf
Numeric Planning via Abstraction and Policy Guided Search,,,,https://www.ijcai.org/proceedings/0606.pdf
Factorized Asymptotic Bayesian Policy Search for POMDPs,,,,https://www.ijcai.org/proceedings/0607.pdf
Equi-Reward Utility Maximizing Design in Stochastic Environments,,,,https://www.ijcai.org/proceedings/0608.pdf
Integrating Answer Set Programming with Semantic Dictionaries for Robot Task Planning,,,,https://www.ijcai.org/proceedings/0609.pdf
Deceptive Path-Planning,,,,https://www.ijcai.org/proceedings/0610.pdf
Lossy Compression of Pattern Databases Using Acyclic Random Hypergraphs,,,,https://www.ijcai.org/proceedings/0611.pdf
Landmarks for Numeric Planning Problems,,,,https://www.ijcai.org/proceedings/0612.pdf
Generating Context-Free Grammars using Classical Planning,,,,https://www.ijcai.org/proceedings/0613.pdf
"Search and Learn- On Dead-End Detectors, the Traps they Set, and Trap Learning",,,,https://www.ijcai.org/proceedings/0614.pdf
"Efficient, Safe, and Probably Approximately Complete Learning of Action Models",,,,https://www.ijcai.org/proceedings/0615.pdf
An Improved Approximation Algorithm for the Subpath Planning Problem and Its Generalization,,,,https://www.ijcai.org/proceedings/0616.pdf
Robust Advertisement Allocation,,,,https://www.ijcai.org/proceedings/0617.pdf
From Qualitative to Quantitative Dominance Pruning for Optimal Planning,,,,https://www.ijcai.org/proceedings/0618.pdf
Mechanism Design for Strategic Project Scheduling,,,,https://www.ijcai.org/proceedings/0619.pdf
Temporal Planning for Compilation of Quantum Approximate Optimization Circuits,,,,https://www.ijcai.org/proceedings/0620.pdf
Heuristic Online Goal Recognition in Continuous Domains,,,,https://www.ijcai.org/proceedings/0621.pdf
New Metrics and Algorithms for Stochastic Goal Recognition Design Problems,,,,https://www.ijcai.org/proceedings/0622.pdf
Hierarchical Task Network Planning with Task Insertion and State Constraints,,,,https://www.ijcai.org/proceedings/0623.pdf
A Scalable Approach to Chasing Multiple Moving Targets with Multiple Agents,,,,https://www.ijcai.org/proceedings/0624.pdf
Bridging the Gap between Observation and Decision Making- Goal Recognition and Flexible Resource Allocation in Dynamic Network Interdiction,,,,https://www.ijcai.org/proceedings/0625.pdf
Dual Track Multimodal Automatic Learning through Human-Robot Interaction,,,,https://www.ijcai.org/proceedings/0626.pdf
Locality Preserving Matching,,,,https://www.ijcai.org/proceedings/0627.pdf
Salient Object Detection with Semantic Priors,,,,https://www.ijcai.org/proceedings/0628.pdf
Temporal Grounding Graphs for Language Understanding with Accrued Visual-Linguistic Context,,,,https://www.ijcai.org/proceedings/0629.pdf
Maintaining Communication in Multi-Robot Tree Coverage,,,,https://www.ijcai.org/proceedings/0630.pdf
Combining Models from Multiple Sources for RGB-D Scene Recognition,,,,https://www.ijcai.org/proceedings/0631.pdf
Fast Preprocessing for Robust Face Sketch Synthesis,,,,https://www.ijcai.org/proceedings/0632.pdf
Learning to Hallucinate Face Images via Component Generation and Enhancement,,,,https://www.ijcai.org/proceedings/0633.pdf
Cross-Granularity Graph Inference for Semantic Video Object Segmentation,,,,https://www.ijcai.org/proceedings/0634.pdf
Is My Object in This Video- Reconstruction-based Object Search in Videos,,,,https://www.ijcai.org/proceedings/0635.pdf
Image Gradient-based Joint Direct Visual Odometry for Stereo Camera,,,,https://www.ijcai.org/proceedings/0636.pdf
Adaptive Elicitation of Preferences under Uncertainty in Sequential Decision Making Problems,,,,https://www.ijcai.org/proceedings/0637.pdf
COG-DICE- An Algorithm for Solving Continuous-Observation Dec-POMDPs,,,,https://www.ijcai.org/proceedings/0638.pdf
Fair and Efficient Social Choice in Dynamic Settings,,,,https://www.ijcai.org/proceedings/0639.pdf
Incremental Decision Making Under Risk with the Weighted Expected Utility Model,,,,https://www.ijcai.org/proceedings/0640.pdf
Coarse-to-Fine Lifted MAP Inference in Computer Vision,,,,https://www.ijcai.org/proceedings/0641.pdf
Variational Mixtures of Gaussian Processes for Classification,,,,https://www.ijcai.org/proceedings/0642.pdf
Weighted Model Integration with Orthogonal Transformations,,,,https://www.ijcai.org/proceedings/0643.pdf
Efficient Inference for Untied MLNs,,,,https://www.ijcai.org/proceedings/0644.pdf
Order Statistics for Probabilistic Graphical Models,,,,https://www.ijcai.org/proceedings/0645.pdf
Scalable Estimation of Dirichlet Process Mixture Models on Distributed Data,,,,https://www.ijcai.org/proceedings/0646.pdf
XOR-Sampling for Network Design with Correlated Stochastic Events,,,,https://www.ijcai.org/proceedings/0647.pdf
Robust Quadratic Programming for Price Optimization,,,,https://www.ijcai.org/proceedings/0648.pdf
Single-Image 3D Scene Parsing Using Geometric Commonsense,,,,https://www.ijcai.org/proceedings/0649.pdf
Dynamic Programming Bipartite Belief Propagation For Hyper Graph Matching,,,,https://www.ijcai.org/proceedings/0650.pdf
Approximating Discrete Probability Distribution of Image Emotions by Multi-Modal Features Fusion,,,,https://www.ijcai.org/proceedings/0651.pdf
Platos Cave in the Dempster-Shafer land--the Link between Pignistic and Plausibility Transformations,,,,https://www.ijcai.org/proceedings/0652.pdf
When Will Negotiation Agents Be Able to Represent Us- The Challenges and Opportunities for Autonomous Negotiators,,,,https://www.ijcai.org/proceedings/0653.pdf
Algorithmic Bias in Autonomous Systems,,,,https://www.ijcai.org/proceedings/0654.pdf
Responsible Autonomy,,,,https://www.ijcai.org/proceedings/0655.pdf
Reinforcement Learning with a Corrupted Reward Channel,,,,https://www.ijcai.org/proceedings/0656.pdf
A Goal Reasoning Agent for Controlling UAVs in Beyond-Visual-Range Air Combat,,,,https://www.ijcai.org/proceedings/0657.pdf
On Automating the Doctrine of Double Effect,,,,https://www.ijcai.org/proceedings/0658.pdf
Achieving Coordination in Multi-Agent Systems by Stable Local Conventions under Community Networks,,,,https://www.ijcai.org/proceedings/0659.pdf
Context-Based Reasoning on Privacy in Internet of Things,,,,https://www.ijcai.org/proceedings/0660.pdf
Concrete Problems for Autonomous Vehicle Safety- Advantages of Bayesian Deep Learning,,,,https://www.ijcai.org/proceedings/0661.pdf
Should Robots be Obedient-,,,,https://www.ijcai.org/proceedings/0662.pdf
Privacy and Autonomous Systems,,,,https://www.ijcai.org/proceedings/0663.pdf
Online Decision-Making for Scalable Autonomous Systems,,,,https://www.ijcai.org/proceedings/0664.pdf
Rationalisation of Profiles of Abstract Argumentation Frameworks- Extended Abstract,,,,https://www.ijcai.org/proceedings/0665.pdf
Unsatisfiable Core Shrinking for Anytime Answer Set Optimization,,,,https://www.ijcai.org/proceedings/0666.pdf
"A Verified SAT Solver Framework with Learn, Forget, Restart, and Incrementality",,,,https://www.ijcai.org/proceedings/0667.pdf
Concerning Referring Expressions in Query Answers,,,,https://www.ijcai.org/proceedings/0668.pdf
Open-World Probabilistic Databases- An Abridged Report,,,,https://www.ijcai.org/proceedings/0669.pdf
Efficient Techniques for Crowdsourced Top-k Lists,,,,https://www.ijcai.org/proceedings/0670.pdf
Predicting Human Similarity Judgments with Distributional Models- The Value of Word Associations,,,,https://www.ijcai.org/proceedings/0671.pdf
Ensuring Rapid Mixing and Low Bias for Asynchronous Gibbs Sampling,,,,https://www.ijcai.org/proceedings/0672.pdf
Intuitionistic Layered Graph Logic,,,,https://www.ijcai.org/proceedings/0673.pdf
User-Based Opinion-based Recommendation,,,,https://www.ijcai.org/proceedings/0674.pdf
Enhancing Crowdworkers Vigilance,,,,https://www.ijcai.org/proceedings/0675.pdf
Lessons from the Amazon Picking Challenge- Four Aspects of Building Robotic Systems,,,,https://www.ijcai.org/proceedings/0676.pdf
Lexicons on Demand- Neural Word Embeddings for Large-Scale Text Analysis,,,,https://www.ijcai.org/proceedings/0677.pdf
Which is the Fairest (Rent Division) of Them All- [Extended Abstract],,,,https://www.ijcai.org/proceedings/0678.pdf
Using Constraint Programming to solve a Cryptanalytic Problem,,,,https://www.ijcai.org/proceedings/0679.pdf
Multi-Type Activity Recognition from a Robots Viewpoint,,,,https://www.ijcai.org/proceedings/0680.pdf
Model Accuracy and Runtime Tradeoff in Distributed Deep Learning- A Systematic Study,,,,https://www.ijcai.org/proceedings/0681.pdf
First-Order Modular Logic Programs and their Conservative Extensions (Extended Abstract),,,,https://www.ijcai.org/proceedings/0682.pdf
"Solving Very Hard Problems- Cube-and-Conquer, a Hybrid SAT Solving Method",,,,https://www.ijcai.org/proceedings/0683.pdf
Summary- Multi-Agent Path Finding with Kinematic Constraints,,,,https://www.ijcai.org/proceedings/0684.pdf
Learning and Applying Case Adaptation Rules for Classification- An Ensemble Approach,,,,https://www.ijcai.org/proceedings/0685.pdf
An End-to-End System for Accomplishing Tasks with Modular Robots- Perspectives for the AI community,,,,https://www.ijcai.org/proceedings/0686.pdf
Blockedness in Propositional Logic- Are You Satisfied With Your Neighborhood-,,,,https://www.ijcai.org/proceedings/0687.pdf
On Thompson Sampling and Asymptotic Optimality,,,,https://www.ijcai.org/proceedings/0688.pdf
A SAT Approach to Branchwidth,,,,https://www.ijcai.org/proceedings/0689.pdf
Self-Adjusting Memory- How to Deal with Diverse Drift Types,,,,https://www.ijcai.org/proceedings/0690.pdf
Competence Guided Model for Casebase Maintenance,,,,https://www.ijcai.org/proceedings/0691.pdf
The Many Benefits of Annotator Rationales for Relevance Judgments,,,,https://www.ijcai.org/proceedings/0692.pdf
