title,keywords,group,link,pdf
Dynamical System-Based Motion Planning for Multi-Arm Systems- Reaching for Moving Objects,,,,https://www.ijcai.org/proceedings/0693.pdf
"KSP- A Resolution-based Prover for Multimodal K, Abridged Report",,,,https://www.ijcai.org/proceedings/0694.pdf
nanoCoP- Natural Non-clausal Theorem Proving,,,,https://www.ijcai.org/proceedings/0695.pdf
Grounding Abstract Spatial Concepts for Language Interaction with Robots,,,,https://www.ijcai.org/proceedings/0696.pdf
Adapting Deep Network Features to Capture Psychological Representations- An Abridged Report,,,,https://www.ijcai.org/proceedings/0697.pdf
Evaluating Market User Interfaces for Electric Vehicle Charging using Bid2Charge,,,,https://www.ijcai.org/proceedings/0698.pdf
Local Topic Discovery via Boosted Ensemble of Nonnegative Matrix Factorization,,,,https://www.ijcai.org/proceedings/0699.pdf
Value Iteration Networks,,,,https://www.ijcai.org/proceedings/0700.pdf
I-dual- Solving Constrained SSPs via Heuristic Search in the Dual Space,,,,https://www.ijcai.org/proceedings/0701.pdf
Maximizing Awareness about HIV in Social Networks of Homeless Youth with Limited Information,,,,https://www.ijcai.org/proceedings/0702.pdf
Robust Multilingual Named Entity Recognition with Shallow Semi-supervised Features (Extended Abstract),,,,https://www.ijcai.org/proceedings/0703.pdf
"Automatic Description Generation from Images- A Survey of Models, Datasets, and Evaluation Measures (Extended Abstract)",,,,https://www.ijcai.org/proceedings/0704.pdf
A New Semantics for Overriding in Description Logics (Extended Abstract),,,,https://www.ijcai.org/proceedings/0705.pdf
On Minimum Representations of Matched Formulas (Extended Abstract),,,,https://www.ijcai.org/proceedings/0706.pdf
Efficient Mechanism Design for Online Scheduling (Extended Abstract),,,,https://www.ijcai.org/proceedings/0707.pdf
"Bayesian Network Structure Learning with Integer Programming- Polytopes, Facets and Complexity (Extended Abstract)",,,,https://www.ijcai.org/proceedings/0708.pdf
Coherent Predictive Inference under Exchangeability with Imprecise Probabilities (Extended Abstract),,,,https://www.ijcai.org/proceedings/0709.pdf
The Ceteris Paribus Structure of Logics of Game Forms (Extended Abstract),,,,https://www.ijcai.org/proceedings/0710.pdf
Computer Models Solving Intelligence Test Problems- Progress and Implications (Extended Abstract),,,,https://www.ijcai.org/proceedings/0711.pdf
New Canonical Representations by Augmenting OBDDs with Conjunctive Decomposition (Extended Abstract),,,,https://www.ijcai.org/proceedings/0712.pdf
Automated Conjecturing I- Fajtlowiczs Dalmatian Heuristic Revisited (Extended Abstract),,,,https://www.ijcai.org/proceedings/0713.pdf
On Redundant Topological Constraints (Extended Abstract),,,,https://www.ijcai.org/proceedings/0714.pdf
AutoFolio- An Automatically Configured Algorithm Selector (Extended Abstract),,,,https://www.ijcai.org/proceedings/0715.pdf
CCEHC- An Efficient Local Search Algorithm for Weighted Partial Maximum Satisfiability (Extended Abstract),,,,https://www.ijcai.org/proceedings/0716.pdf
Approximate Value Iteration with Temporally Extended Actions (Extended Abstract),,,,https://www.ijcai.org/proceedings/0717.pdf
Relations Between Spatial Calculi About Directions and Orientations (Extended Abstract),,,,https://www.ijcai.org/proceedings/0718.pdf
Construction of System of Spheres-based Transitively Relational Partial Meet Multiple Contractions- An Impossibility Result (Extended Abstract),,,,https://www.ijcai.org/proceedings/0719.pdf
News Across Languages - Cross-Lingual Document Similarity and Event Tracking (Extended Abstract),,,,https://www.ijcai.org/proceedings/0720.pdf
Generating Models of a Matched Formula With a Polynomial Delay (Extended Abstract),,,,https://www.ijcai.org/proceedings/0721.pdf
Evaluating Epistemic Negation in Answer Set Programming (Extended Abstract),,,,https://www.ijcai.org/proceedings/0722.pdf
Some Properties of Batch Value of Information in the Selection Problem (Extended Abstract),,,,https://www.ijcai.org/proceedings/0723.pdf
On the Expressivity of Inconsistency Measures (Extended Abstract),,,,https://www.ijcai.org/proceedings/0724.pdf
A generic approach to planning in the presence of incomplete information- Theory and implementation (Extended Abstract),,,,https://www.ijcai.org/proceedings/0725.pdf
Robots in Retirement Homes- Applying Off-the-Shelf Planning and Scheduling to a Team of Assistive Robots (Extended Abstract),,,,https://www.ijcai.org/proceedings/0726.pdf
Exploiting Causality for Selective Belief Filtering in Dynamic Bayesian Networks (Extended Abstract),,,,https://www.ijcai.org/proceedings/0727.pdf
Local Search for Minimum Weight Dominating Set with Two-Level Configuration Checking and Frequency Based Scoring Function (Extended Abstract),,,,https://www.ijcai.org/proceedings/0728.pdf
Text Rewriting Improves Semantic Role Labeling (Extended Abstract),,,,https://www.ijcai.org/proceedings/0729.pdf
"POPPONENT- Highly accurate, individually and socially efficient opponent preference model in bilateral multi issue negotiations (Extended Abstract)",,,,https://www.ijcai.org/proceedings/0730.pdf
Robotic Strategic Behavior in Adversarial Environments,,,,https://www.ijcai.org/proceedings/0731.pdf
Game Theoretic Analysis of Security and Sustainability,,,,https://www.ijcai.org/proceedings/0732.pdf
Logic meets Probability- Towards Explainable AI Systems for Uncertain Worlds,,,,https://www.ijcai.org/proceedings/0733.pdf
Committee Scoring Rules- A Call to Arms,,,,https://www.ijcai.org/proceedings/0734.pdf
Learning from Data Heterogeneity- Algorithms and Applications,,,,https://www.ijcai.org/proceedings/0735.pdf
Knowledge Engineering for Intelligent Decision Support,,,,https://www.ijcai.org/proceedings/0736.pdf
Multimodal News Article Analysis,,,,https://www.ijcai.org/proceedings/0737.pdf
Towards Certified Unsolvability in Classical Planning,,,,https://www.ijcai.org/proceedings/0738.pdf
Reinforcement mechanism design,,,,https://www.ijcai.org/proceedings/0739.pdf
Unsupervised Learning via Total Correlation Explanation,,,,https://www.ijcai.org/proceedings/0740.pdf
Improving Group Decision-Making by Artificial Intelligence,,,,https://www.ijcai.org/proceedings/0741.pdf
Securing and scaling cryptocurrencies,,,,https://www.ijcai.org/proceedings/0742.pdf
A Framework for Long-Term Learning Systems,,,,https://www.ijcai.org/proceedings/0743.pdf
Learning Multi-faceted Knowledge Graph Embeddings for Natural Language Processing,,,,https://www.ijcai.org/proceedings/0744.pdf
Understanding and Measuring Collective Intelligence Across Different Cognitive Systems- An Information-Theoretic Approach,,,,https://www.ijcai.org/proceedings/0745.pdf
Online Algorithm Selection,,,,https://www.ijcai.org/proceedings/0746.pdf
SAT-Based Approaches for the General High School Timetabling Problem,,,,https://www.ijcai.org/proceedings/0747.pdf
Constructive Recommendation,,,,https://www.ijcai.org/proceedings/0748.pdf
Efficient Algorithms And Representations For Chance-constrained Mixed Constraint Programming,,,,https://www.ijcai.org/proceedings/0749.pdf
On the Complexity and Expressiveness of Automated Planning Languages Supporting Temporal Reasoning,,,,https://www.ijcai.org/proceedings/0750.pdf
Stochastic Constraint Programming,,,,https://www.ijcai.org/proceedings/0751.pdf
Machine Learning Techniques for MultiAgent Systems,,,,https://www.ijcai.org/proceedings/0752.pdf
Resilient Control and Safety for Multi-Agent Cyber-Physical Systems,,,,https://www.ijcai.org/proceedings/0753.pdf
Human-Like Agents for Repeated Negotiation,,,,https://www.ijcai.org/proceedings/0754.pdf
Multi-Agent Systems of Inverse Reinforcement Learners in Complex Games,,,,https://www.ijcai.org/proceedings/0755.pdf
Probabilistic Inference in Hybrid Domains,,,,https://www.ijcai.org/proceedings/0756.pdf
Curriculum Learning in Reinforcement Learning,,,,https://www.ijcai.org/proceedings/0757.pdf
Nonparametric Online Machine Learning with Kernels,,,,https://www.ijcai.org/proceedings/0758.pdf
Operationalizing Operational Logics- Semiotic Knowledge Representations for Interactive Systems,,,,https://www.ijcai.org/proceedings/0759.pdf
Teaching Robots through Situated Interactive Dialogue and Visual Demonstrations,,,,https://www.ijcai.org/proceedings/0760.pdf
AToM- An Analogical Theory of Mind,,,,https://www.ijcai.org/proceedings/0761.pdf
Modeling Bias Reduction Strategies in a Biased Agent,,,,https://www.ijcai.org/proceedings/0762.pdf
"Fuzzy Logic Model for Digital Forensics- A Trade-off between Accuracy, Complexity and Interpretability",,,,https://www.ijcai.org/proceedings/0763.pdf
Using Multiagents for Context-Aware Adaptive Biometrics,,,,https://www.ijcai.org/proceedings/0764.pdf
The Role of Textualisation and Argumentation in Understanding the Machine Learning Process,,,,https://www.ijcai.org/proceedings/0765.pdf
Search Strategies as Synchronous Processes (Extended Abstract),,,,https://www.ijcai.org/proceedings/0766.pdf
"Towards Trust, Transparency and Liability in AI - AS systems",,,,https://www.ijcai.org/proceedings/0767.pdf
Deep Abnormality Detection in Video Data,,,,https://www.ijcai.org/proceedings/0768.pdf
Searching for Well-Behaved Fragments of Halpern-Shoham Logic,,,,https://www.ijcai.org/proceedings/0769.pdf
Towards A Relational Approach For Tool Creation By Robots,,,,https://www.ijcai.org/proceedings/0770.pdf
Refinement of Intentions,,,,https://www.ijcai.org/proceedings/0771.pdf
Libratus- The Superhuman AI for No-Limit Poker,,,,https://www.ijcai.org/proceedings/0772.pdf
DISA- A Scientific Writing Advisor with Deep Information Structure Analysis,,,,https://www.ijcai.org/proceedings/0773.pdf
Omniscient Debugging for GOAL Agents in Eclipse (Demonstration),,,,https://www.ijcai.org/proceedings/0774.pdf
"A Goal-Oriented Meaning-based Statistical Multi-Step Math Word Problem Solver with Understanding, Reasoning and Explanation",,,,https://www.ijcai.org/proceedings/0775.pdf
Automated Planning for Urban Traffic Management,,,,https://www.ijcai.org/proceedings/0776.pdf
Speech-based Medical Decision Support in VR using a Deep Neural Network (Demonstration),,,,https://www.ijcai.org/proceedings/0777.pdf
Real--Time UAV Maneuvering via Automated Planning in Simulations,,,,https://www.ijcai.org/proceedings/0778.pdf
Limbo- A Reasoning System for Limited Belief,,,,https://www.ijcai.org/proceedings/0779.pdf
Emergency Evacuation Simulator (EES) - a Tool for Planning Community Evacuations in Australia,,,,https://www.ijcai.org/proceedings/0780.pdf
Become Popular in SNS- Tag Recommendation using FolkPopularityRank to Enhance Social Popularity,,,,https://www.ijcai.org/proceedings/0781.pdf
