title,keywords,group,link,pdf
Unsupervised Hierarchical Temporal Abstraction by Simultaneously Learning Expectations and Representations,,,,https://www.ijcai.org/proceedings/2019/0436.pdf
Meta-Learning for Low-resource Natural Language Generation in Task-oriented Dialogue Systems,,,,https://www.ijcai.org/proceedings/2019/0437.pdf
Robust Flexible Feature Selection via Exclusive L21 Regularization,,,,https://www.ijcai.org/proceedings/2019/0438.pdf
Advantage Amplification in Slowly Evolving Latent-State Environments,,,,https://www.ijcai.org/proceedings/2019/0439.pdf
Deep Variational Koopman Models- Inferring Koopman Observations for Uncertainty-Aware Dynamics Modeling and Control,,,,https://www.ijcai.org/proceedings/2019/0440.pdf
DyAt Nets- Dynamic Attention Networks for State Forecasting in Cyber-Physical Systems,,,,https://www.ijcai.org/proceedings/2019/0441.pdf
Outlier-Robust Multi-Aspect Streaming Tensor Completion and Factorization,,,,https://www.ijcai.org/proceedings/2019/0442.pdf
Incremental Learning of Planning Actions in Model-Based Reinforcement Learning,,,,https://www.ijcai.org/proceedings/2019/0443.pdf
Group LASSO with Asymmetric Structure Estimation for Multi-Task Learning,,,,https://www.ijcai.org/proceedings/2019/0444.pdf
Hill Climbing on Value Estimates for Search-control in Dyna,,,,https://www.ijcai.org/proceedings/2019/0445.pdf
Indirect Trust is Simple to Establish,,,,https://www.ijcai.org/proceedings/2019/0446.pdf
Exploiting Interaction Links for Node Classification with Deep Graph Neural Networks,,,,https://www.ijcai.org/proceedings/2019/0447.pdf
Improving Cross-lingual Entity Alignment via Optimal Transport,,,,https://www.ijcai.org/proceedings/2019/0448.pdf
Fine-grained Event Categorization with Heterogeneous Graph Convolutional Networks,,,,https://www.ijcai.org/proceedings/2019/0449.pdf
A Practical Semi-Parametric Contextual Bandit,,,,https://www.ijcai.org/proceedings/2019/0450.pdf
Graph Space Embedding,,,,https://www.ijcai.org/proceedings/2019/0451.pdf
"An Atari Model Zoo for Analyzing, Visualizing, and Comparing Deep Reinforcement Learning Agents",,,,https://www.ijcai.org/proceedings/2019/0452.pdf
Improving representation learning in autoencoders via multidimensional interpolation and dual regularizations,,,,https://www.ijcai.org/proceedings/2019/0453.pdf
Scalable Bayesian Non-linear Matrix Completion,,,,https://www.ijcai.org/proceedings/2019/0454.pdf
Noise-Resilient Similarity Preserving Network Embedding for Social Networks,,,,https://www.ijcai.org/proceedings/2019/0455.pdf
Fairwalk- Towards Fair Graph Embedding,,,,https://www.ijcai.org/proceedings/2019/0456.pdf
Automated Machine Learning with Monte-Carlo Tree Search,,,,https://www.ijcai.org/proceedings/2019/0457.pdf
Successor Options- An Option Discovery Framework for Reinforcement Learning,,,,https://www.ijcai.org/proceedings/2019/0458.pdf
Unifying the Stochastic and the Adversarial Bandits with Knapsack,,,,https://www.ijcai.org/proceedings/2019/0459.pdf
Label distribution learning with label-specific features,,,,https://www.ijcai.org/proceedings/2019/0460.pdf
Label Distribution Learning with Label Correlations via Low-Rank Approximation,,,,https://www.ijcai.org/proceedings/2019/0461.pdf
Closed-Loop Memory GAN for Continual Learning,,,,https://www.ijcai.org/proceedings/2019/0462.pdf
Complementary Learning for Overcoming Catastrophic Forgetting Using Experience Replay,,,,https://www.ijcai.org/proceedings/2019/0463.pdf
Discovering Regularities from Traditional Chinese Medicine Prescriptions via Bipartite Embedding Model,,,,https://www.ijcai.org/proceedings/2019/0464.pdf
A Degeneracy Framework for Scalable Graph Autoencoders,,,,https://www.ijcai.org/proceedings/2019/0465.pdf
Deterministic Routing between Layout Abstractions for Multi-Scale Classification of Visually Rich Documents,,,,https://www.ijcai.org/proceedings/2019/0466.pdf
SynthNet- Learning to Synthesize Music End-to-End,,,,https://www.ijcai.org/proceedings/2019/0467.pdf
Weakly Supervised Multi-task Learning for Semantic Parsing,,,,https://www.ijcai.org/proceedings/2019/0468.pdf
Community Detection and Link Prediction via Cluster-driven Low-rank Matrix Completion,,,,https://www.ijcai.org/proceedings/2019/0469.pdf
On the Effectiveness of Low Frequency Perturbations,,,,https://www.ijcai.org/proceedings/2019/0470.pdf
A Part Power Set Model for Scale-Free Person Retrieval,,,,https://www.ijcai.org/proceedings/2019/0471.pdf
Rapid Performance Gain through Active Model Reuse,,,,https://www.ijcai.org/proceedings/2019/0472.pdf
A Convergence Analysis of Distributed SGD with Communication-Efficient Gradient Sparsification,,,,https://www.ijcai.org/proceedings/2019/0473.pdf
Quadruply Stochastic Gradients for Large Scale Nonlinear Semi-Supervised AUC Optimization,,,,https://www.ijcai.org/proceedings/2019/0474.pdf
Soft Policy Gradient Method for Maximum Entropy Deep Reinforcement Learning,,,,https://www.ijcai.org/proceedings/2019/0475.pdf
Gradient Boosting with Piece-Wise Linear Regression Trees,,,,https://www.ijcai.org/proceedings/2019/0476.pdf
The Pupil Has Become the Master- Teacher-Student Model-Based Word Embedding Distillation with Ensemble Learning,,,,https://www.ijcai.org/proceedings/2019/0477.pdf
A Principled Approach for Learning Task Similarity in Multitask Learning,,,,https://www.ijcai.org/proceedings/2019/0478.pdf
Structure Learning for Safe Policy Improvement,,,,https://www.ijcai.org/proceedings/2019/0479.pdf
Play and Prune- Adaptive Filter Pruning for Deep Model Compression,,,,https://www.ijcai.org/proceedings/2019/0480.pdf
Solving Continual Combinatorial Selection via Deep Reinforcement Learning,,,,https://www.ijcai.org/proceedings/2019/0481.pdf
Playing FPS Games With Environment-Aware Hierarchical Reinforcement Learning,,,,https://www.ijcai.org/proceedings/2019/0482.pdf
Parallel Wasserstein Generative Adversarial Nets with Multiple Discriminators,,,,https://www.ijcai.org/proceedings/2019/0483.pdf
Finding Statistically Significant Interactions between Continuous Features,,,,https://www.ijcai.org/proceedings/2019/0484.pdf
Fast and Robust Multi-View Multi-Task Learning via Group Sparsity,,,,https://www.ijcai.org/proceedings/2019/0485.pdf
Multiplicative Sparse Feature Decomposition for Efficient Multi-View Multi-Task Learning,,,,https://www.ijcai.org/proceedings/2019/0486.pdf
Adversarial Imitation Learning from Incomplete Demonstrations,,,,https://www.ijcai.org/proceedings/2019/0487.pdf
Heavy-ball Algorithms Always Escape Saddle Points,,,,https://www.ijcai.org/proceedings/2019/0488.pdf
MEGAN- A Generative Adversarial Network for Multi-View Network Embedding,,,,https://www.ijcai.org/proceedings/2019/0489.pdf
Metric Learning on Healthcare Data with Incomplete Modalities,,,,https://www.ijcai.org/proceedings/2019/0490.pdf
HMLasso- Lasso with High Missing Rate,,,,https://www.ijcai.org/proceedings/2019/0491.pdf
Deeply-learned Hybrid Representations for Facial Age Estimation,,,,https://www.ijcai.org/proceedings/2019/0492.pdf
AugBoost- Gradient Boosting Enhanced with Step-Wise Feature Augmentation,,,,https://www.ijcai.org/proceedings/2019/0493.pdf
Adversarial Graph Embedding for Ensemble Clustering,,,,https://www.ijcai.org/proceedings/2019/0494.pdf
Hierarchical Inter-Attention Network for Document Classification with Multi-Task Learning,,,,https://www.ijcai.org/proceedings/2019/0495.pdf
Image Captioning with Compositional Neural Module Networks,,,,https://www.ijcai.org/proceedings/2019/0496.pdf
Imitation Learning from Video by Leveraging Proprioception,,,,https://www.ijcai.org/proceedings/2019/0497.pdf
Exchangeability and Kernel Invariance in Trained MLPs,,,,https://www.ijcai.org/proceedings/2019/0498.pdf
Deeper Connections between Neural Networks and Gaussian Processes Speed-up Active Learning,,,,https://www.ijcai.org/proceedings/2019/0499.pdf
Object Detection based Deep Unsupervised Hashing,,,,https://www.ijcai.org/proceedings/2019/0500.pdf
Ensemble-based Ultrahigh-dimensional Variable Screening,,,,https://www.ijcai.org/proceedings/2019/0501.pdf
Learning to Interpret Satellite Images using Wikipedia,,,,https://www.ijcai.org/proceedings/2019/0502.pdf
DeepCU- Integrating both Common and Unique Latent Information for Multimodal Sentiment Analysis,,,,https://www.ijcai.org/proceedings/2019/0503.pdf
Interpolation Consistency Training for Semi-supervised Learning,,,,https://www.ijcai.org/proceedings/2019/0504.pdf
Sharing Experience in Multitask Reinforcement Learning,,,,https://www.ijcai.org/proceedings/2019/0505.pdf
Planning with Expectation Models,,,,https://www.ijcai.org/proceedings/2019/0506.pdf
Recurrent Existence Determination Through Policy Optimization,,,,https://www.ijcai.org/proceedings/2019/0507.pdf
Boundary Perception Guidance- A Scribble-Supervised Semantic Segmentation Approach,,,,https://www.ijcai.org/proceedings/2019/0508.pdf
Attributed Graph Clustering- A Deep Attentional Embedding Approach,,,,https://www.ijcai.org/proceedings/2019/0509.pdf
Spectral Perturbation Meets Incomplete Multi-view Data,,,,https://www.ijcai.org/proceedings/2019/0510.pdf
Measuring Structural Similarities in Finite MDPs,,,,https://www.ijcai.org/proceedings/2019/0511.pdf
Discriminative and Correlative Partial Multi-Label Learning,,,,https://www.ijcai.org/proceedings/2019/0512.pdf
DMRAN-A Hierarchical Fine-Grained Attention-Based Network for Recommendation,,,,https://www.ijcai.org/proceedings/2019/0513.pdf
CLVSA- A Convolutional LSTM Based Variational Sequence-to-Sequence Model with Attention for Predicting Trends of Financial Markets,,,,https://www.ijcai.org/proceedings/2019/0514.pdf
Classification with Label Distribution Learning,,,,https://www.ijcai.org/proceedings/2019/0515.pdf
Attributed Subspace Clustering,,,,https://www.ijcai.org/proceedings/2019/0516.pdf
Deep Cascade Generation on Point Sets,,,,https://www.ijcai.org/proceedings/2019/0517.pdf
Discrete Binary Coding based Label Distribution Learning,,,,https://www.ijcai.org/proceedings/2019/0518.pdf
Differentially Private Iterative Gradient Hard Thresholding for Sparse Learning,,,,https://www.ijcai.org/proceedings/2019/0519.pdf
MUSICAL- Multi-Scale Image Contextual Attention Learning for Inpainting,,,,https://www.ijcai.org/proceedings/2019/0520.pdf
Partial Label Learning with Unlabeled Data,,,,https://www.ijcai.org/proceedings/2019/0521.pdf
Heterogeneous Graph Matching Networks for Unknown Malware Detection,,,,https://www.ijcai.org/proceedings/2019/0522.pdf
Modeling Multi-Purpose Sessions for Next-Item Recommendations via Mixture-Channel Purpose Routing Networks,,,,https://www.ijcai.org/proceedings/2019/0523.pdf
Multi-view Clustering via Late Fusion Alignment Maximization,,,,https://www.ijcai.org/proceedings/2019/0524.pdf
COP- Customized Deep Model Compression via Regularized Correlation-Based Filter-Level Pruning,,,,https://www.ijcai.org/proceedings/2019/0525.pdf
Position Focused Attention Network for Image-Text Matching,,,,https://www.ijcai.org/proceedings/2019/0526.pdf
Tag2Gauss- Learning Tag Representations via Gaussian Distribution in Tagged Networks,,,,https://www.ijcai.org/proceedings/2019/0527.pdf
Weak Supervision Enhanced Generative Network for Question Generation,,,,https://www.ijcai.org/proceedings/2019/0528.pdf
Unified Embedding Model over Heterogeneous Information Network for Personalized Recommendation,,,,https://www.ijcai.org/proceedings/2019/0529.pdf
Interactive Reinforcement Learning with Dynamic Reuse of Prior Knowledge from Human and Agent Demonstrations,,,,https://www.ijcai.org/proceedings/2019/0530.pdf
Hierarchical Diffusion Attention Network,,,,https://www.ijcai.org/proceedings/2019/0531.pdf
Learning Multi-Objective Rewards and User Utility Function in Contextual Bandits for Personalized Ranking,,,,https://www.ijcai.org/proceedings/2019/0532.pdf
Learning for Tail Label Data- A Label-Specific Feature Approach,,,,https://www.ijcai.org/proceedings/2019/0533.pdf
Bayesian Uncertainty Matching for Unsupervised Domain Adaptation,,,,https://www.ijcai.org/proceedings/2019/0534.pdf
RobustTrend- A Huber Loss with a Combined First and Second Order Difference Regularization for Time Series Trend Filtering,,,,https://www.ijcai.org/proceedings/2019/0535.pdf
Neural News Recommendation with Attentive Multi-View Learning,,,,https://www.ijcai.org/proceedings/2019/0536.pdf
PD-GAN- Adversarial Learning for Personalized Diversity-Promoting Recommendation,,,,https://www.ijcai.org/proceedings/2019/0537.pdf
Feature Evolution Based Multi-Task Learning for Collaborative Filtering with Social Trust,,,,https://www.ijcai.org/proceedings/2019/0538.pdf
Multi-View Multi-Label Learning with View-Specific Information Extraction,,,,https://www.ijcai.org/proceedings/2019/0539.pdf
Trend-Aware Tensor Factorization for Job Skill Demand Analysis,,,,https://www.ijcai.org/proceedings/2019/0540.pdf
Graph Convolutional Networks on User Mobility Heterogeneous Graphs for Social Relationship Inference,,,,https://www.ijcai.org/proceedings/2019/0541.pdf
BPAM- Recommendation Based on BP Neural Network with Attention Mechanism,,,,https://www.ijcai.org/proceedings/2019/0542.pdf
Incremental Few-Shot Learning for Pedestrian Attribute Recognition,,,,https://www.ijcai.org/proceedings/2019/0543.pdf
Reparameterizable Subset Sampling via Continuous Relaxations,,,,https://www.ijcai.org/proceedings/2019/0544.pdf
CFM- Convolutional Factorization Machines for Context-Aware Recommendation,,,,https://www.ijcai.org/proceedings/2019/0545.pdf
Adversarial Incomplete Multi-view Clustering,,,,https://www.ijcai.org/proceedings/2019/0546.pdf
Graph Contextualized Self-Attention Network for Session-based Recommendation,,,,https://www.ijcai.org/proceedings/2019/0547.pdf
Spatio-Temporal Attentive RNN for Node Classification in Temporal Attributed Graphs,,,,https://www.ijcai.org/proceedings/2019/0548.pdf
Learning a Generative Model for Fusing Infrared and Visible Images via Conditional Generative Adversarial Network with Dual Discriminators,,,,https://www.ijcai.org/proceedings/2019/0549.pdf
Topology Attack and Defense for Graph Neural Networks- An Optimization Perspective,,,,https://www.ijcai.org/proceedings/2019/0550.pdf
MR-GNN- Multi-Resolution and Dual Graph Neural Network for Predicting Structured Entity Interactions,,,,https://www.ijcai.org/proceedings/2019/0551.pdf
Commit Message Generation for Source Code Changes,,,,https://www.ijcai.org/proceedings/2019/0552.pdf
Latent Semantics Encoding for Label Distribution Learning,,,,https://www.ijcai.org/proceedings/2019/0553.pdf
Learning Image-Specific Attributes by Hyperbolic Neighborhood Graph Propagation,,,,https://www.ijcai.org/proceedings/2019/0554.pdf
Zero-shot Metric Learning,,,,https://www.ijcai.org/proceedings/2019/0555.pdf
On the Convergence of (Stochastic) Gradient Descent with Extrapolation for Non-Convex Minimization,,,,https://www.ijcai.org/proceedings/2019/0556.pdf
Transfer of Temporal Logic Formulas in Reinforcement Learning,,,,https://www.ijcai.org/proceedings/2019/0557.pdf
Deep Spectral Kernel Learning,,,,https://www.ijcai.org/proceedings/2019/0558.pdf
Deep Correlated Predictive Subspace Learning for Incomplete Multi-View Semi-Supervised Classification,,,,https://www.ijcai.org/proceedings/2019/0559.pdf
Multi-scale Information Diffusion Prediction with Reinforced Recurrent Networks,,,,https://www.ijcai.org/proceedings/2019/0560.pdf
Learning Strictly Orthogonal p-Order Nonnegative Laplacian Embedding via Smoothed Iterative Reweighted Method,,,,https://www.ijcai.org/proceedings/2019/0561.pdf
Low-Bit Quantization for Attributed Network Representation Learning,,,,https://www.ijcai.org/proceedings/2019/0562.pdf
Topology Optimization based Graph Convolutional Network,,,,https://www.ijcai.org/proceedings/2019/0563.pdf
Dual Self-Paced Graph Convolutional Network- Towards Reducing Attribute Distortions Induced by Topology,,,,https://www.ijcai.org/proceedings/2019/0564.pdf
Masked Graph Convolutional Network,,,,https://www.ijcai.org/proceedings/2019/0565.pdf
Deep Multi-Task Learning with Adversarial-and-Cooperative Nets,,,,https://www.ijcai.org/proceedings/2019/0566.pdf
Legal Judgment Prediction via Multi-Perspective Bi-Feedback Network,,,,https://www.ijcai.org/proceedings/2019/0567.pdf
Comprehensive Semi-Supervised Multi-Modal Learning,,,,https://www.ijcai.org/proceedings/2019/0568.pdf
SPAGAN- Shortest Path Graph Attention Network,,,,https://www.ijcai.org/proceedings/2019/0569.pdf
On the Estimation of Treatment Effect with Text Covariates,,,,https://www.ijcai.org/proceedings/2019/0570.pdf
Privacy-Preserving Stacking with Application to Cross-organizational Diabetes Prediction,,,,https://www.ijcai.org/proceedings/2019/0571.pdf
Multi-View Multiple Clustering,,,,https://www.ijcai.org/proceedings/2019/0572.pdf
Amalgamating Filtered Knowledge- Learning Task-customized Student from Multi-task Teachers,,,,https://www.ijcai.org/proceedings/2019/0573.pdf
A Vectorized Relational Graph Convolutional Network for Multi-Relational Network Alignment,,,,https://www.ijcai.org/proceedings/2019/0574.pdf
Distributed Collaborative Feature Selection Based on Intermediate Representation,,,,https://www.ijcai.org/proceedings/2019/0575.pdf
Out-of-sample Node Representation Learning for Heterogeneous Graph in Real-time Android Malware Detection,,,,https://www.ijcai.org/proceedings/2019/0576.pdf
Neural Network based Continuous Conditional Random Field for Fine-grained Crime Prediction,,,,https://www.ijcai.org/proceedings/2019/0577.pdf
BN-invariant Sharpness Regularizes the Training Model to Better Generalization,,,,https://www.ijcai.org/proceedings/2019/0578.pdf
Geometric Understanding for Unsupervised Subspace Learning,,,,https://www.ijcai.org/proceedings/2019/0579.pdf
Belief Propagation Network for Hard Inductive Semi-Supervised Learning,,,,https://www.ijcai.org/proceedings/2019/0580.pdf
Metatrace Actor-Critic- Online Step-Size Tuning by Meta-gradient Descent for Reinforcement Learning Control,,,,https://www.ijcai.org/proceedings/2019/0581.pdf
Semi-supervised Three-dimensional Reconstruction Framework with GAN,,,,https://www.ijcai.org/proceedings/2019/0582.pdf
Interpreting and Evaluating Neural Network Robustness,,,,https://www.ijcai.org/proceedings/2019/0583.pdf
VAEGAN- A Collaborative Filtering Framework based on Adversarial Variational Autoencoders,,,,https://www.ijcai.org/proceedings/2019/0584.pdf
Adaptive User Modeling with Long and Short-Term Preferences for Personalized Recommendation,,,,https://www.ijcai.org/proceedings/2019/0585.pdf
Progressive Transfer Learning for Person Re-identification,,,,https://www.ijcai.org/proceedings/2019/0586.pdf
DARec- Deep Domain Adaptation for Cross-Domain Recommendation via Transferring Rating Patterns,,,,https://www.ijcai.org/proceedings/2019/0587.pdf
KCNN- Kernel-wise Quantization to Remarkably Decrease Multiplications in Convolutional Neural Network,,,,https://www.ijcai.org/proceedings/2019/0588.pdf
Experience Replay Optimization,,,,https://www.ijcai.org/proceedings/2019/0589.pdf
Positive and Unlabeled Learning with Label Disambiguation,,,,https://www.ijcai.org/proceedings/2019/0590.pdf
Generalized Majorization-Minimization for Non-Convex Optimization,,,,https://www.ijcai.org/proceedings/2019/0591.pdf
STAR-GCN- Stacked and Reconstructed Graph Convolutional Networks for Recommender Systems,,,,https://www.ijcai.org/proceedings/2019/0592.pdf
Light-Weight Hybrid Convolutional Network for Liver Tumor Segmentation,,,,https://www.ijcai.org/proceedings/2019/0593.pdf
ProNE- Fast and Scalable Network Representation Learning,,,,https://www.ijcai.org/proceedings/2019/0594.pdf
Towards Robust ResNet- A Small Step but a Giant Leap,,,,https://www.ijcai.org/proceedings/2019/0595.pdf
High Dimensional Bayesian Optimization via Supervised Dimension Reduction,,,,https://www.ijcai.org/proceedings/2019/0596.pdf
Efficient Non-parametric Bayesian Hawkes Processes,,,,https://www.ijcai.org/proceedings/2019/0597.pdf
Inferring Substitutable Products with Deep Network Embedding,,,,https://www.ijcai.org/proceedings/2019/0598.pdf
Quaternion Collaborative Filtering for Recommendation,,,,https://www.ijcai.org/proceedings/2019/0599.pdf
Feature-level Deeper Self-Attention Network for Sequential Recommendation,,,,https://www.ijcai.org/proceedings/2019/0600.pdf
Attributed Graph Clustering via Adaptive Graph Convolution,,,,https://www.ijcai.org/proceedings/2019/0601.pdf
InteractionNN- A Neural Network for Learning Hidden Features in Sparse Prediction,,,,https://www.ijcai.org/proceedings/2019/0602.pdf
Multi-Group Encoder-Decoder Networks to Fuse Heterogeneous Data for Next-Day Air Quality Prediction,,,,https://www.ijcai.org/proceedings/2019/0603.pdf
Taming the Noisy Gradient- Train Deep Neural Networks with Small Batch Sizes,,,,https://www.ijcai.org/proceedings/2019/0604.pdf
Accelerated Inference Framework of Sparse Neural Network Based on Nested Bitmask Structure,,,,https://www.ijcai.org/proceedings/2019/0605.pdf
DANE- Domain Adaptive Network Embedding,,,,https://www.ijcai.org/proceedings/2019/0606.pdf
ATTAIN- Attention-based Time-Aware LSTM Networks for Disease Progression Modeling,,,,https://www.ijcai.org/proceedings/2019/0607.pdf
Scalable Block-Diagonal Locality-Constrained Projective Dictionary Learning,,,,https://www.ijcai.org/proceedings/2019/0608.pdf
Open-Ended Long-Form Video Question Answering via Hierarchical Convolutional Self-Attention Networks,,,,https://www.ijcai.org/proceedings/2019/0609.pdf
Localizing Unseen Activities in Video via Image Query,,,,https://www.ijcai.org/proceedings/2019/0610.pdf
Multi-Prototype Networks for Unconstrained Set-based Face Recognition,,,,https://www.ijcai.org/proceedings/2019/0611.pdf
GAN-EM- GAN Based EM Learning Framework,,,,https://www.ijcai.org/proceedings/2019/0612.pdf
Large Scale Evolving Graphs with Burst Detection,,,,https://www.ijcai.org/proceedings/2019/0613.pdf
AddGraph- Anomaly Detection in Dynamic Graph Using Attention-based Temporal GCN,,,,https://www.ijcai.org/proceedings/2019/0614.pdf
Metadata-driven Task Relation Discovery for Multi-task Learning,,,,https://www.ijcai.org/proceedings/2019/0615.pdf
BeatGAN- Anomalous Rhythm Detection using Adversarially Generated Time Series,,,,https://www.ijcai.org/proceedings/2019/0616.pdf
Latent Distribution Preserving Deep Subspace Clustering,,,,https://www.ijcai.org/proceedings/2019/0617.pdf
Reinforcement Learning Experience Reuse with Policy Residual Representation,,,,https://www.ijcai.org/proceedings/2019/0618.pdf
Collaborative Metric Learning with Memory Network for Multi-Relational Recommender Systems,,,,https://www.ijcai.org/proceedings/2019/0619.pdf
One-Shot Texture Retrieval with Global Context Metric,,,,https://www.ijcai.org/proceedings/2019/0620.pdf
HDI-Forest- Highest Density Interval Regression Forest,,,,https://www.ijcai.org/proceedings/2019/0621.pdf
Prediction of Mild Cognitive Impairment Conversion Using Auxiliary Information,,,,https://www.ijcai.org/proceedings/2019/0622.pdf
Simultaneous Representation Learning and Clustering for Incomplete Multi-view Data,,,,https://www.ijcai.org/proceedings/2019/0623.pdf
Persistence Bag-of-Words for Topological Data Analysis,,,,https://www.ijcai.org/proceedings/2019/0624.pdf
Exploiting the Sign of the Advantage Function to Learn Deterministic Policies in Continuous Domains,,,,https://www.ijcai.org/proceedings/2019/0625.pdf
Predicting the Visual Focus of Attention in Multi-Person Discussion Videos,,,,https://www.ijcai.org/proceedings/2019/0626.pdf
A Quantum-inspired Classical Algorithm for Separable Non-negative Matrix Factorization,,,,https://www.ijcai.org/proceedings/2019/0627.pdf
MLRDA- A Multi-Task Semi-Supervised Learning Framework for Drug-Drug Interaction Prediction,,,,https://www.ijcai.org/proceedings/2019/0628.pdf
Combining ADMM and the Augmented Lagrangian Method for Efficiently Handling Many Constraints,,,,https://www.ijcai.org/proceedings/2019/0629.pdf
Playing Card-Based RTS Games with Deep Reinforcement Learning,,,,https://www.ijcai.org/proceedings/2019/0631.pdf
FSM- A Fast Similarity Measurement for Gene Regulatory Networks via Genes Influence Power,,,,https://www.ijcai.org/proceedings/2019/0632.pdf
Pseudo Supervised Matrix Factorization in Discriminative Subspace,,,,https://www.ijcai.org/proceedings/2019/0633.pdf
Representation Learning-Assisted Click-Through Rate Prediction,,,,https://www.ijcai.org/proceedings/2019/0634.pdf
Dynamic Electronic Toll Collection via Multi-Agent Deep Reinforcement Learning with Edge-Based Graph Convolutional Networks,,,,https://www.ijcai.org/proceedings/2019/0635.pdf
FireCast- Leveraging Deep Learning to Predict Wildfire Spread,,,,https://www.ijcai.org/proceedings/2019/0636.pdf
Faster Distributed Deep Net Training- Computation and Communication Decoupled Stochastic Gradient Descent,,,,https://www.ijcai.org/proceedings/2019/0637.pdf
Randomized Adversarial Imitation Learning for Autonomous Driving,,,,https://www.ijcai.org/proceedings/2019/0638.pdf
Scaling Fine-grained Modularity Clustering for Massive Graphs,,,,https://www.ijcai.org/proceedings/2019/0639.pdf
Node Embedding over Temporal Graphs,,,,https://www.ijcai.org/proceedings/2019/0640.pdf
Medical Concept Embedding with Multiple Ontological Representations,,,,https://www.ijcai.org/proceedings/2019/0641.pdf
Learning Shared Vertex Representation in Heterogeneous Graphs with Convolutional Networks for Recommendation,,,,https://www.ijcai.org/proceedings/2019/0642.pdf
Dual-Path in Dual-Path Network for Single Image Dehazing,,,,https://www.ijcai.org/proceedings/2019/0643.pdf
Disparity-preserved Deep Cross-platform Association for Cross-platform Video Recommendation,,,,https://www.ijcai.org/proceedings/2019/0644.pdf
Predicting dominance in multi-person videos,,,,https://www.ijcai.org/proceedings/2019/0645.pdf
Procedural Generation of Initial States of Sokoban,,,,https://www.ijcai.org/proceedings/2019/0646.pdf
DeepInspect- A Black-box Trojan Detection and Mitigation Framework for Deep Neural Networks,,,,https://www.ijcai.org/proceedings/2019/0647.pdf
