title,keywords,group,link,pdf
VulSniper- Focus Your Attention to Shoot Fine-Grained Vulnerabilities,,,,https://www.ijcai.org/proceedings/2019/0648.pdf
Real-Time Adversarial Attacks,,,,https://www.ijcai.org/proceedings/2019/0649.pdf
Explainable Fashion Recommendation- A Semantic Attribute Region Guided Approach,,,,https://www.ijcai.org/proceedings/2019/0650.pdf
Model-Agnostic Adversarial Detection by Random Perturbations,,,,https://www.ijcai.org/proceedings/2019/0651.pdf
Musical Composition Style Transfer via Disentangled Timbre Representations,,,,https://www.ijcai.org/proceedings/2019/0652.pdf
Multiple Policy Value Monte Carlo Tree Search,,,,https://www.ijcai.org/proceedings/2019/0653.pdf
Robustra- Training Provable Robust Neural Networks over Reference Adversarial Space,,,,https://www.ijcai.org/proceedings/2019/0654.pdf
Dilated Convolution with Dilated GRU for Music Source Separation,,,,https://www.ijcai.org/proceedings/2019/0655.pdf
Locate-Then-Detect- Real-time Web Attack Detection via Attention-based Deep Neural Networks,,,,https://www.ijcai.org/proceedings/2019/0656.pdf
Data Poisoning against Differentially-Private Learners- Attacks and Defenses,,,,https://www.ijcai.org/proceedings/2019/0657.pdf
LogAnomaly- Unsupervised Detection of Sequential and Quantitative Anomalies in Unstructured Logs,,,,https://www.ijcai.org/proceedings/2019/0658.pdf
Decidability of Model Checking Multi-Agent Systems with Regular Expressions against Epistemic HS Specifications,,,,https://www.ijcai.org/proceedings/2019/0659.pdf
Heterogeneous Gaussian Mechanism- Preserving Differential Privacy in Deep Learning with Provable Robustness,,,,https://www.ijcai.org/proceedings/2019/0660.pdf
Demystifying the Combination of Dynamic Slicing and Spectrum-based Fault Localization,,,,https://www.ijcai.org/proceedings/2019/0661.pdf
Equally-Guided Discriminative Hashing for Cross-modal Retrieval,,,,https://www.ijcai.org/proceedings/2019/0662.pdf
A Privacy Preserving Collusion Secure DCOP Algorithm,,,,https://www.ijcai.org/proceedings/2019/0663.pdf
Two-Stage Generative Models of Simulating Training Data at The Voxel Level for Large-Scale Microscopy Bioimage Segmentation,,,,https://www.ijcai.org/proceedings/2019/0664.pdf
Lower Bound of Locally Differentially Private Sparse Covariance Matrix Estimation,,,,https://www.ijcai.org/proceedings/2019/0665.pdf
Principal Component Analysis in the Local Differential Privacy Model,,,,https://www.ijcai.org/proceedings/2019/0666.pdf
Binarized Collaborative Filtering with Distilling Graph Convolutional Network,,,,https://www.ijcai.org/proceedings/2019/0667.pdf
Novel Collaborative Filtering Recommender Friendly to Privacy Protection,,,,https://www.ijcai.org/proceedings/2019/0668.pdf
Adversarial Examples for Graph Data- Deep Insights into Attack and Defense,,,,https://www.ijcai.org/proceedings/2019/0669.pdf
FABA- An Algorithm for Fast Aggregation against Byzantine Attacks in Distributed Neural Networks,,,,https://www.ijcai.org/proceedings/2019/0670.pdf
BAYHENN- Combining Bayesian Deep Learning and Homomorphic Encryption for Secure DNN Inference,,,,https://www.ijcai.org/proceedings/2019/0671.pdf
Toward Efficient Navigation of Massive-Scale Geo-Textual Streams,,,,https://www.ijcai.org/proceedings/2019/0672.pdf
Temporal Pyramid Pooling Convolutional Neural Network for Cover Song Identification,,,,https://www.ijcai.org/proceedings/2019/0673.pdf
Data Poisoning Attack against Knowledge Graph Embedding,,,,https://www.ijcai.org/proceedings/2019/0674.pdf
On Privacy Protection of Latent Dirichlet Allocation Model Training,,,,https://www.ijcai.org/proceedings/2019/0675.pdf
K-Core Maximization- An Edge Addition Approach,,,,https://www.ijcai.org/proceedings/2019/0676.pdf
Pivotal Relationship Identification- The K-Truss Minimization Problem,,,,https://www.ijcai.org/proceedings/2019/0677.pdf
Early Discovery of Emerging Entities in Microblogs,,,,https://www.ijcai.org/proceedings/2019/0678.pdf
Neural Program Induction for KBQA Without Gold Programs or Query Annotations,,,,https://www.ijcai.org/proceedings/2019/0679.pdf
Medical Concept Representation Learning from Multi-source Data,,,,https://www.ijcai.org/proceedings/2019/0680.pdf
Multi-Domain Sentiment Classification Based on Domain-Aware Embedding and Attention,,,,https://www.ijcai.org/proceedings/2019/0681.pdf
A Latent Variable Model for Learning Distributional Relation Vectors,,,,https://www.ijcai.org/proceedings/2019/0682.pdf
Generating Multiple Diverse Responses with Multi-Mapping and Posterior Mapping Selection,,,,https://www.ijcai.org/proceedings/2019/0683.pdf
Sentiment-Controllable Chinese Poetry Generation,,,,https://www.ijcai.org/proceedings/2019/0684.pdf
From Words to Sentences- A Progressive Learning Approach for Zero-resource Machine Translation with Visual Pivots,,,,https://www.ijcai.org/proceedings/2019/0685.pdf
Learning towards Abstractive Timeline Summarization,,,,https://www.ijcai.org/proceedings/2019/0686.pdf
Coreference Aware Representation Learning for Neural Named Entity Recognition,,,,https://www.ijcai.org/proceedings/2019/0687.pdf
Learning Assistance from an Adversarial Critic for Multi-Outputs Prediction,,,,https://www.ijcai.org/proceedings/2019/0688.pdf
End-to-End Multi-Perspective Matching for Entity Resolution,,,,https://www.ijcai.org/proceedings/2019/0689.pdf
Difficulty Controllable Generation of Reading Comprehension Questions,,,,https://www.ijcai.org/proceedings/2019/0690.pdf
Modeling Source Syntax and Semantics for Neural AMR Parsing,,,,https://www.ijcai.org/proceedings/2019/0691.pdf
CNN-Based Chinese NER with Lexicon Rethinking,,,,https://www.ijcai.org/proceedings/2019/0692.pdf
Dual Visual Attention Network for Visual Dialog,,,,https://www.ijcai.org/proceedings/2019/0693.pdf
AmazonQA- A Review-Based Question Answering Task,,,,https://www.ijcai.org/proceedings/2019/0694.pdf
Answering Binary Causal Questions Through Large-Scale Text Mining- An Evaluation Using Cause-Effect Pairs from Human Experts,,,,https://www.ijcai.org/proceedings/2019/0695.pdf
GSN- A Graph-Structured Network for Multi-Party Dialogues,,,,https://www.ijcai.org/proceedings/2019/0696.pdf
Leap-LSTM- Enhancing Long Short-Term Memory for Text Categorization,,,,https://www.ijcai.org/proceedings/2019/0697.pdf
Relation Extraction Using Supervision from Topic Knowledge of Relation Labels,,,,https://www.ijcai.org/proceedings/2019/0698.pdf
Representation Learning with Weighted Inner Product for Universal Approximation of General Similarities,,,,https://www.ijcai.org/proceedings/2019/0699.pdf
Incorporating Structural Information for Better Coreference Resolution,,,,https://www.ijcai.org/proceedings/2019/0700.pdf
Knowledge Base Question Answering with Topic Units,,,,https://www.ijcai.org/proceedings/2019/0701.pdf
Adversarial Transfer for Named Entity Boundary Detection with Pointer Networks,,,,https://www.ijcai.org/proceedings/2019/0702.pdf
Towards Discriminative Representation Learning for Speech Emotion Recognition,,,,https://www.ijcai.org/proceedings/2019/0703.pdf
Self-attentive Biaffine Dependency Parsing,,,,https://www.ijcai.org/proceedings/2019/0704.pdf
Reading selectively via Binary Input Gated Recurrent Unit,,,,https://www.ijcai.org/proceedings/2019/0705.pdf
Learning to Select Knowledge for Response Generation in Dialog Systems,,,,https://www.ijcai.org/proceedings/2019/0706.pdf
Deep Mask Memory Network with Semantic Dependency and Context Moment for Aspect Level Sentiment Classification,,,,https://www.ijcai.org/proceedings/2019/0707.pdf
Exploring and Distilling Cross-Modal Information for Image Captioning,,,,https://www.ijcai.org/proceedings/2019/0708.pdf
Network Embedding with Dual Generation Tasks,,,,https://www.ijcai.org/proceedings/2019/0709.pdf
Building Personalized Simulator for Interactive Search,,,,https://www.ijcai.org/proceedings/2019/0710.pdf
A Dual Reinforcement Learning Framework for Unsupervised Text Style Transfer,,,,https://www.ijcai.org/proceedings/2019/0711.pdf
Unsupervised Neural Aspect Extraction with Sememes,,,,https://www.ijcai.org/proceedings/2019/0712.pdf
Randomized Greedy Search for Structured Prediction- Amortized Inference and Learning,,,,https://www.ijcai.org/proceedings/2019/0713.pdf
Aspect-Based Sentiment Classification with Attentive Neural Turing Machines,,,,https://www.ijcai.org/proceedings/2019/0714.pdf
Learning Task-Specific Representation for Novel Words in Sequence Labeling,,,,https://www.ijcai.org/proceedings/2019/0715.pdf
Improving Cross-Domain Performance for Relation Extraction via Dependency Prediction and Information Flow Control,,,,https://www.ijcai.org/proceedings/2019/0716.pdf
Learn to Select via Hierarchical Gate Mechanism for Aspect-Based Sentiment Analysis,,,,https://www.ijcai.org/proceedings/2019/0717.pdf
Aligning Learning Outcomes to Learning Resources- A Lexico-Semantic Spatial Approach,,,,https://www.ijcai.org/proceedings/2019/0718.pdf
A Deep Generative Model for Code Switched Text,,,,https://www.ijcai.org/proceedings/2019/0719.pdf
Knowledge Aware Semantic Concept Expansion for Image-Text Matching,,,,https://www.ijcai.org/proceedings/2019/0720.pdf
Exploiting Persona Information for Diverse Generation of Conversational Responses,,,,https://www.ijcai.org/proceedings/2019/0721.pdf
Cold-Start Aware Deep Memory Network for Multi-Entity Aspect-Based Sentiment Analysis,,,,https://www.ijcai.org/proceedings/2019/0722.pdf
GANs for Semi-Supervised Opinion Spam Detection,,,,https://www.ijcai.org/proceedings/2019/0723.pdf
PRoFET- Predicting the Risk of Firms from Event Transcripts,,,,https://www.ijcai.org/proceedings/2019/0724.pdf
Unsupervised Embedding Enhancements of Knowledge Graphs using Textual Associations,,,,https://www.ijcai.org/proceedings/2019/0725.pdf
Swell-and-Shrink- Decomposing Image Captioning by Transformation and Summarization,,,,https://www.ijcai.org/proceedings/2019/0726.pdf
T-CVAE- Transformer-Based Conditioned Variational Autoencoder for Story Completion,,,,https://www.ijcai.org/proceedings/2019/0727.pdf
Robust Embedding with Multi-Level Structures for Link Prediction,,,,https://www.ijcai.org/proceedings/2019/0728.pdf
Revealing Semantic Structures of Texts- Multi-grained Framework for Automatic Mind-map Generation,,,,https://www.ijcai.org/proceedings/2019/0729.pdf
Correct-and-Memorize- Learning to Translate from Interactive Revisions,,,,https://www.ijcai.org/proceedings/2019/0730.pdf
Modeling Noisy Hierarchical Types in Fine-Grained Entity Typing- A Content-Based Weighting Approach,,,,https://www.ijcai.org/proceedings/2019/0731.pdf
Mask and Infill- Applying Masked Language Model for Sentiment Transfer,,,,https://www.ijcai.org/proceedings/2019/0732.pdf
Relation-Aware Entity Alignment for Heterogeneous Knowledge Graphs,,,,https://www.ijcai.org/proceedings/2019/0733.pdf
RTHN- A RNN-Transformer Hierarchical Network for Emotion Cause Extraction,,,,https://www.ijcai.org/proceedings/2019/0734.pdf
Sharing Attention Weights for Fast Transformer,,,,https://www.ijcai.org/proceedings/2019/0735.pdf
A Goal-Driven Tree-Structured Neural Model for Math Word Problems,,,,https://www.ijcai.org/proceedings/2019/0736.pdf
Dual-View Variational Autoencoders for Semi-Supervised Text Matching,,,,https://www.ijcai.org/proceedings/2019/0737.pdf
Earlier Attention- Aspect-Aware LSTM for Aspect-Based Sentiment Analysis,,,,https://www.ijcai.org/proceedings/2019/0738.pdf
Polygon-Net- A General Framework for Jointly Boosting Multiple Unsupervised Neural Machine Translation Models,,,,https://www.ijcai.org/proceedings/2019/0739.pdf
Neural Collective Entity Linking Based on Recurrent Random Walk Network Learning,,,,https://www.ijcai.org/proceedings/2019/0740.pdf
Robust Audio Adversarial Example for a Physical Attack,,,,https://www.ijcai.org/proceedings/2019/0741.pdf
HorNet- A Hierarchical Offshoot Recurrent Network for Improving Person Re-ID via Image Captioning,,,,https://www.ijcai.org/proceedings/2019/0742.pdf
Knowledge-enhanced Hierarchical Attention for Community Question Answering with Multi-task and Adaptive Learning,,,,https://www.ijcai.org/proceedings/2019/0743.pdf
Knowledgeable Storyteller- A Commonsense-Driven Generative Model for Visual Storytelling,,,,https://www.ijcai.org/proceedings/2019/0744.pdf
Triplet Enhanced AutoEncoder- Model-free Discriminative Network Embedding,,,,https://www.ijcai.org/proceedings/2019/0745.pdf
Improving Multilingual Sentence Embedding using Bi-directional Dual Encoder with Additive Margin Softmax,,,,https://www.ijcai.org/proceedings/2019/0746.pdf
Utilizing Non-Parallel Text for Style Transfer by Making Partial Comparisons,,,,https://www.ijcai.org/proceedings/2019/0747.pdf
Graph-based Neural Sentence Ordering,,,,https://www.ijcai.org/proceedings/2019/0748.pdf
Refining Word Representations by Manifold Learning,,,,https://www.ijcai.org/proceedings/2019/0749.pdf
Beyond Word Attention- Using Segment Attention in Neural Relation Extraction,,,,https://www.ijcai.org/proceedings/2019/0750.pdf
Adapting BERT for Target-Oriented Multimodal Sentiment Classification,,,,https://www.ijcai.org/proceedings/2019/0751.pdf
Modeling both Context- and Speaker-Sensitive Dependence for Emotion Detection in Multi-speaker Conversations,,,,https://www.ijcai.org/proceedings/2019/0752.pdf
Extracting Entities and Events as a Single Task Using a Transition-Based Neural Model,,,,https://www.ijcai.org/proceedings/2019/0753.pdf
Multi-view Knowledge Graph Embedding for Entity Alignment,,,,https://www.ijcai.org/proceedings/2019/0754.pdf
Quantum-Inspired Interactive Networks for Conversational Sentiment Analysis,,,,https://www.ijcai.org/proceedings/2019/0755.pdf
A Document-grounded Matching Network for Response Selection in Retrieval-based Chatbots,,,,https://www.ijcai.org/proceedings/2019/0756.pdf
Recurrent Neural Network for Text Classification with Hierarchical Multiscale Dense Connections,,,,https://www.ijcai.org/proceedings/2019/0757.pdf
RLTM- An Efficient Neural IR Framework for Long Documents,,,,https://www.ijcai.org/proceedings/2019/0758.pdf
Dynamically Route Hierarchical Structure Representation to Attentive Capsule for Text Classification,,,,https://www.ijcai.org/proceedings/2019/0759.pdf
Sequence Generation- From Both Sides to the Middle,,,,https://www.ijcai.org/proceedings/2019/0760.pdf
Getting in Shape- Word Embedding SubSpaces,,,,https://www.ijcai.org/proceedings/2019/0761.pdf
A Span-based Joint Model for Opinion Target Extraction and Target Sentiment Classification,,,,https://www.ijcai.org/proceedings/2019/0762.pdf
Earliest-Completion Scheduling of Contract Algorithms with End Guarantees,,,,https://www.ijcai.org/proceedings/2019/0763.pdf
Finding Optimal Solutions in HTN Planning - A SAT-based Approach,,,,https://www.ijcai.org/proceedings/2019/0764.pdf
Faster Dynamic Controllability Checking in Temporal Networks with Integer Bounds,,,,https://www.ijcai.org/proceedings/2019/0765.pdf
Regular Decision Processes- A Model for Non-Markovian Domains,,,,https://www.ijcai.org/proceedings/2019/0766.pdf
Strong Fully Observable Non-Deterministic Planning with LTL and LTLf Goals,,,,https://www.ijcai.org/proceedings/2019/0767.pdf
Counterexample-Guided Strategy Improvement for POMDPs Using Recurrent Neural Networks,,,,https://www.ijcai.org/proceedings/2019/0768.pdf
Influence of State-Variable Constraints on Partially Observable Monte Carlo Planning,,,,https://www.ijcai.org/proceedings/2019/0769.pdf
Online Probabilistic Goal Recognition over Nominal Models,,,,https://www.ijcai.org/proceedings/2019/0770.pdf
Generalized Potential Heuristics for Classical Planning,,,,https://www.ijcai.org/proceedings/2019/0771.pdf
Subgoal-Based Temporal Abstraction in Monte-Carlo Tree Search,,,,https://www.ijcai.org/proceedings/2019/0772.pdf
Fair Online Allocation of Perishable Goods and its Application to Electric Vehicle Charging,,,,https://www.ijcai.org/proceedings/2019/0773.pdf
Dynamic logic of parallel propositional assignments and its applications to planning,,,,https://www.ijcai.org/proceedings/2019/0774.pdf
Approximability of Constant-horizon Constrained POMDP,,,,https://www.ijcai.org/proceedings/2019/0775.pdf
Bayesian Inference of Linear Temporal Logic Specifications for Contrastive Explanations,,,,https://www.ijcai.org/proceedings/2019/0776.pdf
Partitioning Techniques in LTLf Synthesis,,,,https://www.ijcai.org/proceedings/2019/0777.pdf
Adaptive Thompson Sampling Stacks for Memory Bounded Open-Loop Planning,,,,https://www.ijcai.org/proceedings/2019/0778.pdf
A Novel Distribution-Embedded Neural Network for Sensor-Based Activity Recognition,,,,https://www.ijcai.org/proceedings/2019/0779.pdf
Pattern Selection for Optimal Classical Planning with Saturated Cost Partitioning,,,,https://www.ijcai.org/proceedings/2019/0780.pdf
Scheduling Jobs with Stochastic Processing Time on Parallel Identical Machines,,,,https://www.ijcai.org/proceedings/2019/0781.pdf
On Computational Complexity of Pickup-and-Delivery Problems with Precedence Constraints or Time Windows,,,,https://www.ijcai.org/proceedings/2019/0782.pdf
Merge-and-Shrink Task Reformulation for Classical Planning,,,,https://www.ijcai.org/proceedings/2019/0783.pdf
Steady-State Policy Synthesis for Verifiable Control,,,,https://www.ijcai.org/proceedings/2019/0784.pdf
Energy-Efficient Slithering Gait Exploration for a Snake-Like Robot Based on Reinforcement Learning,,,,https://www.ijcai.org/proceedings/2019/0785.pdf
The Parameterized Complexity of Motion Planning for Snake-Like Robots,,,,https://www.ijcai.org/proceedings/2019/0786.pdf
Unsupervised Learning of Monocular Depth and Ego-Motion using Conditional PatchGANs,,,,https://www.ijcai.org/proceedings/2019/0787.pdf
Region Deformer Networks for Unsupervised Depth Estimation from Unconstrained Monocular Videos,,,,https://www.ijcai.org/proceedings/2019/0788.pdf
Statistical Guarantees for the Robustness of Bayesian Neural Networks,,,,https://www.ijcai.org/proceedings/2019/0789.pdf
Lifted Message Passing for Hybrid Probabilistic Inference,,,,https://www.ijcai.org/proceedings/2019/0790.pdf
Bayesian Parameter Estimation for Nonlinear Dynamics Using Sensitivity Analysis,,,,https://www.ijcai.org/proceedings/2019/0791.pdf
Thompson Sampling on Symmetric Alpha-Stable Bandits,,,,https://www.ijcai.org/proceedings/2019/0792.pdf
On Constrained Open-World Probabilistic Databases,,,,https://www.ijcai.org/proceedings/2019/0793.pdf
An End-to-End Community Detection Model- Integrating LDA into Markov Random Field via Factor Graph,,,,https://www.ijcai.org/proceedings/2019/0794.pdf
Exact Bernoulli Scan Statistics using Binary Decision Diagrams,,,,https://www.ijcai.org/proceedings/2019/0795.pdf
Hyper-parameter Tuning under a Budget Constraint,,,,https://www.ijcai.org/proceedings/2019/0796.pdf
Cutset Bayesian Networks- A New Representation for Learning Rao-Blackwellised Graphical Models,,,,https://www.ijcai.org/proceedings/2019/0797.pdf
Ranked Programming,,,,https://www.ijcai.org/proceedings/2019/0798.pdf
ISLF- Interest Shift and Latent Factors Combination Model for Session-based Recommendation,,,,https://www.ijcai.org/proceedings/2019/0799.pdf
DiffChaser- Detecting Disagreements for Deep Neural Networks,,,,https://www.ijcai.org/proceedings/2019/0800.pdf
SparseSense- Human Activity Recognition from Highly Sparse Sensor Data-streams Using Set-based Neural Networks,,,,https://www.ijcai.org/proceedings/2019/0801.pdf
Governance by Glass-Box- Implementing Transparent Moral Bounds for AI Behaviour,,,,https://www.ijcai.org/proceedings/2019/0802.pdf
Decision Making for Improving Maritime Traffic Safety Using Constraint Programming,,,,https://www.ijcai.org/proceedings/2019/0803.pdf
Evaluating the Interpretability of the Knowledge Compilation Map- Communicating Logical Statements Effectively,,,,https://www.ijcai.org/proceedings/2019/0804.pdf
AI-powered Posture Training- Application of Machine Learning in Sitting Posture Recognition Using the LifeChair Smart Cushion,,,,https://www.ijcai.org/proceedings/2019/0805.pdf
Improving Law Enforcement Daily Deployment Through Machine Learning-Informed Optimization under Uncertainty,,,,https://www.ijcai.org/proceedings/2019/0806.pdf
Risk Assessment for Networked-guarantee Loans Using High-order Graph Attention Representation,,,,https://www.ijcai.org/proceedings/2019/0807.pdf
PI-Bully- Personalized Cyberbullying Detection with Peer Influence,,,,https://www.ijcai.org/proceedings/2019/0808.pdf
The Price of Local Fairness in Multistage Selection,,,,https://www.ijcai.org/proceedings/2019/0809.pdf
Enhancing Stock Movement Prediction with Adversarial Training,,,,https://www.ijcai.org/proceedings/2019/0810.pdf
Safe Contextual Bayesian Optimization for Sustainable Room Temperature PID Control Tuning,,,,https://www.ijcai.org/proceedings/2019/0811.pdf
DDL- Deep Dictionary Learning for Predictive Phenotyping,,,,https://www.ijcai.org/proceedings/2019/0812.pdf
Improving Customer Satisfaction in Bike Sharing Systems through Dynamic Repositioning,,,,https://www.ijcai.org/proceedings/2019/0813.pdf
mdfa- Multi-Differential Fairness Auditor for Black Box Classifiers,,,,https://www.ijcai.org/proceedings/2019/0814.pdf
CounterFactual Regression with Importance Sampling Weights,,,,https://www.ijcai.org/proceedings/2019/0815.pdf
MINA- Multilevel Knowledge-Guided Attention for Modeling Electrocardiography Signals,,,,https://www.ijcai.org/proceedings/2019/0816.pdf
RDPD- Rich Data Helps Poor Data via Imitation,,,,https://www.ijcai.org/proceedings/2019/0817.pdf
Systematic Conservation Planning for Sustainable Land-use Policies- A Constrained Partitioning Approach to Reserve Selection and Design.,,,,https://www.ijcai.org/proceedings/2019/0818.pdf
Truly Batch Apprenticeship Learning with Deep Successor Features,,,,https://www.ijcai.org/proceedings/2019/0819.pdf
Scribble-to-Painting Transformation with Multi-Task Generative Adversarial Networks,,,,https://www.ijcai.org/proceedings/2019/0820.pdf
Diversity-Inducing Policy Gradient- Using Maximum Mean Discrepancy to Find a Set of Diverse Policies,,,,https://www.ijcai.org/proceedings/2019/0821.pdf
KitcheNette- Predicting and Ranking Food Ingredient Pairings using Siamese Neural Network,,,,https://www.ijcai.org/proceedings/2019/0822.pdf
MNN- Multimodal Attentional Neural Networks for Diagnosis Prediction,,,,https://www.ijcai.org/proceedings/2019/0823.pdf
Global Robustness Evaluation of Deep Neural Networks with Provable Guarantees for the Hamming Distance,,,,https://www.ijcai.org/proceedings/2019/0824.pdf
Pre-training of Graph Augmented Transformers for Medication Recommendation,,,,https://www.ijcai.org/proceedings/2019/0825.pdf
Three-quarter Sibling Regression for Denoising Observational Data,,,,https://www.ijcai.org/proceedings/2019/0826.pdf
Daytime Sleepiness Level Prediction Using Respiratory Information,,,,https://www.ijcai.org/proceedings/2019/0827.pdf
Simultaneous Prediction Intervals for Patient-Specific Survival Curves,,,,https://www.ijcai.org/proceedings/2019/0828.pdf
Controllable Neural Story Plot Generation via Reward Shaping,,,,https://www.ijcai.org/proceedings/2019/0829.pdf
Bidirectional Active Learning with Gold-Instance-Based Human Training,,,,https://www.ijcai.org/proceedings/2019/0830.pdf
Group-Fairness in Influence Maximization,,,,https://www.ijcai.org/proceedings/2019/0831.pdf
Failure-Scenario Maker for Rule-Based Agent using Multi-agent Adversarial Reinforcement Learning and its Application to Autonomous Driving,,,,https://www.ijcai.org/proceedings/2019/0832.pdf
Protecting Neural Networks with Hierarchical Random Switching- Towards Better Robustness-Accuracy Trade-off for Stochastic Defenses,,,,https://www.ijcai.org/proceedings/2019/0833.pdf
Who Should Pay the Cost- A Game-theoretic Model for Government Subsidized Investments to Improve National Cybersecurity,,,,https://www.ijcai.org/proceedings/2019/0834.pdf
Automatic Grassland Degradation Estimation Using Deep Learning,,,,https://www.ijcai.org/proceedings/2019/0835.pdf
Balanced Ranking with Diversity Constraints,,,,https://www.ijcai.org/proceedings/2019/0836.pdf
A Decomposition Approach for Urban Anomaly Detection Across Spatiotemporal Data,,,,https://www.ijcai.org/proceedings/2019/0837.pdf
Learning Interpretable Relational Structures of Hinge-loss Markov Random Fields,,,,https://www.ijcai.org/proceedings/2019/0838.pdf
K-margin-based Residual-Convolution-Recurrent Neural Network for Atrial Fibrillation Detection,,,,https://www.ijcai.org/proceedings/2019/0839.pdf
LTL and Beyond- Formal Languages for Reward Function Specification in Reinforcement Learning,,,,https://www.ijcai.org/proceedings/2019/0840.pdf
Playgol- Learning Programs Through Play,,,,https://www.ijcai.org/proceedings/2019/0841.pdf
Learning Relational Representations with Auto-encoding Logic Programs,,,,https://www.ijcai.org/proceedings/2019/0842.pdf
A Comparative Study of Distributional and Symbolic Paradigms for Relational Learning,,,,https://www.ijcai.org/proceedings/2019/0843.pdf
Learning Hierarchical Symbolic Representations to Support Interactive Task Learning and Knowledge Transfer,,,,https://www.ijcai.org/proceedings/2019/0844.pdf
EL Embeddings- Geometric Construction of Models for the Description Logic EL++,,,,https://www.ijcai.org/proceedings/2019/0845.pdf
How Well Do Machines Perform on IQ tests- a Comparison Study on a Large-Scale Dataset,,,,https://www.ijcai.org/proceedings/2019/0846.pdf
Synthesizing Datalog Programs using Numerical Relaxation,,,,https://www.ijcai.org/proceedings/2019/0847.pdf
A Refined Understanding of Cost-optimal Planning with Polytree Causal Graphs,,,,https://www.ijcai.org/proceedings/2019/0848.pdf
Closed-World Semantics for Conjunctive Queries with Negation over ELH-bottom Ontologies,,,,https://www.ijcai.org/proceedings/2019/0849.pdf
Quality Control Attack Schemes in Crowdsourcing,,,,https://www.ijcai.org/proceedings/2019/0850.pdf
Do We Need Many-valued Logics for Incomplete Information-,,,,https://www.ijcai.org/proceedings/2019/0851.pdf
Addressing Age-Related Bias in Sentiment Analysis,,,,https://www.ijcai.org/proceedings/2019/0852.pdf
