title,keywords,group,link,pdf
Demiguise Attack- Crafting Invisible Semantic Adversarial Perturbations with Perceptual Similarity,,,,https://www.ijcai.org/proceedings/2021/0430.pdf
Self-Supervised Adversarial Distribution Regularization for Medication Recommendation,,,,https://www.ijcai.org/proceedings/2021/0431.pdf
Against Membership Inference Attack- Pruning is All You Need,,,,https://www.ijcai.org/proceedings/2021/0432.pdf
Layer-Assisted Neural Topic Modeling over Document Networks,,,,https://www.ijcai.org/proceedings/2021/0433.pdf
Robust Adversarial Imitation Learning via Adaptively-Selected Demonstrations,,,,https://www.ijcai.org/proceedings/2021/0434.pdf
Reinforcement Learning Based Sparse Black-box Adversarial Attack on Video Recognition Models,,,,https://www.ijcai.org/proceedings/2021/0435.pdf
Reward-Constrained Behavior Cloning,,,,https://www.ijcai.org/proceedings/2021/0436.pdf
Closing the BIG-LID- An Effective Local Intrinsic Dimensionality Defense for Nonlinear Regression Poisoning,,,,https://www.ijcai.org/proceedings/2021/0437.pdf
GSPL- A Succinct Kernel Model for Group-Sparse Projections Learning of Multiview Data,,,,https://www.ijcai.org/proceedings/2021/0438.pdf
Deep Reinforcement Learning Boosted Partial Domain Adaptation,,,,https://www.ijcai.org/proceedings/2021/0439.pdf
Learning Deeper Non-Monotonic Networks by Softly Transferring Solution Space,,,,https://www.ijcai.org/proceedings/2021/0440.pdf
Exploiting Spiking Dynamics with Spatial-temporal Feature Normalization in Graph Learning,,,,https://www.ijcai.org/proceedings/2021/0441.pdf
k-Nearest Neighbors by Means of Sequence to Sequence Deep Neural Networks and Memory Networks,,,,https://www.ijcai.org/proceedings/2021/0442.pdf
Evolutionary Gradient Descent for Non-convex Optimization,,,,https://www.ijcai.org/proceedings/2021/0443.pdf
KDExplainer- A Task-oriented Attention Model for Explaining Knowledge Distillation,,,,https://www.ijcai.org/proceedings/2021/0444.pdf
Clustering-Induced Adaptive Structure Enhancing Network for Incomplete Multi-View Data,,,,https://www.ijcai.org/proceedings/2021/0445.pdf
Differentially Private Pairwise Learning Revisited,,,,https://www.ijcai.org/proceedings/2021/0446.pdf
Decomposable-Net- Scalable Low-Rank Compression for Neural Networks,,,,https://www.ijcai.org/proceedings/2021/0447.pdf
A Clustering-based framework for Classifying Data Streams,,,,https://www.ijcai.org/proceedings/2021/0448.pdf
Multi-level Generative Models for Partial Label Learning with Non-random Label Noise,,,,https://www.ijcai.org/proceedings/2021/0449.pdf
Secure Deep Graph Generation with Link Differential Privacy,,,,https://www.ijcai.org/proceedings/2021/0450.pdf
Progressive Open-Domain Response Generation with Multiple Controllable Attributes,,,,https://www.ijcai.org/proceedings/2021/0451.pdf
Unsupervised Path Representation Learning with Curriculum Negative Sampling,,,,https://www.ijcai.org/proceedings/2021/0452.pdf
BESA- BERT-based Simulated Annealing for Adversarial Text Attacks,,,,https://www.ijcai.org/proceedings/2021/0453.pdf
Rethinking Label-Wise Cross-Modal Retrieval from A Semantic Sharing Perspective,,,,https://www.ijcai.org/proceedings/2021/0454.pdf
Blocking-based Neighbor Sampling for Large-scale Graph Neural Networks,,,,https://www.ijcai.org/proceedings/2021/0455.pdf
Understanding the Effect of Bias in Deep Anomaly Detection,,,,https://www.ijcai.org/proceedings/2021/0456.pdf
Improving Sequential Recommendation Consistency with Self-Supervised Imitation,,,,https://www.ijcai.org/proceedings/2021/0457.pdf
Graph Universal Adversarial Attacks- A Few Bad Actors Ruin Graph Learning Models,,,,https://www.ijcai.org/proceedings/2021/0458.pdf
Hindsight Trust Region Policy Optimization,,,,https://www.ijcai.org/proceedings/2021/0459.pdf
Deep Descriptive Clustering,,,,https://www.ijcai.org/proceedings/2021/0460.pdf
Independence-aware Advantage Estimation,,,,https://www.ijcai.org/proceedings/2021/0461.pdf
UNBERT- User-News Matching BERT for News Recommendation,,,,https://www.ijcai.org/proceedings/2021/0462.pdf
Correlation-Guided Representation for Multi-Label Text Classification,,,,https://www.ijcai.org/proceedings/2021/0463.pdf
Private Stochastic Non-convex Optimization with Improved Utility Rates,,,,https://www.ijcai.org/proceedings/2021/0464.pdf
Non-I.I.D. Multi-Instance Learning for Predicting Instance and Bag Labels with Variational Auto-Encoder,,,,https://www.ijcai.org/proceedings/2021/0465.pdf
Model-based Multi-agent Policy Optimization with Adaptive Opponent-wise Rollouts,,,,https://www.ijcai.org/proceedings/2021/0466.pdf
"Rethink the Connections among Generalization, Memorization, and the Spectral Bias of DNNs",,,,https://www.ijcai.org/proceedings/2021/0467.pdf
User Retention- A Causal Approach with Triple Task Modeling,,,,https://www.ijcai.org/proceedings/2021/0468.pdf
Neural Relation Inference for Multi-dimensional Temporal Point Processes via Message Passing Graph,,,,https://www.ijcai.org/proceedings/2021/0469.pdf
Combining Tree Search and Action Prediction for State-of-the-Art Performance in DouDiZhu,,,,https://www.ijcai.org/proceedings/2021/0470.pdf
Uncertainty-Aware Few-Shot Image Classification,,,,https://www.ijcai.org/proceedings/2021/0471.pdf
Automatic Mixed-Precision Quantization Search of BERT,,,,https://www.ijcai.org/proceedings/2021/0472.pdf
Graph Debiased Contrastive Learning with Joint Representation Clustering,,,,https://www.ijcai.org/proceedings/2021/0473.pdf
Uncertainty-aware Binary Neural Networks,,,,https://www.ijcai.org/proceedings/2021/0474.pdf
Few-Shot Partial-Label Learning,,,,https://www.ijcai.org/proceedings/2021/0475.pdf
Non-decreasing Quantile Function Network with Efficient Exploration for Distributional Reinforcement Learning,,,,https://www.ijcai.org/proceedings/2021/0476.pdf
Multi-Target Invisibly Trojaned Networks for Visual Recognition and Detection,,,,https://www.ijcai.org/proceedings/2021/0477.pdf
AutoReCon- Neural Architecture Search-based Reconstruction for Data-free Compression,,,,https://www.ijcai.org/proceedings/2021/0478.pdf
You Get What You Sow- High Fidelity Image Synthesis with a Single Pretrained Network,,,,https://www.ijcai.org/proceedings/2021/0479.pdf
MapGo- Model-Assisted Policy Optimization for Goal-Oriented Tasks,,,,https://www.ijcai.org/proceedings/2021/0480.pdf
Toward Optimal Solution for the Context-Attentive Bandit Problem,,,,https://www.ijcai.org/proceedings/2021/0481.pdf
Sample Efficient Decentralized Stochastic Frank-Wolfe Methods for Continuous DR-Submodular Maximization,,,,https://www.ijcai.org/proceedings/2021/0482.pdf
Self-Guided Community Detection on Networks with Missing Edges,,,,https://www.ijcai.org/proceedings/2021/0483.pdf
Two-Sided Wasserstein Procrustes Analysis,,,,https://www.ijcai.org/proceedings/2021/0484.pdf
Solving Math Word Problems with Teacher Supervision,,,,https://www.ijcai.org/proceedings/2021/0485.pdf
Collaborative Graph Learning with Auxiliary Text for Temporal Event Prediction in Healthcare,,,,https://www.ijcai.org/proceedings/2021/0486.pdf
MDNN- A Multimodal Deep Neural Network for Predicting Drug-Drug Interaction Events,,,,https://www.ijcai.org/proceedings/2021/0487.pdf
SPADE- A Semi-supervised Probabilistic Approach for Detecting Errors in Tables,,,,https://www.ijcai.org/proceedings/2021/0488.pdf
TEC- A Time Evolving Contextual Graph Model for Speaker State Analysis in Political Debates,,,,https://www.ijcai.org/proceedings/2021/0489.pdf
Adaptive Residue-wise Profile Fusion for Low Homologous Protein Secondary Structure Prediction Using External Knowledge,,,,https://www.ijcai.org/proceedings/2021/0490.pdf
Ordering-Based Causal Discovery with Reinforcement Learning,,,,https://www.ijcai.org/proceedings/2021/0491.pdf
Boosting Offline Reinforcement Learning with Residual Generative Modeling,,,,https://www.ijcai.org/proceedings/2021/0492.pdf
Multi-series Time-aware Sequence Partitioning for Disease Progression Modeling,,,,https://www.ijcai.org/proceedings/2021/0493.pdf
A Rule Mining-based Advanced Persistent Threats Detection System,,,,https://www.ijcai.org/proceedings/2021/0494.pdf
Electrocardio Panorama- Synthesizing New ECG views with Self-supervision,,,,https://www.ijcai.org/proceedings/2021/0495.pdf
A Novel Sequence-to-Subgraph Framework for Diagnosis Classification,,,,https://www.ijcai.org/proceedings/2021/0496.pdf
Parallel Subtrajectory Alignment over Massive-Scale Trajectory Data,,,,https://www.ijcai.org/proceedings/2021/0497.pdf
TrafficStream- A Streaming Traffic Flow Forecasting Framework Based on Graph Neural Networks and Continual Learning,,,,https://www.ijcai.org/proceedings/2021/0498.pdf
Predictive Job Scheduling under Uncertain Constraints in Cloud Computing,,,,https://www.ijcai.org/proceedings/2021/0499.pdf
Fine-tuning Is Not Enough- A Simple yet Effective Watermark Removal Attack for DNN Models,,,,https://www.ijcai.org/proceedings/2021/0500.pdf
Dynamic Lane Traffic Signal Control with Group Attention and Multi-Timescale Reinforcement Learning,,,,https://www.ijcai.org/proceedings/2021/0501.pdf
Differentially Private Correlation Alignment for Domain Adaptation,,,,https://www.ijcai.org/proceedings/2021/0502.pdf
Traffic Congestion Alleviation over Dynamic Road Networks- Continuous Optimal Route Combination for Trip Query Streams,,,,https://www.ijcai.org/proceedings/2021/0503.pdf
CFR-MIX- Solving Imperfect Information Extensive-Form Games with Combinatorial Action Space,,,,https://www.ijcai.org/proceedings/2021/0504.pdf
Online Credit Payment Fraud Detection via Structure-Aware Hierarchical Recurrent Neural Network,,,,https://www.ijcai.org/proceedings/2021/0505.pdf
Learning Unknown from Correlations- Graph Neural Network for Inter-novel-protein Interaction Prediction,,,,https://www.ijcai.org/proceedings/2021/0506.pdf
Adapting Meta Knowledge with Heterogeneous Information Network for COVID-19 Themed Malicious Repository Detection,,,,https://www.ijcai.org/proceedings/2021/0507.pdf
Hierarchical Adaptive Temporal-Relational Modeling for Stock Trend Prediction,,,,https://www.ijcai.org/proceedings/2021/0508.pdf
BACKDOORL- Backdoor Attack against Competitive Reinforcement Learning,,,,https://www.ijcai.org/proceedings/2021/0509.pdf
Hiding Numerical Vectors in Local Private and Shuffled Messages,,,,https://www.ijcai.org/proceedings/2021/0510.pdf
Solving Large-Scale Extensive-Form Network Security Games via Neural Fictitious Self-Play,,,,https://www.ijcai.org/proceedings/2021/0511.pdf
Towards Generating Summaries for Lexically Confusing Code through Code Erosion,,,,https://www.ijcai.org/proceedings/2021/0512.pdf
Change Matters- Medication Change Prediction with Recurrent Residual Networks,,,,https://www.ijcai.org/proceedings/2021/0513.pdf
SafeDrug- Dual Molecular Graph Encoders for Recommending Effective and Safe Drug Combinations,,,,https://www.ijcai.org/proceedings/2021/0514.pdf
Real-Time Pricing Optimization for Ride-Hailing Quality of Service,,,,https://www.ijcai.org/proceedings/2021/0515.pdf
GraphMI- Extracting Private Graph Data from Graph Neural Networks,,,,https://www.ijcai.org/proceedings/2021/0516.pdf
CSGNN- Contrastive Self-Supervised Graph Neural Network for Molecular Interaction Prediction,,,,https://www.ijcai.org/proceedings/2021/0517.pdf
"Long-term, Short-term and Sudden Event- Trading Volume Movement Prediction with Graph-based Multi-view Modeling",,,,https://www.ijcai.org/proceedings/2021/0518.pdf
Objective-aware Traffic Simulation via Inverse Reinforcement Learning,,,,https://www.ijcai.org/proceedings/2021/0519.pdf
"Exemplification Modeling- Can You Give Me an Example, Please-",,,,https://www.ijcai.org/proceedings/2021/0520.pdf
Generating Senses and RoLes- An End-to-End Model for Dependency- and Span-based Semantic Role Labeling,,,,https://www.ijcai.org/proceedings/2021/0521.pdf
Improving Context-Aware Neural Machine Translation with Source-side Monolingual Documents,,,,https://www.ijcai.org/proceedings/2021/0522.pdf
Focus on Interaction- A Novel Dynamic Graph Model for Joint Multiple Intent Detection and Slot Filling,,,,https://www.ijcai.org/proceedings/2021/0523.pdf
Dialogue Discourse-Aware Graph Model and Data Augmentation for Meeting Summarization,,,,https://www.ijcai.org/proceedings/2021/0524.pdf
Automatically Paraphrasing via Sentence Reconstruction and Round-trip Translation,,,,https://www.ijcai.org/proceedings/2021/0525.pdf
Dialogue Disentanglement in Software Engineering- How Far are We-,,,,https://www.ijcai.org/proceedings/2021/0526.pdf
FedSpeech- Federated Text-to-Speech with Continual Learning,,,,https://www.ijcai.org/proceedings/2021/0527.pdf
ALaSca- an Automated approach for Large-Scale Lexical Substitution,,,,https://www.ijcai.org/proceedings/2021/0528.pdf
Enhancing Label Representations with Relational Inductive Bias Constraint for Fine-Grained Entity Typing,,,,https://www.ijcai.org/proceedings/2021/0529.pdf
Modelling General Properties of Nouns by Selectively Averaging Contextualised Embeddings,,,,https://www.ijcai.org/proceedings/2021/0530.pdf
Asynchronous Multi-grained Graph Network For Interpretable Multi-hop Reading Comprehension,,,,https://www.ijcai.org/proceedings/2021/0531.pdf
Keep the Structure- A Latent Shift-Reduce Parser for Semantic Parsing,,,,https://www.ijcai.org/proceedings/2021/0532.pdf
Discourse-Level Event Temporal Ordering with Uncertainty-Guided Graph Completion,,,,https://www.ijcai.org/proceedings/2021/0533.pdf
Improving Text Generation with Dynamic Masking and Recovering,,,,https://www.ijcai.org/proceedings/2021/0534.pdf
Consistent Inference for Dialogue Relation Extraction,,,,https://www.ijcai.org/proceedings/2021/0535.pdf
Multi-Hop Fact Checking of Political Claims,,,,https://www.ijcai.org/proceedings/2021/0536.pdf
Laughing Heads- Can Transformers Detect What Makes a Sentence Funny-,,,,https://www.ijcai.org/proceedings/2021/0537.pdf
A Streaming End-to-End Framework For Spoken Language Understanding,,,,https://www.ijcai.org/proceedings/2021/0538.pdf
MultiMirror- Neural Cross-lingual Word Alignment for Multilingual Word Sense Disambiguation,,,,https://www.ijcai.org/proceedings/2021/0539.pdf
Learning Class-Transductive Intent Representations for Zero-shot Intent Detection,,,,https://www.ijcai.org/proceedings/2021/0540.pdf
MEDA- Meta-Learning with Data Augmentation for Few-Shot Text Classification,,,,https://www.ijcai.org/proceedings/2021/0541.pdf
A Sequence-to-Set Network for Nested Named Entity Recognition,,,,https://www.ijcai.org/proceedings/2021/0542.pdf
A Structure Self-Aware Model for Discourse Parsing on Multi-Party Dialogues,,,,https://www.ijcai.org/proceedings/2021/0543.pdf
Hierarchical Modeling of Label Dependency and Label Noise in Fine-grained Entity Typing,,,,https://www.ijcai.org/proceedings/2021/0544.pdf
Learn from Syntax- Improving Pair-wise Aspect and Opinion Terms Extraction with Rich Syntactic Knowledge,,,,https://www.ijcai.org/proceedings/2021/0545.pdf
Knowledge-Aware Dialogue Generation via Hierarchical Infobox Accessing and Infobox-Dialogue Interaction Graph Network,,,,https://www.ijcai.org/proceedings/2021/0546.pdf
Improving Stylized Neural Machine Translation with Iterative Dual Knowledge Transfer,,,,https://www.ijcai.org/proceedings/2021/0547.pdf
UniMF- A Unified Framework to Incorporate Multimodal Knowledge Bases intoEnd-to-End Task-Oriented Dialogue Systems,,,,https://www.ijcai.org/proceedings/2021/0548.pdf
MRD-Net- Multi-Modal Residual Knowledge Distillation for Spoken Question Answering,,,,https://www.ijcai.org/proceedings/2021/0549.pdf
Cross-Domain Slot Filling as Machine Reading Comprehension,,,,https://www.ijcai.org/proceedings/2021/0550.pdf
Document-level Relation Extraction as Semantic Segmentation,,,,https://www.ijcai.org/proceedings/2021/0551.pdf
"Drop Redundant, Shrink Irrelevant- Selective Knowledge Injection for Language Pretraining",,,,https://www.ijcai.org/proceedings/2021/0552.pdf
Relational Gating for What If Reasoning,,,,https://www.ijcai.org/proceedings/2021/0553.pdf
Efficient Black-Box Planning Using Macro-Actions with Focused Effects,,,,https://www.ijcai.org/proceedings/2021/0554.pdf
ME-MCTS- Online Generalization by Combining Multiple Value Estimators,,,,https://www.ijcai.org/proceedings/2021/0555.pdf
Learn to Intervene- An Adaptive Learning Policy for Restless Bandits in Application to Preventive Healthcare,,,,https://www.ijcai.org/proceedings/2021/0556.pdf
Type-WA-- Using Exploration in Bounded Suboptimal Planning,,,,https://www.ijcai.org/proceedings/2021/0557.pdf
Custom-Design of FDR Encodings- The Case of Red-Black Planning,,,,https://www.ijcai.org/proceedings/2021/0558.pdf
Active Goal Recognition Design,,,,https://www.ijcai.org/proceedings/2021/0559.pdf
Stochastic Probing with Increasing Precision,,,,https://www.ijcai.org/proceedings/2021/0560.pdf
Incorporating Queueing Dynamics into Schedule-Driven Traffic Control,,,,https://www.ijcai.org/proceedings/2021/0561.pdf
Symbolic Dynamic Programming for Continuous State MDPs with Linear Program Transitions,,,,https://www.ijcai.org/proceedings/2021/0562.pdf
Interference-free Walks in Time- Temporally Disjoint Paths,,,,https://www.ijcai.org/proceedings/2021/0563.pdf
Counterfactual Explanations for Optimization-Based Decisions in the Context of the GDPR,,,,https://www.ijcai.org/proceedings/2021/0564.pdf
LTL-Constrained Steady-State Policy Synthesis,,,,https://www.ijcai.org/proceedings/2021/0565.pdf
Online Learning of Action Models for PDDL Planning,,,,https://www.ijcai.org/proceedings/2021/0566.pdf
Polynomial-Time in PDDL Input Size- Making the Delete Relaxation Feasible for Lifted Planning,,,,https://www.ijcai.org/proceedings/2021/0567.pdf
Anytime Multi-Agent Path Finding via Large Neighborhood Search,,,,https://www.ijcai.org/proceedings/2021/0568.pdf
Dynamic Rebalancing Dockless Bike-Sharing System based on Station Community Discovery,,,,https://www.ijcai.org/proceedings/2021/0569.pdf
Synthesizing Good-Enough Strategies for LTLf Specifications,,,,https://www.ijcai.org/proceedings/2021/0570.pdf
Change the World - How Hard Can that Be- On the Computational Complexity of Fixing Planning Models,,,,https://www.ijcai.org/proceedings/2021/0571.pdf
Learning Temporal Plan Preferences from Examples- An Empirical Study,,,,https://www.ijcai.org/proceedings/2021/0572.pdf
On Weak Stubborn Sets in Classical Planning,,,,https://www.ijcai.org/proceedings/2021/0573.pdf
Learning Generalized Unsolvability Heuristics for Classical Planning,,,,https://www.ijcai.org/proceedings/2021/0574.pdf
Solving Partially Observable Stochastic Shortest-Path Games,,,,https://www.ijcai.org/proceedings/2021/0575.pdf
The Fewer the Merrier- Pruning Preferred Operators with Novelty,,,,https://www.ijcai.org/proceedings/2021/0576.pdf
TANGO- Commonsense Generalization in Predicting Tool Interactions for Mobile Manipulators,,,,https://www.ijcai.org/proceedings/2021/0577.pdf
The Traveling Tournament Problem with Maximum Tour Length Two- A Practical Algorithm with An Improved Approximation Bound,,,,https://www.ijcai.org/proceedings/2021/0578.pdf
Non-Parametric Stochastic Sequential Assignment With Random Arrival Times,,,,https://www.ijcai.org/proceedings/2021/0579.pdf
On the Parameterized Complexity of Polytree Learning,,,,https://www.ijcai.org/proceedings/2021/0580.pdf
Handling Overlaps When Lifting Gaussian Bayesian Networks,,,,https://www.ijcai.org/proceedings/2021/0581.pdf
Deep Bucket Elimination,,,,https://www.ijcai.org/proceedings/2021/0582.pdf
BKT-POMDP- Fast Action Selection for User Skill Modelling over Tasks with Multiple Skills,,,,https://www.ijcai.org/proceedings/2021/0583.pdf
Improved Acyclicity Reasoning for Bayesian Network Structure Learning with Constraint Programming,,,,https://www.ijcai.org/proceedings/2021/0584.pdf
Provable Guarantees on the Robustness of Decision Rules to Causal Interventions,,,,https://www.ijcai.org/proceedings/2021/0585.pdf
Fast Algorithms for Relational Marginal Polytopes,,,,https://www.ijcai.org/proceedings/2021/0586.pdf
Partition Function Estimation- A Quantitative Study,,,,https://www.ijcai.org/proceedings/2021/0587.pdf
A Survey of Machine Learning-Based Physics Event Generation,,,,https://www.ijcai.org/proceedings/2021/0588.pdf
Distortion in Social Choice Problems- The First 15 Years and Beyond,,,,https://www.ijcai.org/proceedings/2021/0589.pdf
Building Affordance Relations for Robotic Agents - A Review,,,,https://www.ijcai.org/proceedings/2021/0590.pdf
Recent Advances in Adversarial Training for Adversarial Robustness,,,,https://www.ijcai.org/proceedings/2021/0591.pdf
Hardware-Aware Neural Architecture Search- Survey and Taxonomy,,,,https://www.ijcai.org/proceedings/2021/0592.pdf
Recent Trends in Word Sense Disambiguation- A Survey,,,,https://www.ijcai.org/proceedings/2021/0593.pdf
When Computational Representation Meets Neuroscience- A Survey on Brain Encoding and Decoding,,,,https://www.ijcai.org/proceedings/2021/0594.pdf
Combinatorial Optimization and Reasoning with Graph Neural Networks,,,,https://www.ijcai.org/proceedings/2021/0595.pdf
Mechanism Design for Facility Location Problems- A Survey,,,,https://www.ijcai.org/proceedings/2021/0596.pdf
Knowledge-aware Zero-Shot Learning- Survey and Perspective,,,,https://www.ijcai.org/proceedings/2021/0597.pdf
Causal Learning for Socially Responsible AI,,,,https://www.ijcai.org/proceedings/2021/0598.pdf
Understanding the Relationship between Interactions and Outcomes in Human-in-the-Loop Machine Learning,,,,https://www.ijcai.org/proceedings/2021/0599.pdf
Argumentative XAI- A Survey,,,,https://www.ijcai.org/proceedings/2021/0600.pdf
Explanation in Constraint Satisfaction- A Survey,,,,https://www.ijcai.org/proceedings/2021/0601.pdf
Bayesian Nonparametric Space Partitions- A Survey,,,,https://www.ijcai.org/proceedings/2021/0602.pdf
"Where Is Your Place, Visual Place Recognition-",,,,https://www.ijcai.org/proceedings/2021/0603.pdf
A Comprehensive Survey on Image Dehazing Based on Deep Learning,,,,https://www.ijcai.org/proceedings/2021/0604.pdf
Emerging Methods of Auction Design in Social Networks,,,,https://www.ijcai.org/proceedings/2021/0605.pdf
Recent Advances in Heterogeneous Relation Learning for Recommendation,,,,https://www.ijcai.org/proceedings/2021/0606.pdf
Optimal Transport for Deep Generative Models- State of the Art and Research Challenges,,,,https://www.ijcai.org/proceedings/2021/0607.pdf
Reasoning-Based Learning of Interpretable ML Models,,,,https://www.ijcai.org/proceedings/2021/0608.pdf
If Only We Had Better Counterfactual Explanations- Five Key Deficits to Rectify in the Evaluation of Counterfactual XAI Techniques,,,,https://www.ijcai.org/proceedings/2021/0609.pdf
End-to-End Constrained Optimization Learning- A Survey,,,,https://www.ijcai.org/proceedings/2021/0610.pdf
"A Survey on Complex Knowledge Base Question Answering- Methods, Challenges and Solutions",,,,https://www.ijcai.org/proceedings/2021/0611.pdf
Pretrained Language Model for Text Generation- A Survey,,,,https://www.ijcai.org/proceedings/2021/0612.pdf
Person Search Challenges and Solutions- A Survey,,,,https://www.ijcai.org/proceedings/2021/0613.pdf
Policy Learning with Constraints in Model-free Reinforcement Learning- A Survey,,,,https://www.ijcai.org/proceedings/2021/0614.pdf
What’s the Context- Implicit and Explicit Assumptions in Model-Based Goal Recognition,,,,https://www.ijcai.org/proceedings/2021/0615.pdf
A Survey on Goal Recognition as Planning,,,,https://www.ijcai.org/proceedings/2021/0616.pdf
Hybrid Probabilistic Inference with Logical and Algebraic Constraints- a Survey,,,,https://www.ijcai.org/proceedings/2021/0617.pdf
The Power of the Weisfeiler-Leman Algorithm for Machine Learning with Graphs,,,,https://www.ijcai.org/proceedings/2021/0618.pdf
Automated Fact-Checking for Assisting Human Fact-Checkers,,,,https://www.ijcai.org/proceedings/2021/0619.pdf
Ten Years of BabelNet- A Survey,,,,https://www.ijcai.org/proceedings/2021/0620.pdf
Analogical Proportions- Why They Are Useful in AI,,,,https://www.ijcai.org/proceedings/2021/0621.pdf
A Survey on Spoken Language Understanding- Recent Advances and New Frontiers,,,,https://www.ijcai.org/proceedings/2021/0622.pdf
Neural Temporal Point Processes- A Review,,,,https://www.ijcai.org/proceedings/2021/0623.pdf
Qualitative Spatial and Temporal Reasoning- Current Status and Future Challenges,,,,https://www.ijcai.org/proceedings/2021/0624.pdf
A Unifying Bayesian Formulation of Measures of Interpretability in Human-AI Interaction,,,,https://www.ijcai.org/proceedings/2021/0625.pdf
Tournaments in Computational Social Choice- Recent Developments,,,,https://www.ijcai.org/proceedings/2021/0626.pdf
A Survey on Response Selection for Retrieval-based Dialogues,,,,https://www.ijcai.org/proceedings/2021/0627.pdf
Generalizing to Unseen Domains- A Survey on Domain Generalization,,,,https://www.ijcai.org/proceedings/2021/0628.pdf
A Survey on Low-Resource Neural Machine Translation,,,,https://www.ijcai.org/proceedings/2021/0629.pdf
Graph Learning based Recommender Systems- A Review,,,,https://www.ijcai.org/proceedings/2021/0630.pdf
Time Series Data Augmentation for Deep Learning- A Survey,,,,https://www.ijcai.org/proceedings/2021/0631.pdf
Challenges and Opportunities of Building Fast GBDT Systems,,,,https://www.ijcai.org/proceedings/2021/0632.pdf
Information-Theoretic Methods in Deep Neural Networks- Recent Advances and Emerging Opportunities,,,,https://www.ijcai.org/proceedings/2021/0633.pdf
A Comparative Survey- Benchmarking for Pool-based Active Learning,,,,https://www.ijcai.org/proceedings/2021/0634.pdf
A Survey on Universal Adversarial Attack,,,,https://www.ijcai.org/proceedings/2021/0635.pdf
Deep Learning for Click-Through Rate Estimation,,,,https://www.ijcai.org/proceedings/2021/0636.pdf
Automated Machine Learning on Graphs- A Survey,,,,https://www.ijcai.org/proceedings/2021/0637.pdf
Topic Modelling Meets Deep Neural Networks- A Survey,,,,https://www.ijcai.org/proceedings/2021/0638.pdf
"Cross-Domain Recommendation- Challenges, Progress, and Prospects",,,,https://www.ijcai.org/proceedings/2021/0639.pdf
