title,keywords,group,link,pdf
Hierarchical Graph Traversal for Aggregate k Nearest Neighbors Search in Road Networks (Extended Abstract),,,,https://www.ijcai.org/proceedings/2021/0640.pdf
Defining the Semantics of Abstract Argumentation Frameworks through Logic Programs and Partial Stable Models (Extended Abstract),,,,https://www.ijcai.org/proceedings/2021/0641.pdf
Comparing Weak Admissibility Semantics to their Dung-style Counterparts (Extended Abstract),,,,https://www.ijcai.org/proceedings/2021/0642.pdf
Abstract Cores in Implicit Hitting Set MaxSat Solving (Extended Abstract),,,,https://www.ijcai.org/proceedings/2021/0643.pdf
"Robust Domain Adaptation- Representations, Weights and Inductive Bias (Extended Abstract)",,,,https://www.ijcai.org/proceedings/2021/0644.pdf
Decentralized No-regret Learning Algorithms for Extensive-form Correlated Equilibria (Extended Abstract),,,,https://www.ijcai.org/proceedings/2021/0645.pdf
Weaving a Semantic Web of Credibility Reviews for Explainable Misinformation Detection (Extended Abstract),,,,https://www.ijcai.org/proceedings/2021/0646.pdf
Improved Guarantees and a Multiple-descent Curve for Column Subset Selection and the Nystrom Method (Extended Abstract),,,,https://www.ijcai.org/proceedings/2021/0647.pdf
Mental Models of AI Agents in a Cooperative Game Setting (Extended Abstract),,,,https://www.ijcai.org/proceedings/2021/0648.pdf
Successor-Invariant First-Order Logic on Classes of Bounded Degree (Extended Abstract),,,,https://www.ijcai.org/proceedings/2021/0649.pdf
Deep Drone Acrobatics (Extended Abstract),,,,https://www.ijcai.org/proceedings/2021/0650.pdf
On Sampled Metrics for Item Recommendation (Extended Abstract),,,,https://www.ijcai.org/proceedings/2021/0651.pdf
Revisiting Wedge Sampling for Budgeted Maximum Inner Product Search (Extended Abstract),,,,https://www.ijcai.org/proceedings/2021/0652.pdf
On Learning Sets of Symmetric Elements (Extended Abstract),,,,https://www.ijcai.org/proceedings/2021/0653.pdf
The Moodoo Library- Quantitative Metrics to Model How Teachers Make Use of the Classroom Space by Analysing Indoor Positioning Traces (Extended Abstract),,,,https://www.ijcai.org/proceedings/2021/0654.pdf
Controlling Fairness and Bias in Dynamic Learning-to-Rank (Extended Abstract),,,,https://www.ijcai.org/proceedings/2021/0655.pdf
Unifying Online and Counterfactual Learning to Rank- A Novel Counterfactual Estimator that Effectively Utilizes Online Interventions (Extended Abstract),,,,https://www.ijcai.org/proceedings/2021/0656.pdf
Finding the Hardest Formulas for Resolution (Extended Abstract),,,,https://www.ijcai.org/proceedings/2021/0657.pdf
Exploring the Effects of Goal Setting When Training for Complex Crowdsourcing Tasks (Extended Abstract),,,,https://www.ijcai.org/proceedings/2021/0658.pdf
Beyond Accuracy- Behavioral Testing of NLP Models with Checklist (Extended Abstract),,,,https://www.ijcai.org/proceedings/2021/0659.pdf
Politeness for the Theory of Algebraic Datatypes (Extended Abstract),,,,https://www.ijcai.org/proceedings/2021/0660.pdf
Imprecise Oracles Impose Limits to Predictability in Supervised Learning (Extended Abstract),,,,https://www.ijcai.org/proceedings/2021/0661.pdf
RAFT- Recurrent All-Pairs Field Transforms for Optical Flow (Extended Abstract),,,,https://www.ijcai.org/proceedings/2021/0662.pdf
Open Intent Extraction from Natural Language Interactions (Extended Abstract),,,,https://www.ijcai.org/proceedings/2021/0663.pdf
Speech Recognition Using RFID Tattoos (Extended Abstract),,,,https://www.ijcai.org/proceedings/2021/0664.pdf
Unsupervised Learning of Probably Symmetric Deformable 3D Objects from Images in the Wild (Extended Abstract),,,,https://www.ijcai.org/proceedings/2021/0665.pdf
TAXOGAN- Hierarchical Network Representation Learning via Taxonomy Guided Generative Adversarial Networks (Extended Abstract),,,,https://www.ijcai.org/proceedings/2021/0666.pdf
Semantic Linking Maps for Active Visual Object Search (Extended Abstract),,,,https://www.ijcai.org/proceedings/2021/0667.pdf
Deep Residual Reinforcement Learning (Extended Abstract),,,,https://www.ijcai.org/proceedings/2021/0668.pdf
Greybox Algorithm Configuration,,,,https://www.ijcai.org/proceedings/2021/0669.pdf
Bottleneck Identification to Semantic Segmentation of Industrial 3D Point Cloud Scene via Deep Learning,,,,https://www.ijcai.org/proceedings/2021/0670.pdf
Multi-agent Approach to Resource Allocation in Autonomous Vehicle Fleets,,,,https://www.ijcai.org/proceedings/2021/0671.pdf
Automatic Design of Heuristic Algorithms for Binary Optimization Problems,,,,https://www.ijcai.org/proceedings/2021/0672.pdf
Distributional Metareasoning for Heuristic Search,,,,https://www.ijcai.org/proceedings/2021/0673.pdf
Automated Facilitation Support in Online Forum,,,,https://www.ijcai.org/proceedings/2021/0674.pdf
Safety Analysis of Deep Neural Networks,,,,https://www.ijcai.org/proceedings/2021/0675.pdf
Towards Robust Dynamic Network Embedding,,,,https://www.ijcai.org/proceedings/2021/0676.pdf
An Information-Theoretic Approach on Causal Structure Learning for Heterogeneous Data Characteristics of Real-World Scenarios,,,,https://www.ijcai.org/proceedings/2021/0677.pdf
Robot Manipulation Learning Using Generative Adversarial Imitation Learning,,,,https://www.ijcai.org/proceedings/2021/0678.pdf
Planning and Reinforcement Learning for General-Purpose Service Robots,,,,https://www.ijcai.org/proceedings/2021/0679.pdf
Nash Welfare in the Facility Location Problem,,,,https://www.ijcai.org/proceedings/2021/0680.pdf
Deep Reinforcement Learning with Hierarchical Structures,,,,https://www.ijcai.org/proceedings/2021/0681.pdf
AI for Planning Public Health Interventions,,,,https://www.ijcai.org/proceedings/2021/0682.pdf
Uncertain Time Series Classification,,,,https://www.ijcai.org/proceedings/2021/0683.pdf
Combining Reinforcement Learning and Causal Models for Robotics Applications,,,,https://www.ijcai.org/proceedings/2021/0684.pdf
On the Learnability of Knowledge in Multi-Agent Logics,,,,https://www.ijcai.org/proceedings/2021/0685.pdf
Towards an Explainer-agnostic Conversational XAI,,,,https://www.ijcai.org/proceedings/2021/0686.pdf
Hardware-friendly Deep Learning by Network Quantization and Binarization,,,,https://www.ijcai.org/proceedings/2021/0687.pdf
Modeling Institutions in Socio-Ecosystems,,,,https://www.ijcai.org/proceedings/2021/0688.pdf
Inter-Task Similarity for Lifelong Reinforcement Learning in Heterogeneous Tasks,,,,https://www.ijcai.org/proceedings/2021/0689.pdf
A Human-AI Teaming Approach for Incremental Taxonomy Learning from Text,,,,https://www.ijcai.org/proceedings/2021/0690.pdf
Continual Lifelong Learning for Intelligent Agents,,,,https://www.ijcai.org/proceedings/2021/0691.pdf
Learning from Multimedia Data with Incomplete Information,,,,https://www.ijcai.org/proceedings/2021/0692.pdf
Data Efficient Algorithms and Interpretability Requirements for Personalized Assessment of Taskable AI Systems,,,,https://www.ijcai.org/proceedings/2021/0693.pdf
Adversarial Examples in Physical World,,,,https://www.ijcai.org/proceedings/2021/0694.pdf
Learning and Planning Under Uncertainty for Green Security,,,,https://www.ijcai.org/proceedings/2021/0695.pdf
An Automated Framework for Supporting Data-Governance Rule Compliance in Decentralized MIMO Contexts,,,,https://www.ijcai.org/proceedings/2021/0696.pdf
Self-Adaptive Swarm System (SASS),,,,https://www.ijcai.org/proceedings/2021/0722.pdf
"Anomaly Mining - Past, Present and Future",,,,https://www.ijcai.org/proceedings/2021/0697.pdf
From Computational Social Choice to Digital Democracy,,,,https://www.ijcai.org/proceedings/2021/0698.pdf
Adaptive Experimental Design for Optimizing Combinatorial Structures,,,,https://www.ijcai.org/proceedings/2021/0699.pdf
Intelligent and Learning Agents- Four Investigations,,,,https://www.ijcai.org/proceedings/2021/0700.pdf
Safe Weakly Supervised Learning,,,,https://www.ijcai.org/proceedings/2021/0701.pdf
"Width-Based Algorithms for Common Problems in Control, Planning and Reinforcement Learning",,,,https://www.ijcai.org/proceedings/2021/0702.pdf
Towards a New Generation of Cognitive Diagnosis,,,,https://www.ijcai.org/proceedings/2021/0703.pdf
Alleviating Road Traffic Congestion with Artificial Intelligence,,,,https://www.ijcai.org/proceedings/2021/0704.pdf
Towards Fair and Transparent Algorithmic Systems,,,,https://www.ijcai.org/proceedings/2021/0705.pdf
A Neural Network Auction For Group Decision Making Over a Continuous Space,,,,https://www.ijcai.org/proceedings/2021/0706.pdf
Web Interoperability for Ontology Development and Support with crowd 2.0,,,,https://www.ijcai.org/proceedings/2021/0707.pdf
Skills2Graph- Processing million Job Ads to face the Job Skill Mismatch Problem,,,,https://www.ijcai.org/proceedings/2021/0708.pdf
HIVE- Hierarchical Information Visualization for Explainability,,,,https://www.ijcai.org/proceedings/2021/0709.pdf
ConvLogMiner- A Real-Time Conversational Lifelog Miner,,,,https://www.ijcai.org/proceedings/2021/0710.pdf
InfOCF-Web- An Online Tool for Nonmonotonic Reasoning with Conditionals and Ranking Functions,,,,https://www.ijcai.org/proceedings/2021/0711.pdf
A Compression-Compilation Framework for On-mobile Real-time BERT Applications,,,,https://www.ijcai.org/proceedings/2021/0712.pdf
VisioRed- A Visualisation Tool for Interpretable Predictive Maintenance,,,,https://www.ijcai.org/proceedings/2021/0713.pdf
Connect Multi-Agent Path Finding- Generation and Visualization,,,,https://www.ijcai.org/proceedings/2021/0714.pdf
Towards Fast and Accurate Multi-Person Pose Estimation on Mobile Devices,,,,https://www.ijcai.org/proceedings/2021/0715.pdf
Predictive Analytics for COVID-19 Social Distancing,,,,https://www.ijcai.org/proceedings/2021/0716.pdf
Graph-Augmented Code Summarization in Computational Notebooks,,,,https://www.ijcai.org/proceedings/2021/0717.pdf
Interactive Video Acquisition and Learning System for Motor Assessment of Parkinsons Disease,,,,https://www.ijcai.org/proceedings/2021/0718.pdf
AutoBandit- A Meta Bandit Online Learning System,,,,https://www.ijcai.org/proceedings/2021/0719.pdf
Communication-efficient and Scalable Decentralized Federated Edge Learning,,,,https://www.ijcai.org/proceedings/2021/0720.pdf
IIAS- An Intelligent Insurance Assessment System through Online Real-time Conversation Analysis,,,,https://www.ijcai.org/proceedings/2021/0721.pdf
Self-Adaptive Swarm System (SASS),,,,https://www.ijcai.org/proceedings/2021/0722.pdf
